NC_018554.1	Malus domestica	Malus x domestica mitochondrion, complete genome
CM048777.1	Colletotrichum fioriniae	Colletotrichum fioriniae strain ACFK16 mitochondrion, complete sequence, whole genome shotgun sequence
JANUHL010000102.1	Colletotrichum fioriniae	Colletotrichum fioriniae strain ACFK16 scaffold_102 mitochondrial, whole genome shotgun sequence
ON478160.1	Malus domestica	Malus domestica cultivar Gala mitochondrion, complete genome
MN964891.1	Malus domestica	Malus domestica cultivar Yantai fuji 8 mitochondrion, complete genome
MN398269.1	Tetranychus urticae	Tetranychus urticae isolate PK13 cytochrome oxidase I subunit I gene, partial cds; mitochondrial
FR714868.1	Malus domestica	Malus x domestica mitchondrial complete genome, cultivar Golden delicious
