0	20	20	40.1	100.000	20	1.3	0	0	100	100	Chrysodeixis includens genome assembly, chromosome: 3	Chrysodeixis includens	0	1	20	10236841	10236860
0	20	20	40.1	100.000	20	1.3	0	0	100	100	Chrysodeixis includens genome assembly, chromosome: 4	Chrysodeixis includens	0	1	20	10434651	10434670
0	20	20	40.1	100.000	20	1.3	0	0	100	100	Anopheles gambiae genome assembly, chromosome: 3	Anopheles gambiae	0	1	20	41620271	41620290
0	20	20	40.1	100.000	20	1.3	0	0	100	100	Anopheles marshallii genome assembly, chromosome: 3	Anopheles marshallii	0	1	20	34181455	34181474
0	20	20	40.1	100.000	20	1.3	0	0	100	100	Anopheles coluzzii genome assembly, chromosome: 3	Anopheles coluzzii	0	1	20	41285544	41285563
0	20	20	40.1	100.000	20	1.3	0	0	100	100	Diachrysia chrysitis genome assembly, chromosome: 3	Diachrysia chrysitis	0	1	20	11147221	11147240
0	20	20	40.1	100.000	20	1.3	0	0	100	100	Bombus hypnorum genome assembly, chromosome: 10	Bombus hypnorum	0	1	20	5413389	5413408
0	20	16	32.2	95.000	19	326	0	0	100	100	Bombus hypnorum genome assembly, chromosome: 10	Bombus hypnorum	1	1	20	5401199	5401180
0	20	20	40.1	100.000	20	1.3	0	0	100	100	Ectemnius lituratus genome assembly, chromosome: 12	Ectemnius lituratus	0	1	20	5954198	5954217
0	20	20	40.1	100.000	20	1.3	0	0	100	100	Bombus terrestris genome assembly, chromosome: 1	Bombus terrestris	0	1	20	5568523	5568542
0	20	20	40.1	100.000	20	1.3	0	0	100	100	Bombus pascuorum genome assembly, chromosome: 9	Bombus pascuorum	0	1	20	5488446	5488465
1	20	20	40.1	100.000	20	1.3	0	0	100	100	PREDICTED: Nasonia vitripennis PHD finger protein 12 (LOC100122152), mRNA	Nasonia vitripennis	0	1	20	2692	2711
1	20	20	40.1	100.000	20	1.3	0	0	100	100	Anopheles stephensi strain Indian chromosome 3R	Anopheles stephensi	0	1	20	29460708	29460727
1	20	20	40.1	100.000	20	1.3	0	0	100	100	Anopheles stephensi strain SDA-500 chromosome 3R	Anopheles stephensi	0	1	20	35411129	35411148
1	20	20	40.1	100.000	20	1.3	0	0	100	100	Photobacterium gaetbulicola Gung47 chromosome 2, complete sequence	Photobacterium gaetbulicola Gung47	0	1	20	3655446	3655465
1	20	20	40.1	100.000	20	1.3	0	0	100	100	Aricia agestis genome assembly, chromosome: 1	Aricia agestis	0	1	20	5462146	5462165
1	20	20	40.1	100.000	20	1.3	0	0	100	100	Agriphila geniculea genome assembly, chromosome: 4	Agriphila geniculea	0	1	20	22715442	22715461
1	20	20	40.1	100.000	20	1.3	0	0	100	100	Anopheles nili genome assembly, chromosome: 3	Anopheles nili	0	1	20	7638037	7638056
1	20	20	40.1	100.000	20	1.3	0	0	100	100	Diatraea saccharalis genome assembly, chromosome: 12	Diatraea saccharalis	0	1	20	16309177	16309196
1	20	20	40.1	100.000	20	1.3	0	0	100	100	Anopheles ziemanni genome assembly, chromosome: 2	Anopheles ziemanni	0	1	20	67092521	67092540
1	20	20	40.1	100.000	20	1.3	0	0	100	100	Anopheles darlingi genome assembly, chromosome: 2	Anopheles darlingi	0	1	20	75300804	75300823
2	20	20	40.1	100.000	20	1.3	0	0	100	100	PREDICTED: Vanessa tameamea protein Wnt-1 (LOC113394406), mRNA	Vanessa tameamea	0	1	20	1174	1155
2	20	20	40.1	100.000	20	1.3	0	0	100	100	Prismognathus davidis cheni gene for wingless, partial cds, specimen_voucher: NCHU:Luc1292	Prismognathus davidis cheni	0	1	20	476	457
2	20	20	40.1	100.000	20	1.3	0	0	100	100	Prismognathus davidis nigerrimus gene for wingless, partial cds, specimen_voucher: NCHU:Luc1066	Prismognathus davidis nigerrimus	0	1	20	476	457
2	20	20	40.1	100.000	20	1.3	0	0	100	100	Ceutorhynchus assimilis genome assembly, chromosome: 4	Ceutorhynchus assimilis	0	1	20	47449390	47449371
2	20	20	40.1	100.000	20	1.3	0	0	100	100	Odontolabis cuvera fallaciosa culture AHU:O2 wingless (WG) gene, partial cds	Odontolabis cuvera fallaciosa	0	1	20	485	466
2	20	20	40.1	100.000	20	1.3	0	0	100	100	Odontolabis cuvera fallaciosa culture AHU:O1 wingless (WG) gene, partial cds	Odontolabis cuvera fallaciosa	0	1	20	485	466
2	20	20	40.1	100.000	20	1.3	0	0	100	100	Odontolabis cuvera fallaciosa culture AHU:Od225 wingless (WG) gene, partial cds	Odontolabis cuvera fallaciosa	0	1	20	467	448
2	20	20	40.1	100.000	20	1.3	0	0	100	100	Odontolabis cuvera fallaciosa culture AHU:Od223 wingless (WG) gene, partial cds	Odontolabis cuvera fallaciosa	0	1	20	482	463
2	20	20	40.1	100.000	20	1.3	0	0	100	100	Odontolabis cuvera sinensis culture AHU:Od218 wingless (WG) gene, partial cds	Odontolabis cuvera sinensis	0	1	20	467	448
2	20	20	40.1	100.000	20	1.3	0	0	100	100	Odontolabis cuvera sinensis culture AHU:Od210 wingless (WG) gene, partial cds	Odontolabis cuvera sinensis	0	1	20	482	463
3	20	20	40.1	100.000	20	1.3	0	0	100	100	PREDICTED: Maniola hyperantus protein Wnt-1 (LOC117996552), mRNA	Maniola hyperantus	0	1	20	1151	1132
3	20	20	40.1	100.000	20	1.3	0	0	100	100	PREDICTED: Cryptotermes secundus protein wingless (LOC111861258), mRNA	Cryptotermes secundus	0	1	20	1578	1559
3	20	20	40.1	100.000	20	1.3	0	0	100	100	Aphantopus hyperantus genome assembly, chromosome: 1	Maniola hyperantus	0	1	20	4353264	4353245
3	20	20	40.1	100.000	20	1.3	0	0	100	100	Gnamptogenys continua partial wnt-1 gene for wingless	Gnamptogenys continua	0	1	20	458	439
3	20	20	40.1	100.000	20	1.3	0	0	100	100	Crematogaster auberti partial wnt-1 gene for wingless	Crematogaster auberti	0	1	20	455	436
3	20	20	40.1	100.000	20	1.3	0	0	100	100	PREDICTED: Ceratina calcarata protein Wnt-6-like (LOC108622250), mRNA	Ceratina calcarata	0	1	20	1776	1757
3	20	20	40.1	100.000	20	1.3	0	0	100	100	PREDICTED: Ceratina calcarata protein Wnt-1 (LOC108622300), mRNA	Ceratina calcarata	0	1	20	1511	1492
3	20	20	40.1	100.000	20	1.3	0	0	100	100	PREDICTED: Trichogramma pretiosum protein Wnt-5b-like (LOC106656621), mRNA	Trichogramma pretiosum	0	1	20	1106	1087
3	20	20	40.1	100.000	20	1.3	0	0	100	100	PREDICTED: Spodoptera litura protein Wnt-1 (LOC111352311), mRNA	Spodoptera litura	0	1	20	1172	1153
3	20	20	40.1	100.000	20	1.3	0	0	100	100	Periplaneta americana wingless (Wg) mRNA, complete cds	Periplaneta americana	0	1	20	1302	1283
