29	23	23	46.1	100.000	23	0.054	0	0	88	88	Pinctada fucata isolate ZZ28 cytochrome oxidase subunit I (COI) gene, partial cds; mitochondrial	Pinctada fucata	0	1	23	479	457
29	23	23	46.1	100.000	23	0.054	0	0	88	88	Centrorhynchus aluconis mitochondrion, complete genome	Centrorhynchus aluconis	0	4	26	728	706
30	26	26	52.0	100.000	26	8.78e-04	0	0	100	100	Idiomarina andamanensis strain W-5T chromosome	Idiomarina andamanensis	0	1	26	2079761	2079786
30	26	26	52.0	100.000	26	8.78e-04	0	0	100	100	Microbulbifer sp. GL-2 DNA, complete genome	Microbulbifer sp. GL-2	0	1	26	1487694	1487719
30	26	26	52.0	100.000	26	8.78e-04	0	0	100	100	Irus mitis isolate VT-C495 cytochrome c oxidase subunit I (COX1) gene, partial cds; mitochondrial	Irus mitis	0	1	26	656	631
30	26	26	52.0	100.000	26	8.78e-04	0	0	100	100	Irus macrophylla isolate VT-C494 cytochrome c oxidase subunit I (COX1) gene, partial cds; mitochondrial	Irus macrophylla	0	1	26	656	631
30	23	23	46.1	100.000	23	0.054	0	0	88	88	Halomonas titanicae strain GPM3 chromosome, complete genome	Halomonas titanicae	0	4	26	1588086	1588108
30	23	23	46.1	100.000	23	0.054	0	0	88	88	Halomonas titanicae strain ANRCS81 chromosome, complete genome	Halomonas titanicae	0	4	26	2689914	2689936
30	23	23	46.1	100.000	23	0.054	0	0	88	88	Halomonas sp. PA16-9 chromosome, complete genome	Halomonas sp. PA16-9	0	4	26	2826292	2826314
30	23	23	46.1	100.000	23	0.054	0	0	88	88	Halomonas olivaria TYRC17 DNA, complete genome	Halomonas olivaria	0	4	26	2291420	2291398
30	23	23	46.1	100.000	23	0.054	0	0	88	88	Hypothenemus sp. He65 cytochrome oxidase subunit I (COI) gene, partial cds; mitochondrial	Hypothenemus sp. He65	0	4	26	458	436
30	23	23	46.1	100.000	23	0.054	0	0	88	88	Hypothenemus sp. He12 cytochrome oxidase subunit I (COI) gene, partial cds; mitochondrial	Hypothenemus sp. He12	0	4	26	476	454
31	26	26	52.0	100.000	26	8.78e-04	0	0	100	100	Altigena wui isolate KIZ20060074 cytochrome oxidase subunit I (COI) gene, partial cds; mitochondrial	Altigena wui	0	1	26	611	586
31	26	26	52.0	100.000	26	8.78e-04	0	0	100	100	Pseudoniphargus stocki mitochondrion, complete genome	Pseudoniphargus stocki	0	1	26	4536	4511
31	26	26	52.0	100.000	26	8.78e-04	0	0	100	100	Bufo japonicus mitochondrial DNA, complete genome	Bufo japonicus	0	1	26	8609	8584
31	23	23	46.1	100.000	23	0.054	0	0	88	88	Geotomus sp. FS-2019 mitochondrion, complete genome	Geotomus sp. FS-2019	0	4	26	2107	2085
31	23	23	46.1	100.000	23	0.054	0	0	88	88	Ogadenus brumpti isolate 2 clone Contig 456 mitochondrion, complete genome	Ogadenus brumpti	0	4	26	1917	1895
31	23	23	46.1	100.000	23	0.054	0	0	88	88	Ogadenus brumpti isolate 1 clone Contig 137 mitochondrion, complete genome	Ogadenus brumpti	0	4	26	1919	1897
31	23	23	46.1	100.000	23	0.054	0	0	88	88	Sclerophrys lemairii isolate T2273 voucher AACRG 1052 cytochrome oxidase subunit I (COI) gene, partial cds; mitochondrial	Sclerophrys lemairii	0	4	26	152	130
31	23	23	46.1	100.000	23	0.054	0	0	88	88	Dendrotriton sanctibarbarus voucher MVZ:Herp:263842 cytochrome c oxidase subunit I (cox1) gene, partial cds; tRNA-Ser and tRNA-Asp genes, complete sequence; cytochrome c oxidase subunit II (cox2) gene, complete cds; and tRNA-Lys gene, partial sequence; mitochondrial	Dendrotriton sanctibarbarus	0	4	26	391	369
31	23	23	46.1	100.000	23	0.054	0	0	88	88	Dendropsophus sp. RAE-2014a voucher MPEG 17208 cytochrome oxidase subunit I (COI) gene, partial cds; mitochondrial	Dendropsophus sp. RAE-2014a	0	4	26	35	13
31	23	23	46.1	100.000	23	0.054	0	0	88	88	Calidris temminckii voucher TEST 22 cytochrome oxidase subunit 1 (COI) gene, partial cds; mitochondrial	Calidris temminckii	0	4	26	616	594
32	26	26	52.0	100.000	26	8.78e-04	0	0	100	100	Ixodes holocyclus voucher Q93 cytochrome c oxidase subunit 1 gene, partial cds; mitochondrial	Ixodes holocyclus	0	1	26	662	637
32	26	26	52.0	100.000	26	8.78e-04	0	0	100	100	Ixodes holocyclus voucher Q92 cytochrome c oxidase subunit 1 gene, partial cds; mitochondrial	Ixodes holocyclus	0	1	26	617	592
32	26	26	52.0	100.000	26	8.78e-04	0	0	100	100	Peromyscopsylla hesperomys adelpha isolate FLBPM002 cytochrome c oxidase subunit I (CO1X) gene, partial cds; mitochondrial	Peromyscopsylla hesperomys adelpha	0	1	26	32	7
32	26	26	52.0	100.000	26	8.78e-04	0	0	100	100	Ixodes holocyclus isolate B9b2 mitochondrion, complete genome	Ixodes holocyclus	0	1	26	1945	1920
32	26	26	52.0	100.000	26	8.78e-04	0	0	100	100	Ixodes holocyclus isolate H4 mitochondrion, complete genome	Ixodes holocyclus	0	1	26	1945	1920
32	26	26	52.0	100.000	26	8.78e-04	0	0	100	100	Ixodes holocyclus isolate I7 mitochondrion, complete genome	Ixodes holocyclus	0	1	26	1945	1920
32	26	26	52.0	100.000	26	8.78e-04	0	0	100	100	Oestergrenia digitata cytochrome c oxidase subunit I (COI) gene, partial cds; mitochondrial	Oestergrenia digitata	0	1	26	476	451
32	26	26	52.0	100.000	26	8.78e-04	0	0	100	100	Ixodes holocyclus isolate S4 cytochrome oxidase subunit I (COX1) gene, partial cds; mitochondrial	Ixodes holocyclus	0	1	26	601	576
32	26	26	52.0	100.000	26	8.78e-04	0	0	100	100	Ixodes holocyclus isolate S1 cytochrome oxidase subunit I (COX1) gene, partial cds; mitochondrial	Ixodes holocyclus	0	1	26	601	576
32	26	26	52.0	100.000	26	8.78e-04	0	0	100	100	Ixodes holocyclus isolate S37 cytochrome oxidase subunit I (COX1) gene, partial cds; mitochondrial	Ixodes holocyclus	0	1	26	601	576
33	26	26	52.0	100.000	26	8.78e-04	0	0	100	100	Coregonus artedi isolate NEFC F16-263 mitochondrion, complete genome	Coregonus artedi	0	1	26	6202	6177
33	26	26	52.0	100.000	26	8.78e-04	0	0	100	100	Coregonus artedi isolate NEFC F16-262 mitochondrion, complete genome	Coregonus artedi	0	1	26	6202	6177
33	26	26	52.0	100.000	26	8.78e-04	0	0	100	100	Schizopygopsis malacanthus chengi isolate 3 cytochrome oxidase subunit I (COX1) gene, partial cds; mitochondrial	Schizopygopsis malacanthus chengi	0	1	26	608	583
33	26	26	52.0	100.000	26	8.78e-04	0	0	100	100	Coregonus artedi strain NEFC_F16-524 mitochondrion, complete genome.	Coregonus artedi	0	1	26	6202	6177
33	26	26	52.0	100.000	26	8.78e-04	0	0	100	100	Coregonus artedi voucher NEFC_F16-375 mitochondrion, complete genome.	Coregonus artedi	0	1	26	6202	6177
33	26	26	52.0	100.000	26	8.78e-04	0	0	100	100	Coregonus autumnalis isolate BLM3 COI gene, partial cds; mitochondrial	Coregonus autumnalis	0	1	26	569	544
33	26	26	52.0	100.000	26	8.78e-04	0	0	100	100	Coregonus autumnalis isolate BLM1 COI gene, partial cds; mitochondrial	Coregonus autumnalis	0	1	26	569	544
33	26	26	52.0	100.000	26	8.78e-04	0	0	100	100	Schizopygopsis malacanthus chengi mitochondrion, partial genome	Schizopygopsis malacanthus chengi	0	1	26	6209	6184
33	26	26	52.0	100.000	26	8.78e-04	0	0	100	100	Uca annulipes isolate Ua_H19 cytochrome oxidase subunit I (COI) gene, partial cds; mitochondrial	Austruca annulipes	0	1	26	654	629
33	26	26	52.0	100.000	26	8.78e-04	0	0	100	100	Uca annulipes isolate Ua_H18 cytochrome oxidase subunit I (COI) gene, partial cds; mitochondrial	Austruca annulipes	0	1	26	654	629
34	26	26	52.0	100.000	26	8.78e-04	0	0	100	100	Anserobilharzia brantae isolate atsr_26 cytochrome c oxidase subunit I (COI) gene, partial cds; mitochondrial	Anserobilharzia brantae	0	1	26	593	568
34	26	26	52.0	100.000	26	8.78e-04	0	0	100	100	Anserobilharzia brantae isolate atsr_5 cytochrome c oxidase subunit I (COI) gene, partial cds; mitochondrial	Anserobilharzia brantae	0	1	26	506	481
34	26	26	52.0	100.000	26	8.78e-04	0	0	100	100	Anodontites trapesialis isolate H2445 mitochondrion, partial genome	Anodontites trapesialis	0	1	26	818	843
34	26	26	52.0	100.000	26	8.78e-04	0	0	100	100	Aculamprotula tientsinensis mitochondrion, complete genome	Aculamprotula tientsinensis	0	1	26	821	846
34	26	26	52.0	100.000	26	8.78e-04	0	0	100	100	Anserobilharzia brantae voucher MSB:Para:14741 cytochrome oxidase subunit I (cox1) gene, partial cds; mitochondrial	Anserobilharzia brantae	0	1	26	632	607
34	26	26	52.0	100.000	26	8.78e-04	0	0	100	100	Anserobilharzia brantae voucher USC-VECPAR_H.Ferte cytochrome oxidase subunit I (cox1) gene, partial cds; mitochondrial	Anserobilharzia brantae	0	1	26	632	607
34	26	26	52.0	100.000	26	8.78e-04	0	0	100	100	Anserobilharzia brantae voucher USC-VECPAR_H.Ferte cytochrome oxidase subunit I (cox1) gene, partial cds; mitochondrial	Anserobilharzia brantae	0	1	26	632	607
34	26	26	52.0	100.000	26	8.78e-04	0	0	100	100	Anserobilharzia brantae voucher MSB:Para:7985 cytochrome oxidase subunit I (cox1) gene, partial cds; mitochondrial	Anserobilharzia brantae	0	1	26	632	607
34	26	26	52.0	100.000	26	8.78e-04	0	0	100	100	Anserobilharzia brantae voucher MSB:Para:7984 cytochrome oxidase subunit I (cox1) gene, partial cds; mitochondrial	Anserobilharzia brantae	0	1	26	632	607
34	26	26	52.0	100.000	26	8.78e-04	0	0	100	100	Anenterotrema stunkardi isolate VT7167 cytochrome c oxidase subunit I (COX1) gene, partial cds; mitochondrial	Anenterotrema stunkardi	0	1	26	635	610
35	26	26	52.0	100.000	26	8.78e-04	0	0	100	100	Hermerius prionoides mitochondrion, partial genome	Hermerius prionoides	0	1	26	2165	2140
35	26	26	52.0	100.000	26	8.78e-04	0	0	100	100	Sarcophaga rohdendorfi isolate SRUM26/6 cytochrome oxidase subunit I (COI) gene, partial cds; tRNA-Leu (trnL) gene, complete sequence; and cytochrome oxidase subunit II (COII) gene, complete cds; mitochondrial	Sarcophaga rohdendorfi	0	1	26	731	706
35	26	26	52.0	100.000	26	8.78e-04	0	0	100	100	Epeorus sp. XL-2019 mitochondrion, partial genome	Epeorus sp. XL-2019	0	1	26	2209	2184
35	26	26	52.0	100.000	26	8.78e-04	0	0	100	100	Tinaminyssus melloi mitochondrion, complete genome	Tinaminyssus melloi	0	1	26	5606	5581
35	26	26	52.0	100.000	26	8.78e-04	0	0	100	100	Cryptotympana facialis kum21 mitochondrial COX1 gene for cytochrome c oxidase subunit 1, partial cds	Cryptotympana facialis	0	1	26	417	392
35	26	26	52.0	100.000	26	8.78e-04	0	0	100	100	Cryptotympana facialis kum18 mitochondrial COX1 gene for cytochrome c oxidase subunit 1, partial cds	Cryptotympana facialis	0	1	26	417	392
35	26	26	52.0	100.000	26	8.78e-04	0	0	100	100	Cryptotympana facialis kum36 mitochondrial COX1 gene for cytochrome c oxidase subunit 1, partial cds	Cryptotympana facialis	0	1	26	417	392
35	26	26	52.0	100.000	26	8.78e-04	0	0	100	100	Cryptotympana facialis kum33 mitochondrial COX1 gene for cytochrome c oxidase subunit 1, partial cds	Cryptotympana facialis	0	1	26	417	392
35	26	26	52.0	100.000	26	8.78e-04	0	0	100	100	Cania heppneri cytochrome oxidase subunit 1 (COI) gene, partial cds; mitochondrial	Cania heppneri	0	1	26	722	697
35	26	26	52.0	100.000	26	8.78e-04	0	0	100	100	Gracilariopsis longissima cytochrome c oxidase subunit I (cox1) gene, partial cds; mitochondrial	Gracilariopsis longissima	0	1	26	665	640
36	26	26	52.0	100.000	26	8.78e-04	0	0	100	100	Dendrochiton gothicus voucher CSUF_DNA_DE_de1499 mitochondrion, complete genome	Dendrochiton gothicus	0	1	26	722	697
36	26	26	52.0	100.000	26	8.78e-04	0	0	100	100	Cicadella viridis mitochondrion, complete genome	Cicadella viridis	0	1	26	2069	2044
36	26	26	52.0	100.000	26	8.78e-04	0	0	100	100	Ctenodrilus serratus cytochrome oxidase subunit I gene, partial cds; mitochondrial	Ctenodrilus serratus	0	1	26	632	607
36	26	26	52.0	100.000	26	8.78e-04	0	0	100	100	Brachidontes exustus mitochondrion, complete genome	Brachidontes exustus	0	1	26	728	703
36	26	26	52.0	100.000	26	8.78e-04	0	0	100	100	Neoseiulus subsolidus voucher X-BIOTU Ph-12 cytochrome c oxidase subunit I (COX1) gene, partial cds; mitochondrial	Neoseiulus subsolidus	0	1	26	653	628
36	26	26	52.0	100.000	26	8.78e-04	0	0	100	100	Semisulcospira libertina voucher KUZ-Z0396 cytochrome c oxidase subunit I (COI) gene, partial cds; mitochondrial	Semisulcospira libertina	0	1	26	404	379
36	26	26	52.0	100.000	26	8.78e-04	0	0	100	100	Semisulcospira libertina voucher KUZ-Z081 cytochrome c oxidase subunit I (COI) gene, partial cds; mitochondrial	Semisulcospira libertina	0	1	26	404	379
36	26	26	52.0	100.000	26	8.78e-04	0	0	100	100	Semisulcospira libertina voucher KUZ-Z0427 cytochrome c oxidase subunit I (COI) gene, partial cds; mitochondrial	Semisulcospira libertina	0	1	26	404	379
36	26	26	52.0	100.000	26	8.78e-04	0	0	100	100	Semisulcospira libertina voucher KUZ-Z0426 cytochrome c oxidase subunit I (COI) gene, partial cds; mitochondrial	Semisulcospira libertina	0	1	26	404	379
36	26	26	52.0	100.000	26	8.78e-04	0	0	100	100	Semisulcospira libertina voucher KUZ-Z0425 cytochrome c oxidase subunit I (COI) gene, partial cds; mitochondrial	Semisulcospira libertina	0	1	26	404	379
37	26	26	52.0	100.000	26	8.78e-04	0	0	100	100	Callinectes sapidus voucher USNM:1408399 cytochrome oxidase subunit I (COI) gene, partial cds; mitochondrial	Callinectes sapidus	0	1	26	48	23
37	26	26	52.0	100.000	26	8.78e-04	0	0	100	100	Oithona dissimilis mitochondrial COI gene for cytochrome c oxidase I, partial cds, haplotype: OdS-CO1-04	Oithona dissimilis	0	1	26	681	656
37	26	26	52.0	100.000	26	8.78e-04	0	0	100	100	Oithona dissimilis mitochondrial COI gene for cytochrome c oxidase I, partial cds, haplotype: OdS-CO1-01	Oithona dissimilis	0	1	26	681	656
37	26	26	52.0	100.000	26	8.78e-04	0	0	100	100	Scutovertex sculptus isolate SsRF1 cytochrome oxidase subunit I (COI) gene, partial cds; mitochondrial	Scutovertex sculptus	0	1	26	685	660
37	23	23	46.1	100.000	23	0.054	0	0	88	88	Acronicta aceris genome assembly, organelle: mitochondrion	Acronicta aceris	0	4	26	10626	10648
37	23	23	46.1	100.000	23	0.054	0	0	88	88	Kibramoa guapa voucher CAS ENT 9068480 cytochrome oxidase subunit I (COI) gene, partial cds; mitochondrial	Kibramoa guapa	0	4	26	686	664
37	23	23	46.1	100.000	23	0.054	0	0	88	88	Kibramoa guapa voucher CAS ENT 9068482 cytochrome oxidase subunit I (COI) gene, partial cds; mitochondrial	Kibramoa guapa	0	4	26	686	664
37	23	23	46.1	100.000	23	0.054	0	0	88	88	Kibramoa guapa voucher SDSU G003 cytochrome oxidase subunit I (COI) gene, partial cds; mitochondrial	Kibramoa guapa	0	4	26	683	661
37	23	23	46.1	100.000	23	0.054	0	0	88	88	Capillaria sp. cat-2018 mitochondrion, complete genome	Capillaria sp. cat-2018	0	4	26	731	709
37	23	23	46.1	100.000	23	0.054	0	0	88	88	Chrysoritis dicksoni voucher AH98Y698 cytochrome c oxidase subunit I (COX1) gene, partial cds; mitochondrial	Chrysoritis dicksoni	0	4	26	659	637
38	26	26	52.0	100.000	26	8.78e-04	0	0	100	100	Eustrongylides sp. 60 XF-2009 isolate PL-MA2 cytochrome oxidase subunit I (COI) gene, partial cds; mitochondrial	Eustrongylides sp. 60 XF-2009	0	1	26	29	4
38	23	23	46.1	100.000	23	0.054	0	0	88	88	Zygocotyle lunata isolate BH-Cidade Administrativa cytochrome c oxidase subunit I (COX1) gene, partial cds; mitochondrial	Zygocotyle lunata	0	4	26	593	571
38	23	23	46.1	100.000	23	0.054	0	0	88	88	Gyrodactylus salmonis isolate Washington Olympic Peninsula cytochrome c oxidase subunit I (COX1) gene, complete cds; mitochondrial	Gyrodactylus salmonis	0	4	26	725	703
38	23	23	46.1	100.000	23	0.054	0	0	88	88	Gyrodactylus salmonis isolate Pensylvania Lamar cytochrome c oxidase subunit I (COX1) gene, complete cds; mitochondrial	Gyrodactylus salmonis	0	4	26	725	703
38	23	23	46.1	100.000	23	0.054	0	0	88	88	Gyrodactylus salmonis isolate Montana Big Springs 3 cytochrome c oxidase subunit I (COX1) gene, complete cds; mitochondrial	Gyrodactylus salmonis	0	4	26	725	703
38	23	23	46.1	100.000	23	0.054	0	0	88	88	Gyrodactylus salmonis isolate Washington Ford cytochrome c oxidase subunit I (COX1) gene, complete cds; mitochondrial	Gyrodactylus salmonis	0	4	26	725	703
38	23	23	46.1	100.000	23	0.054	0	0	88	88	Gyrodactylus salmonis isolate Montana Giant Springs cytochrome c oxidase subunit I (COX1) gene, complete cds; mitochondrial	Gyrodactylus salmonis	0	4	26	725	703
38	23	23	46.1	100.000	23	0.054	0	0	88	88	Gyrodactylus salmonis isolate Montana Big Springs 5 cytochrome c oxidase subunit I (COX1) gene, complete cds; mitochondrial	Gyrodactylus salmonis	0	4	26	725	703
38	23	23	46.1	100.000	23	0.054	0	0	88	88	Gyrodactylus salmonis isolate Washington Naselle cytochrome c oxidase subunit I (COX1) gene, complete cds; mitochondrial	Gyrodactylus salmonis	0	4	26	725	703
38	23	23	46.1	100.000	23	0.054	0	0	88	88	Etheostoma flabellare isolate NEFC F17-080 mitochondrion, complete genome.	Etheostoma flabellare	0	1	23	6203	6181
39	26	26	52.0	100.000	26	8.78e-04	0	0	100	100	Himasthla quissetensis haplotype HQ_HAP36 cytochrome oxidase subunit I (COI) gene, partial cds; mitochondrial	Himasthla quissetensis	0	1	26	401	376
39	26	26	52.0	100.000	26	8.78e-04	0	0	100	100	Himasthla quissetensis haplotype HQ_HAP35 cytochrome oxidase subunit I (COI) gene, partial cds; mitochondrial	Himasthla quissetensis	0	1	26	401	376
39	26	26	52.0	100.000	26	8.78e-04	0	0	100	100	Funaria hygrometrica cytochrome oxidase subunit I (cox1) gene, complete cds; mitochondrial	Funaria hygrometrica	0	1	26	743	718
39	26	26	52.0	100.000	26	8.78e-04	0	0	100	100	Funaria hygrometrica cytochrome c oxidase subunit 1 (cox1) mRNA, complete cds; mitochondrial	Funaria hygrometrica	0	1	26	743	718
39	23	23	46.1	100.000	23	0.054	0	0	88	88	Metorchis sp. 40.2 YVT-2017 cytochrome oxidase subunit I (cox1) gene, partial cds; mitochondrial	Metorchis sp. 40.2 YVT-2017	0	4	26	617	595
39	23	23	46.1	100.000	23	0.054	0	0	88	88	Metorchis sp. 40.1 YVT-2017 cytochrome oxidase subunit I (cox1) gene, partial cds; mitochondrial	Metorchis sp. 40.1 YVT-2017	0	4	26	617	595
39	23	23	46.1	100.000	23	0.054	0	0	88	88	Metorchis ussuriensis isolate 28.1 cytochrome oxidase subunit I (CO1) gene, partial cds; mitochondrial	Metorchis ussuriensis	0	4	26	617	595
39	23	23	46.1	100.000	23	0.054	0	0	88	88	Metorchis ussuriensis isolate 16.3 cytochrome oxidase subunit I (CO1) gene, partial cds; mitochondrial	Metorchis ussuriensis	0	4	26	617	595
39	23	23	46.1	100.000	23	0.054	0	0	88	88	Metorchis ussuriensis isolate 16.2 cytochrome oxidase subunit I (CO1) gene, partial cds; mitochondrial	Metorchis ussuriensis	0	4	26	617	595
39	23	23	46.1	100.000	23	0.054	0	0	88	88	Metorchis ussuriensis isolate 16.1 cytochrome oxidase subunit I (CO1) gene, partial cds; mitochondrial	Metorchis ussuriensis	0	4	26	617	595
40	26	26	52.0	100.000	26	8.78e-04	0	0	100	100	Pinnularia borealis complex sp. voucher REU16_05_11 cytochrome oxidase subunit 1 (COI) gene, partial cds; mitochondrial	Pinnularia borealis complex sp.	0	1	26	533	508
40	26	26	52.0	100.000	26	8.78e-04	0	0	100	100	Pinnularia borealis complex sp. voucher REU16_05_15 cytochrome oxidase subunit 1 (COI) gene, partial cds; mitochondrial	Pinnularia borealis complex sp.	0	1	26	503	478
40	26	26	52.0	100.000	26	8.78e-04	0	0	100	100	Mesorhizobium sp. Pch-S chromosome, complete genome	Mesorhizobium sp. Pch-S	0	1	26	323561	323586
40	26	26	52.0	100.000	26	8.78e-04	0	0	100	100	Meira miltonrushii cytochrome c oxidase (FA14DRAFT_180408), partial mRNA	Meira miltonrushii	0	1	26	731	706
40	26	26	52.0	100.000	26	8.78e-04	0	0	100	100	Ceraceosorus guamensis cytochrome oxidase subunit 1 (IE81DRAFT_335859), partial mRNA	Ceraceosorus guamensis	0	1	26	206	181
40	26	26	52.0	100.000	26	8.78e-04	0	0	100	100	Microplana sparsa isolate 353Z235 cytochrome oxidase subunit I (Cox1) gene, partial cds; mitochondrial	Microplana sparsa	0	1	26	503	478
40	26	26	52.0	100.000	26	8.78e-04	0	0	100	100	Pseudochrobactrum sp. XF203 chromosome, complete genome	Pseudochrobactrum sp. XF203	0	1	26	854480	854455
40	26	26	52.0	100.000	26	8.78e-04	0	0	100	100	Pseudochrobactrum sp. Wa41.01b-1 chromosome, complete genome	Pseudochrobactrum sp. Wa41.01b-1	0	1	26	3169685	3169660
40	26	26	52.0	100.000	26	8.78e-04	0	0	100	100	Hepatozoon sp. mitochondrion, complete genome	Hepatozoon sp.	0	1	26	899	874
40	26	26	52.0	100.000	26	8.78e-04	0	0	100	100	Hepatozoon sp. mitochondrion, complete genome	Hepatozoon sp.	0	1	26	899	874
41	26	26	52.0	100.000	26	8.78e-04	0	0	100	100	Porrhomma sp. 24 SL-2010 voucher IZCL74 cytochrome oxidase subunit I (COI) gene, partial cds; mitochondrial	Porrhomma sp. 24 SL-2010	0	1	26	449	424
41	23	23	46.1	100.000	23	0.054	0	0	88	88	Nablistes heterochroma cytochrome oxidase subunit I (COI) gene, partial cds; mitochondrial	Nablistes heterochroma	0	1	23	617	595
41	23	23	46.1	100.000	23	0.054	0	0	88	88	Onchocerca lupi isolate OL1 cytochrome c oxidase subunit gene, partial cds; mitochondrial	Onchocerca lupi	0	1	23	489	467
41	23	23	46.1	100.000	23	0.054	0	0	88	88	Onchocerca lupi voucher MNHN:88YTF cytochrome c oxidase subunit I (COX1) gene, partial cds; mitochondrial	Onchocerca lupi	0	1	23	451	429
41	23	23	46.1	100.000	23	0.054	0	0	88	88	Onchocerca lupi voucher MNHN:88YTE cytochrome c oxidase subunit I (COX1) gene, partial cds; mitochondrial	Onchocerca lupi	0	1	23	451	429
41	23	23	46.1	100.000	23	0.054	0	0	88	88	Onchocerca lupi voucher MNHN:88YTD cytochrome c oxidase subunit I (COX1) gene, partial cds; mitochondrial	Onchocerca lupi	0	1	23	451	429
41	23	23	46.1	100.000	23	0.054	0	0	88	88	Onchocerca lupi isolate 110/14 cytochrome c oxidase subunit gene, partial cds; mitochondrial	Onchocerca lupi	0	1	23	489	467
41	23	23	46.1	100.000	23	0.054	0	0	88	88	Onchocerca lupi isolate 132/14 cytochrome c oxidase subunit gene, partial cds; mitochondrial	Onchocerca lupi	0	1	23	489	467
41	23	23	46.1	100.000	23	0.054	0	0	88	88	Onchocerca lupi isolate OL001 cytochrome c oxidase subunit I (COX1) gene, partial cds; mitochondrial	Onchocerca lupi	0	1	23	493	471
41	23	23	46.1	100.000	23	0.054	0	0	88	88	Onchocerca lupi isolate Adult cytochrome c oxidase subunit I (COX1) gene, partial cds; mitochondrial	Onchocerca lupi	0	1	23	503	481
42	26	26	52.0	100.000	26	8.78e-04	0	0	100	100	Portunus pelagicus voucher MPk29 cytochrome c oxidase subunit I (COXI) gene, complete cds; mitochondrial	Portunus pelagicus	0	1	26	725	700
42	26	26	52.0	100.000	26	8.78e-04	0	0	100	100	Portunus pelagicus voucher MPk28 cytochrome c oxidase subunit I (COXI) gene, complete cds; mitochondrial	Portunus pelagicus	0	1	26	725	700
42	26	26	52.0	100.000	26	8.78e-04	0	0	100	100	Portunus pelagicus voucher MPk15 cytochrome c oxidase subunit I (COXI) gene, complete cds; mitochondrial	Portunus pelagicus	0	1	26	725	700
42	26	26	52.0	100.000	26	8.78e-04	0	0	100	100	Portunus pelagicus voucher EPk29_1 cytochrome c oxidase subunit I (COXI) gene, complete cds; mitochondrial	Portunus pelagicus	0	1	26	725	700
42	26	26	52.0	100.000	26	8.78e-04	0	0	100	100	Portunus pelagicus voucher EPk29_2 cytochrome c oxidase subunit I (COXI) gene, complete cds; mitochondrial	Portunus pelagicus	0	1	26	725	700
42	26	26	52.0	100.000	26	8.78e-04	0	0	100	100	Portunus pelagicus voucher EPk28 cytochrome c oxidase subunit I (COXI) gene, complete cds; mitochondrial	Portunus pelagicus	0	1	26	725	700
42	26	26	52.0	100.000	26	8.78e-04	0	0	100	100	Portunus pelagicus voucher EPk15 cytochrome c oxidase subunit I (COXI) gene, complete cds; mitochondrial	Portunus pelagicus	0	1	26	725	700
42	26	26	52.0	100.000	26	8.78e-04	0	0	100	100	Portunus pelagicus isolate 15 cytochrome oxidase subunit I gene, partial cds; mitochondrial	Portunus pelagicus	0	1	26	547	572
42	26	26	52.0	100.000	26	8.78e-04	0	0	100	100	Portunus pelagicus isolate 14 cytochrome oxidase subunit I gene, partial cds; mitochondrial	Portunus pelagicus	0	1	26	547	572
42	26	26	52.0	100.000	26	8.78e-04	0	0	100	100	Portunus pelagicus isolate 12 cytochrome oxidase subunit I gene, partial cds; mitochondrial	Portunus pelagicus	0	1	26	547	572
43	26	26	52.0	100.000	26	8.78e-04	0	0	100	100	Abia sp. 'Zaraea' CSCSHymM02109 cytochrome oxidase subunit 1 gene, partial cds; mitochondrial	Abia sp. 'Zaraea' CSCSHymM02109	0	1	26	478	453
43	26	26	52.0	100.000	26	8.78e-04	0	0	100	100	Bembidion rebli voucher OSAC:DRMaddison DNA3119 cytochrome oxidase subunit 1 gene, partial cds; mitochondrial	Bembidion rebli	0	1	26	684	659
43	26	26	52.0	100.000	26	8.78e-04	0	0	100	100	Brachymna tenuis mitochondrion, complete genome	Brachymna tenuis	0	1	26	2140	2115
43	26	26	52.0	100.000	26	8.78e-04	0	0	100	100	Euscopus rufipes mitochondrion, complete genome	Euscopus rufipes	0	1	26	2101	2076
43	26	26	52.0	100.000	26	8.78e-04	0	0	100	100	Anapodisma miramae voucher TAMUIC-IGC-OR356 cytochrome c oxidase subunit I (COI) gene, partial cds; mitochondrial	Anapodisma miramae	0	1	26	722	697
43	26	26	52.0	100.000	26	8.78e-04	0	0	100	100	Gecarcoidea natalis isolate GN2 mitochondrion, partial genome	Gecarcoidea natalis	0	1	26	725	700
43	26	26	52.0	100.000	26	8.78e-04	0	0	100	100	Gecarcoidea natalis isolate GN2 mitochondrion	Gecarcoidea natalis	0	1	26	725	700
43	26	26	52.0	100.000	26	8.78e-04	0	0	100	100	Ceroplastes cirripediformis voucher S5-212 cytochrome oxidase subunit I (COI) gene, partial cds; mitochondrial	Ceroplastes cirripediformis	0	1	26	626	601
43	26	26	52.0	100.000	26	8.78e-04	0	0	100	100	Ceroplastes cirripediformis voucher S4-188 cytochrome oxidase subunit I (COI) gene, partial cds; mitochondrial	Ceroplastes cirripediformis	0	1	26	626	601
43	26	26	52.0	100.000	26	8.78e-04	0	0	100	100	Ceroplastes cirripediformis voucher S4-113 cytochrome oxidase subunit I (COI) gene, partial cds; mitochondrial	Ceroplastes cirripediformis	0	1	26	626	601
44	26	26	52.0	100.000	26	8.78e-04	0	0	100	100	Halioglobus maricola strain IMCC14385 chromosome, complete genome	Halioglobus maricola	0	1	26	34457	34432
44	26	26	52.0	100.000	26	8.78e-04	0	0	100	100	Glutamicibacter sp. ZJUTW chromosome, complete genome	Glutamicibacter sp. ZJUTW	0	1	26	1783038	1783063
44	26	26	52.0	100.000	26	8.78e-04	0	0	100	100	Corynebacterium endometrii strain LMM-1653 chromosome, complete genome	Corynebacterium endometrii	0	1	26	2010302	2010327
44	26	26	52.0	100.000	26	8.78e-04	0	0	100	100	Glutamicibacter nicotianae strain OTC-16 chromosome, complete genome	Glutamicibacter nicotianae	0	1	26	1819589	1819614
44	26	26	52.0	100.000	26	8.78e-04	0	0	100	100	Gammarus stagnarius voucher IZCASIA1545 cytochrome oxidase subunit I (COI) gene, COI-cytochrome oxidase subunit I allele, partial cds; mitochondrial	Gammarus stagnarius	0	1	26	77	52
44	26	26	52.0	100.000	26	8.78e-04	0	0	100	100	Gammarus stagnarius voucher IZCASIA1338 cytochrome oxidase subunit I (COI) gene, COI-cytochrome oxidase subunit I allele, partial cds; mitochondrial	Gammarus stagnarius	0	1	26	77	52
