73	26	26	52.0	100.000	26	8.78e-04	0	0	100	100	Rhinogobius similis haplotype Hap_1 cytochrome c oxidase subunit I (COI) gene, partial cds; mitochondrial	Rhinogobius similis	0	1	26	683	658
73	26	26	52.0	100.000	26	8.78e-04	0	0	100	100	Bothriechis bicolor voucher UTA R-39413 cytochrome c oxidase subunit I (COX1) gene, complete cds; mitochondrial	Bothriechis bicolor	0	1	26	731	706
73	26	26	52.0	100.000	26	8.78e-04	0	0	100	100	Poropuntius normani voucher SUC0325.15 cytochrome c oxidase subunit I (COI) gene, complete cds; mitochondrial	Poropuntius normani	0	1	26	731	706
74	26	26	52.0	100.000	26	8.78e-04	0	0	100	100	Leptastacus aff. laticaudatus 2 SR-2019 voucher SR_679 cytochrome oxidase subunit 1 (COI) gene, partial cds; mitochondrial	Leptastacus aff. laticaudatus 2 SR-2019	0	1	26	701	676
74	26	26	52.0	100.000	26	8.78e-04	0	0	100	100	Atelopus senex voucher MVZ 164816 cytochrome oxidase subunit I (COI) gene, partial cds; mitochondrial	Atelopus senex	0	1	26	47	22
74	26	26	52.0	100.000	26	8.78e-04	0	0	100	100	Culicoides punctatus mitochondrial cox1, tRNA-Leu, cox2 genes, partial cds and complete sequence, clone: Kag13_2	Culicoides punctatus	0	1	26	483	458
74	26	26	52.0	100.000	26	8.78e-04	0	0	100	100	Culicoides punctatus mitochondrial cox1, tRNA-Leu, cox2 genes, partial cds and complete sequence, clone: Kag13_1	Culicoides punctatus	0	1	26	483	458
74	26	26	52.0	100.000	26	8.78e-04	0	0	100	100	Atelopus varius haplotype varius.16 cytochrome oxidase subunit I (COI) gene, partial cds; mitochondrial	Atelopus varius	0	1	26	68	43
74	26	26	52.0	100.000	26	8.78e-04	0	0	100	100	Dugong dugon mitochondrion, complete genome	Dugong dugon	0	1	26	6058	6033
74	26	26	52.0	100.000	26	8.78e-04	0	0	100	100	Dugong dugon complete mitochondrial genome	Dugong dugon	0	1	26	6057	6032
74	23	23	46.1	100.000	23	0.054	0	0	88	88	Elateridae sp. 1 ACP-2013 mitochondrion, partial genome	Elateridae sp. 1 ACP-2013	0	4	26	1013	991
74	23	23	46.1	100.000	23	0.054	0	0	88	88	Lachnaia cylindrica mitochondrion	Lachnaia cylindrica	0	4	26	2137	2115
74	23	23	46.1	100.000	23	0.054	0	0	88	88	Amerodectes gracilis voucher UMMZ BMOC 08-0515-104 AD1174 cytochrome oxidase subunit I (COX1) gene, partial cds; mitochondrial	Amerodectes gracilis	0	4	26	685	663
75	26	26	52.0	100.000	26	8.78e-04	0	0	100	100	Tetrahymena rostrata isolate TRAUS mitochondrion	Tetrahymena rostrata	0	1	26	37446	37421
75	26	26	52.0	100.000	26	8.78e-04	0	0	100	100	Tetrahymena rostrata isolate TRAUS mitochondrion, complete genome	Tetrahymena rostrata	0	1	26	38875	38850
75	26	26	52.0	100.000	26	8.78e-04	0	0	100	100	Kudoa iwatai NSMT:Pr262 COX1 gene for cytochrome c oxidase subunit 1, partial cds	Kudoa iwatai	0	1	26	601	576
75	26	26	52.0	100.000	26	8.78e-04	0	0	100	100	Tetrahymena rostrata clone TRAUS cytochrome oxidase subunit 1 (COI) gene, complete cds; mitochondrial	Tetrahymena rostrata	0	1	26	1184	1159
75	26	26	52.0	100.000	26	8.78e-04	0	0	100	100	Tetrahymena rostrata isolate TRAUS cytochrome c oxidase subunit 1 (COI) gene, partial cds; mitochondrial	Tetrahymena rostrata	0	1	26	989	964
75	26	26	52.0	100.000	26	8.78e-04	0	0	100	100	Tetrahymena rostrata clone TR1016 cytochrome oxidase subunit 1 (COX1) gene, partial cds; mitochondrial	Tetrahymena rostrata	0	1	26	1137	1112
75	26	26	52.0	100.000	26	8.78e-04	0	0	100	100	Kudoa iwatai mitochondrial DNA, complete genome, isolate: KI-001	Kudoa iwatai	0	1	26	11476	11501
75	26	26	52.0	100.000	26	8.78e-04	0	0	100	100	Tropostreptus droides voucher NHMD:621802 mitochondrion, complete genome	Tropostreptus droides	0	1	26	1986	1961
75	26	26	52.0	100.000	26	8.78e-04	0	0	100	100	Aedes taylori voucher Ae. taylori T1 cytochrome oxidase subunit I (COI) gene, partial cds; mitochondrial	Aedes taylori	0	1	26	107	82
75	23	23	46.1	100.000	23	0.054	0	0	88	88	Colletotrichum fructicola uncharacterized protein (CGMCC3_g17603), partial mRNA	Colletotrichum fructicola	0	4	26	118	140
76	26	26	52.0	100.000	26	8.78e-04	0	0	100	100	Hua pallens strain DLN20160030 cytochrome c oxidase subunit I (COI) gene, partial cds; mitochondrial	Hua pallens	0	1	26	611	586
76	26	26	52.0	100.000	26	8.78e-04	0	0	100	100	Hua pallens strain DLN20160027 cytochrome c oxidase subunit I (COI) gene, partial cds; mitochondrial	Hua pallens	0	1	26	617	592
76	26	26	52.0	100.000	26	8.78e-04	0	0	100	100	Xingyurella xingyuarum voucher MBM280259 clone 1788 cytochrome oxidase subunit I (COI) gene, partial cds; mitochondrial	Xingyurella xingyuarum	0	1	26	716	691
76	26	26	52.0	100.000	26	8.78e-04	0	0	100	100	Xingyurella xingyuarum voucher MBM280259 clone 1787 cytochrome oxidase subunit I (COI) gene, partial cds; mitochondrial	Xingyurella xingyuarum	0	1	26	716	691
76	26	26	52.0	100.000	26	8.78e-04	0	0	100	100	Macrothele taiwanensis voucher TWTPENG126 cytochrome oxidase subunit I (COI) gene, partial cds; mitochondrial	Macrothele taiwanensis	0	1	26	325	300
76	26	26	52.0	100.000	26	8.78e-04	0	0	100	100	Macrothele taiwanensis voucher TWTPENG122 cytochrome oxidase subunit I (COI) gene, partial cds; mitochondrial	Macrothele taiwanensis	0	1	26	325	300
76	26	26	52.0	100.000	26	8.78e-04	0	0	100	100	Trisidos kiyonoi isolate H6 cytochrome c oxidase subunit I (COX1) gene, partial cds; mitochondrial	Trisidos kiyonoi	0	1	26	194	169
76	26	26	52.0	100.000	26	8.78e-04	0	0	100	100	Mycomya fimbriata mitochondrion, partial genome	Mycomya fimbriata	0	1	26	11092	11067
76	26	26	52.0	100.000	26	8.78e-04	0	0	100	100	Scolopendra japonica voucher CMMI 20181030004 cytochrome c oxidase subunit I (COX1) gene, partial cds; mitochondrial	Scolopendra japonica	0	1	26	686	661
76	26	26	52.0	100.000	26	8.78e-04	0	0	100	100	Pseudoalteromonas rubra strain S4059 chromosome 1, complete sequence	Pseudoalteromonas rubra	0	1	26	347034	347009
77	26	26	52.0	100.000	26	8.78e-04	0	0	100	100	Pomphorhynchus sp. TP-2012 mitochondrion, complete genome	Pomphorhynchus sp. TP-2012	0	1	26	722	697
77	26	24	48.1	96.154	25	0.014	0	0	100	100	Onchobothrium antarcticum isolate 388 cytochrome c oxidase subunit I (COX1) gene, partial cds; mitochondrial	Onchobothrium antarcticum	1	1	26	39	14
77	26	24	48.1	96.154	25	0.014	0	0	100	100	Onchobothrium antarcticum isolate 463 cytochrome c oxidase subunit I (COX1) gene, partial cds; mitochondrial	Onchobothrium antarcticum	1	1	26	39	14
77	23	23	46.1	100.000	23	0.054	0	0	88	88	Plethodon shenandoah haplotype 32 mitochondrion, partial genome	Plethodon shenandoah	0	4	26	5850	5828
77	23	23	46.1	100.000	23	0.054	0	0	88	88	Plethodon shenandoah haplotype 31 mitochondrion, partial genome	Plethodon shenandoah	0	4	26	5849	5827
77	23	23	46.1	100.000	23	0.054	0	0	88	88	Plethodon shenandoah haplotype 30 mitochondrion, partial genome	Plethodon shenandoah	0	4	26	5849	5827
77	23	23	46.1	100.000	23	0.054	0	0	88	88	Plethodon shenandoah haplotype 29 mitochondrion, partial genome	Plethodon shenandoah	0	4	26	5849	5827
77	23	23	46.1	100.000	23	0.054	0	0	88	88	Plethodon shenandoah haplotype 28 mitochondrion, partial genome	Plethodon shenandoah	0	4	26	5849	5827
77	23	23	46.1	100.000	23	0.054	0	0	88	88	Plethodon shenandoah haplotype 27 mitochondrion, partial genome	Plethodon shenandoah	0	4	26	5849	5827
77	23	23	46.1	100.000	23	0.054	0	0	88	88	Plethodon shenandoah haplotype 26 mitochondrion, partial genome	Plethodon shenandoah	0	4	26	5849	5827
78	26	26	52.0	100.000	26	8.78e-04	0	0	100	100	Kineobactrum salinum strain M2 chromosome, complete genome	Kineobactrum salinum	0	1	26	2279310	2279285
78	26	26	52.0	100.000	26	8.78e-04	0	0	100	100	Mesorhizobium sp. PAMC28654 chromosome, complete genome	Mesorhizobium sp. PAMC28654	0	1	26	704341	704366
78	26	26	52.0	100.000	26	8.78e-04	0	0	100	100	Mesorhizobium sp. INR15 plasmid unnamed1	Mesorhizobium sp. INR15	0	1	26	55623	55648
78	23	23	46.1	100.000	23	0.054	0	0	88	88	Etheostoma trisella mitochondrion, complete genome	Etheostoma trisella	0	1	23	6204	6182
78	23	23	46.1	100.000	23	0.054	0	0	88	88	Sarcocystis sp. OaEsp5 isolate OS25 cytochrome c oxidase subunit I gene, partial cds; mitochondrial	Sarcocystis sp. OaEsp5	0	4	26	695	673
78	23	23	46.1	100.000	23	0.054	0	0	88	88	Globodera pallida isolate CD2706a clone 2 cytochrome c oxidase subunit I (COI) gene, partial cds; mitochondrial	Globodera pallida	0	4	26	47	25
78	23	23	46.1	100.000	23	0.054	0	0	88	88	Globodera pallida isolate CD2706a clone 1 cytochrome c oxidase subunit I (COI) gene, partial cds; mitochondrial	Globodera pallida	0	4	26	47	25
78	23	23	46.1	100.000	23	0.054	0	0	88	88	Nitrosococcus wardiae strain D1FHS chromosome, complete genome	Nitrosococcus wardiae	0	4	26	781695	781717
78	23	23	46.1	100.000	23	0.054	0	0	88	88	Pylaiella washingtoniensis mitochondrial cox1 gene for cytochrome oxidase subunit 1, partial cds	Pylaiella washingtoniensis	0	4	26	513	491
78	23	23	46.1	100.000	23	0.054	0	0	88	88	Plagiorchis elegans isolate AF197 cytochrome c oxidase subunit I (COX1) gene, partial cds; mitochondrial	Plagiorchis elegans	0	1	23	638	616
79	26	26	52.0	100.000	26	8.78e-04	0	0	100	100	Monodonta labio isolate LSGB_A_037 cytochrome c oxidase subunit I (COI) gene, partial cds; mitochondrial	Monodonta labio	0	1	26	353	328
79	26	26	52.0	100.000	26	8.78e-04	0	0	100	100	Monodonta labio isolate LSGB_A_036 cytochrome c oxidase subunit I (COI) gene, partial cds; mitochondrial	Monodonta labio	0	1	26	353	328
79	26	26	52.0	100.000	26	8.78e-04	0	0	100	100	Monodonta labio isolate LSGB_A_035 cytochrome c oxidase subunit I (COI) gene, partial cds; mitochondrial	Monodonta labio	0	1	26	353	328
79	26	26	52.0	100.000	26	8.78e-04	0	0	100	100	Monodonta labio isolate ZH22 cytochrome oxidase subunit I gene, partial cds; mitochondrial	Monodonta labio	0	1	26	385	360
79	26	26	52.0	100.000	26	8.78e-04	0	0	100	100	Monodonta labio isolate ZH21 cytochrome oxidase subunit I gene, partial cds; mitochondrial	Monodonta labio	0	1	26	385	360
79	26	26	52.0	100.000	26	8.78e-04	0	0	100	100	Monodonta labio isolate ZH20 cytochrome oxidase subunit I gene, partial cds; mitochondrial	Monodonta labio	0	1	26	385	360
79	26	26	52.0	100.000	26	8.78e-04	0	0	100	100	Monodonta labio isolate ZH19 cytochrome oxidase subunit I gene, partial cds; mitochondrial	Monodonta labio	0	1	26	385	360
79	26	26	52.0	100.000	26	8.78e-04	0	0	100	100	Monodonta labio isolate ZH18 cytochrome oxidase subunit I gene, partial cds; mitochondrial	Monodonta labio	0	1	26	385	360
79	26	26	52.0	100.000	26	8.78e-04	0	0	100	100	Monodonta labio isolate ZH17 cytochrome oxidase subunit I gene, partial cds; mitochondrial	Monodonta labio	0	1	26	385	360
79	26	26	52.0	100.000	26	8.78e-04	0	0	100	100	Monodonta labio isolate ZH14 cytochrome oxidase subunit I gene, partial cds; mitochondrial	Monodonta labio	0	1	26	385	360
80	26	26	52.0	100.000	26	8.78e-04	0	0	100	100	Sphingobium sp. RSMS chromosome 1, complete sequence	Sphingobium sp. RSMS	0	1	26	659286	659261
80	26	26	52.0	100.000	26	8.78e-04	0	0	100	100	Nanorana yunnanensis mitochondrion, partial genome	Nanorana yunnanensis	0	1	26	13149	13124
80	26	26	52.0	100.000	26	8.78e-04	0	0	100	100	Sinorhizobium fredii USDA 257, complete genome	Sinorhizobium fredii USDA 257	0	1	26	675008	674983
80	23	19	38.2	95.652	22	13	0	0	100	88	Sinorhizobium fredii USDA 257, complete genome	Sinorhizobium fredii USDA 257	1	4	26	5345235	5345213
80	23	23	46.1	100.000	23	0.054	0	0	88	88	Mesorhizobium japonicum strain R7AstarV2 chromosome, complete genome	Mesorhizobium japonicum	0	4	26	5024544	5024566
80	23	23	46.1	100.000	23	0.054	0	0	88	88	Mesorhizobium japonicum strain R7ANSstar chromosome, complete genome	Mesorhizobium japonicum	0	4	26	5024551	5024573
80	23	23	46.1	100.000	23	0.054	0	0	88	88	Mesorhizobium japonicum strain R7Astar chromosome, complete genome	Mesorhizobium japonicum	0	4	26	5024551	5024573
80	23	23	46.1	100.000	23	0.054	0	0	88	88	Mesorhizobium japonicum R7A chromosome, complete genome	Mesorhizobium japonicum R7A	0	4	26	5024551	5024573
80	23	23	46.1	100.000	23	0.054	0	0	88	88	Rhizobium rhizoryzae strain DSM 29514 chromosome, complete genome	Rhizobium rhizoryzae	0	4	26	58081	58103
80	23	23	46.1	100.000	23	0.054	0	0	88	88	Mesorhizobium japonicum R7A chromosome, complete genome	Mesorhizobium japonicum R7A	0	4	26	5024142	5024164
80	23	23	46.1	100.000	23	0.054	0	0	88	88	Labrenzia sp. THAF35 chromosome, complete genome	Labrenzia sp. THAF35	0	4	26	147552	147574
81	26	26	52.0	100.000	26	8.78e-04	0	0	100	100	Chirocentrus nudus mitochondrial DNA, complete genome	Chirocentrus nudus	0	1	26	6186	6161
81	26	26	52.0	100.000	26	8.78e-04	0	0	100	100	Nothobranchius ugandensis cytochrome c oxidase subunit I (coi) gene, complete cds; mitochondrial	Nothobranchius ugandensis	0	1	26	731	706
81	26	26	52.0	100.000	26	8.78e-04	0	0	100	100	Nothobranchius nubaensis mitochondrion, complete genome	Nothobranchius nubaensis	0	1	26	6894	6869
81	26	26	52.0	100.000	26	8.78e-04	0	0	100	100	Isophya major isolate BCiplak-Turkiye mitochondrion, complete genome	Isophya major	0	1	26	2147	2122
81	26	26	52.0	100.000	26	8.78e-04	0	0	100	100	Salmo ischchan gegarkuni isolate sevan4 mitochondrion, complete genome	Salmo ischchan gegarkuni	0	1	26	6205	6180
81	26	26	52.0	100.000	26	8.78e-04	0	0	100	100	Salmo ischchan isolate Li4 mitochondrion, complete genome	Salmo ischchan	0	1	26	6205	6180
81	26	26	52.0	100.000	26	8.78e-04	0	0	100	100	Protobothrops mangshanensis mitochondrion, complete genome	Protobothrops mangshanensis	0	1	26	7136	7111
81	26	26	52.0	100.000	26	8.78e-04	0	0	100	100	Couesius plumbeus mitochondrial DNA, complete genome	Couesius plumbeus	0	1	26	6216	6191
81	26	26	52.0	100.000	26	8.78e-04	0	0	100	100	Alpheus nr. amblyonyx HDBG-2014 voucher ULLZ6618 cytochrome oxidase subunit 1 (COI) gene, partial cds; mitochondrial	Alpheus nr. amblyonyx HDBG-2014	0	1	26	48	23
81	26	26	52.0	100.000	26	8.78e-04	0	0	100	100	Nibea coibor mitochondrion, complete genome	Nibea coibor	0	1	26	6223	6198
82	26	26	52.0	100.000	26	8.78e-04	0	0	100	100	Bison priscus isolate PH225 voucher F4095 mitochondrion, complete genome	Bison priscus	0	1	26	6055	6030
82	26	26	52.0	100.000	26	8.78e-04	0	0	100	100	Bison priscus isolate JK502JK537 mitochondrion, partial genome	Bison priscus	0	1	26	6423	6398
82	26	26	52.0	100.000	26	8.78e-04	0	0	100	100	Bison priscus isolate PH229 voucher F4090 mitochondrion, complete genome	Bison priscus	0	1	26	6055	6030
82	26	26	52.0	100.000	26	8.78e-04	0	0	100	100	Bison priscus isolate PH200 voucher F2519 mitochondrion, complete genome	Bison priscus	0	1	26	6055	6030
82	26	26	52.0	100.000	26	8.78e-04	0	0	100	100	Bison priscus isolate PH230 voucher F4089 mitochondrion, complete genome	Bison priscus	0	1	26	6055	6030
82	26	26	52.0	100.000	26	8.78e-04	0	0	100	100	Bison priscus isolate PH214 voucher F3941 mitochondrion, complete genome	Bison priscus	0	1	26	6055	6030
82	26	26	52.0	100.000	26	8.78e-04	0	0	100	100	Bison priscus isolate PH205 voucher F3006 mitochondrion, complete genome	Bison priscus	0	1	26	6055	6030
82	26	26	52.0	100.000	26	8.78e-04	0	0	100	100	Bos grunniens mitochondrion, complete genome	Bos grunniens	0	1	26	6949	6924
82	26	26	52.0	100.000	26	8.78e-04	0	0	100	100	Bos grunniens voucher SERON20190410 mitochondrion, complete genome	Bos grunniens	0	1	26	6952	6927
82	26	26	52.0	100.000	26	8.78e-04	0	0	100	100	Bos grunniens voucher Y78335935 mitochondrion, complete genome	Bos grunniens	0	1	26	6951	6926
83	26	26	52.0	100.000	26	8.78e-04	0	0	100	100	Parafavella greenlandica isolate Arc12 cytochrome c oxidase subunit 1 (COI) gene, partial cds; mitochondrial	Parafavella greenlandica	0	1	26	348	323
83	26	26	52.0	100.000	26	8.78e-04	0	0	100	100	Parafavella greenlandica isolate Arc11 cytochrome c oxidase subunit 1 (COI) gene, partial cds; mitochondrial	Parafavella greenlandica	0	1	26	348	323
83	23	23	46.1	100.000	23	0.054	0	0	88	88	Himasthla quissetensis haplotype HQ_HAP36 cytochrome oxidase subunit I (COI) gene, partial cds; mitochondrial	Himasthla quissetensis	0	4	26	398	376
83	23	23	46.1	100.000	23	0.054	0	0	88	88	Himasthla quissetensis haplotype HQ_HAP35 cytochrome oxidase subunit I (COI) gene, partial cds; mitochondrial	Himasthla quissetensis	0	4	26	398	376
83	23	23	46.1	100.000	23	0.054	0	0	88	88	Metanophrys sinensis isolate FXP09052901 cytochrome oxidase subunit I (COI) gene, partial cds; mitochondrial	Metanophrys sinensis	0	1	23	887	865
83	23	23	46.1	100.000	23	0.054	0	0	88	88	Miamiensis avidus isolate FXP09050602 cytochrome oxidase subunit I (COI) gene, partial cds; mitochondrial	Miamiensis avidus	0	1	23	890	868
83	23	23	46.1	100.000	23	0.054	0	0	88	88	Pleuronema cf. setigerum isolate PHB08111303 cytochrome oxidase subunit I (COI) gene, partial cds; mitochondrial	Pleuronema cf. setigerum	0	1	23	890	868
83	23	23	46.1	100.000	23	0.054	0	0	88	88	Metorchis sp. 40.2 YVT-2017 cytochrome oxidase subunit I (cox1) gene, partial cds; mitochondrial	Metorchis sp. 40.2 YVT-2017	0	4	26	617	595
83	23	23	46.1	100.000	23	0.054	0	0	88	88	Metorchis sp. 40.1 YVT-2017 cytochrome oxidase subunit I (cox1) gene, partial cds; mitochondrial	Metorchis sp. 40.1 YVT-2017	0	4	26	617	595
83	23	23	46.1	100.000	23	0.054	0	0	88	88	Metorchis ussuriensis isolate 28.1 cytochrome oxidase subunit I (CO1) gene, partial cds; mitochondrial	Metorchis ussuriensis	0	4	26	617	595
84	26	26	52.0	100.000	26	8.78e-04	0	0	100	100	Podargus strigoides voucher ANWC B55782 mitochondrion, partial genome	Podargus strigoides	0	1	26	6278	6253
84	26	26	52.0	100.000	26	8.78e-04	0	0	100	100	Ptyas dhumnades mitochondrion, complete genome	Ptyas dhumnades	0	1	26	6910	6885
84	26	26	52.0	100.000	26	8.78e-04	0	0	100	100	Suncus murinus isolate JA6361 cytochrome oxidase subunit 1 (COX1) gene, complete cds; mitochondrial	Suncus murinus	0	1	26	731	706
84	26	26	52.0	100.000	26	8.78e-04	0	0	100	100	Suncus murinus isolate MM4416 cytochrome oxidase subunit 1 (COX1) gene, complete cds; mitochondrial	Suncus murinus	0	1	26	731	706
84	26	26	52.0	100.000	26	8.78e-04	0	0	100	100	Suncus murinus isolate MM4413 cytochrome oxidase subunit 1 (COX1) gene, complete cds; mitochondrial	Suncus murinus	0	1	26	731	706
84	26	26	52.0	100.000	26	8.78e-04	0	0	100	100	Suncus murinus isolate IN3847 cytochrome oxidase subunit 1 (COX1) gene, complete cds; mitochondrial	Suncus murinus	0	1	26	731	706
84	26	26	52.0	100.000	26	8.78e-04	0	0	100	100	Suncus murinus isolate IN3844 cytochrome oxidase subunit 1 (COX1) gene, complete cds; mitochondrial	Suncus murinus	0	1	26	731	706
84	26	26	52.0	100.000	26	8.78e-04	0	0	100	100	Suncus murinus isolate MM3831 cytochrome oxidase subunit 1 (COX1) gene, complete cds; mitochondrial	Suncus murinus	0	1	26	731	706
84	26	26	52.0	100.000	26	8.78e-04	0	0	100	100	Suncus murinus isolate MM3828 cytochrome oxidase subunit 1 (COX1) gene, complete cds; mitochondrial	Suncus murinus	0	1	26	731	706
84	26	26	52.0	100.000	26	8.78e-04	0	0	100	100	Suncus murinus isolate SL3800 cytochrome oxidase subunit 1 (COX1) gene, complete cds; mitochondrial	Suncus murinus	0	1	26	731	706
85	26	26	52.0	100.000	26	8.78e-04	0	0	100	100	Trioza erytreae isolate TE-ETH mitochondrion, complete genome	Trioza erytreae	0	1	26	719	694
85	26	26	52.0	100.000	26	8.78e-04	0	0	100	100	Trioza erytreae isolate TE-UG mitochondrion, complete genome	Trioza erytreae	0	1	26	719	694
85	26	26	52.0	100.000	26	8.78e-04	0	0	100	100	Trachys auricollis mitochondrion, complete genome	Trachys auricollis	0	1	26	2140	2115
85	26	26	52.0	100.000	26	8.78e-04	0	0	100	100	Parabathynellidae sp. (Pilbara) 5 EM-2019 haplotype 31 cytochrome c oxidase subunit 1 (CO1) gene, partial cds; mitochondrial	Parabathynellidae sp. (Pilbara) 5 EM-2019	0	1	26	479	454
85	26	26	52.0	100.000	26	8.78e-04	0	0	100	100	Plesiodema pinetella voucher AMNH:PBI 00343031 cytochrome c oxidase subunit I (COI) gene, partial cds; mitochondrial	Plesiodema pinetella	0	1	26	654	629
85	26	26	52.0	100.000	26	8.78e-04	0	0	100	100	Phylus melanocephalus voucher AMNH:PBI 00341033 cytochrome c oxidase subunit I (COI) gene, partial cds; mitochondrial	Phylus melanocephalus	0	1	26	660	635
85	26	26	52.0	100.000	26	8.78e-04	0	0	100	100	Paraleptastacus espinulatus voucher DP_117 cytochrome oxidase subunit 1 (COI) gene, partial cds; mitochondrial	Paraleptastacus espinulatus	0	1	26	686	661
85	26	26	52.0	100.000	26	8.78e-04	0	0	100	100	Hua rotundata strain DLN20170181 cytochrome c oxidase subunit I (COI) gene, partial cds; mitochondrial	Hua rotundata	0	1	26	617	592
85	26	26	52.0	100.000	26	8.78e-04	0	0	100	100	Gelidium adriaticum voucher SL6 cytochrome c oxidase subunit I (cox1) gene, partial cds; mitochondrial	Gelidium adriaticum	0	1	26	656	631
85	26	26	52.0	100.000	26	8.78e-04	0	0	100	100	Laodelphax striatellus haplotype B46 mitochondrion, complete genome	Laodelphax striatellus	0	1	26	2114	2089
86	26	26	52.0	100.000	26	8.78e-04	0	0	100	100	Parafavella gigantea isolate Kor10 cytochrome c oxidase subunit 1 (COI) gene, partial cds; mitochondrial	Parafavella gigantea	0	1	26	348	323
86	26	26	52.0	100.000	26	8.78e-04	0	0	100	100	Parafavella gigantea isolate Kor09 cytochrome c oxidase subunit 1 (COI) gene, partial cds; mitochondrial	Parafavella gigantea	0	1	26	348	323
86	26	26	52.0	100.000	26	8.78e-04	0	0	100	100	Parafavella gigantea isolate Kor08 cytochrome c oxidase subunit 1 (COI) gene, partial cds; mitochondrial	Parafavella gigantea	0	1	26	348	323
86	26	26	52.0	100.000	26	8.78e-04	0	0	100	100	Parafavella gigantea isolate Kor07 cytochrome c oxidase subunit 1 (COI) gene, partial cds; mitochondrial	Parafavella gigantea	0	1	26	348	323
86	26	26	52.0	100.000	26	8.78e-04	0	0	100	100	Parafavella gigantea isolate Kor06 cytochrome c oxidase subunit 1 (COI) gene, partial cds; mitochondrial	Parafavella gigantea	0	1	26	348	323
86	26	26	52.0	100.000	26	8.78e-04	0	0	100	100	Parafavella gigantea isolate Kor05 cytochrome c oxidase subunit 1 (COI) gene, partial cds; mitochondrial	Parafavella gigantea	0	1	26	348	323
86	26	26	52.0	100.000	26	8.78e-04	0	0	100	100	Parafavella gigantea isolate Kor04 cytochrome c oxidase subunit 1 (COI) gene, partial cds; mitochondrial	Parafavella gigantea	0	1	26	348	323
86	26	26	52.0	100.000	26	8.78e-04	0	0	100	100	Parafavella gigantea isolate Kor03 cytochrome c oxidase subunit 1 (COI) gene, partial cds; mitochondrial	Parafavella gigantea	0	1	26	348	323
86	26	26	52.0	100.000	26	8.78e-04	0	0	100	100	Parafavella gigantea isolate Kor02 cytochrome c oxidase subunit 1 (COI) gene, partial cds; mitochondrial	Parafavella gigantea	0	1	26	348	323
86	26	26	52.0	100.000	26	8.78e-04	0	0	100	100	Parafavella gigantea isolate Kor01 cytochrome c oxidase subunit 1 (COI) gene, partial cds; mitochondrial	Parafavella gigantea	0	1	26	348	323
87	26	26	52.0	100.000	26	8.78e-04	0	0	100	100	Austinograea rodriguezensis isolate Ar_3 cytochrome c oxidase subunit 1 gene, partial cds; mitochondrial	Austinograea rodriguezensis	0	1	26	639	614
87	26	26	52.0	100.000	26	8.78e-04	0	0	100	100	Austinograea rodriguezensis isolate Ar_9 cytochrome c oxidase subunit 1 gene, partial cds; mitochondrial	Austinograea rodriguezensis	0	1	26	639	614
87	26	26	52.0	100.000	26	8.78e-04	0	0	100	100	Austinograea rodriguezensis isolate Ar_8 cytochrome c oxidase subunit 1 gene, partial cds; mitochondrial	Austinograea rodriguezensis	0	1	26	639	614
87	26	26	52.0	100.000	26	8.78e-04	0	0	100	100	Austinograea rodriguezensis isolate Ar_7 cytochrome c oxidase subunit 1 gene, partial cds; mitochondrial	Austinograea rodriguezensis	0	1	26	639	614
87	26	26	52.0	100.000	26	8.78e-04	0	0	100	100	Austinograea rodriguezensis isolate Ar_5 cytochrome c oxidase subunit 1 gene, partial cds; mitochondrial	Austinograea rodriguezensis	0	1	26	639	614
87	26	26	52.0	100.000	26	8.78e-04	0	0	100	100	Austinograea rodriguezensis isolate Ar_4 cytochrome c oxidase subunit 1 gene, partial cds; mitochondrial	Austinograea rodriguezensis	0	1	26	639	614
87	26	26	52.0	100.000	26	8.78e-04	0	0	100	100	Austinograea rodriguezensis isolate Ar_2 cytochrome c oxidase subunit 1 gene, partial cds; mitochondrial	Austinograea rodriguezensis	0	1	26	639	614
87	26	26	52.0	100.000	26	8.78e-04	0	0	100	100	Austinograea rodriguezensis isolate Ar_15 cytochrome c oxidase subunit 1 gene, partial cds; mitochondrial	Austinograea rodriguezensis	0	1	26	639	614
87	26	26	52.0	100.000	26	8.78e-04	0	0	100	100	Austinograea rodriguezensis isolate Ar_14 cytochrome c oxidase subunit 1 gene, partial cds; mitochondrial	Austinograea rodriguezensis	0	1	26	639	614
87	26	26	52.0	100.000	26	8.78e-04	0	0	100	100	Austinograea rodriguezensis isolate Ar_13 cytochrome c oxidase subunit 1 gene, partial cds; mitochondrial	Austinograea rodriguezensis	0	1	26	639	614
88	26	26	52.0	100.000	26	8.78e-04	0	0	100	100	Campephilus guatemalensis voucher MHNG 1934.028 mitochondrion, complete genome	Campephilus guatemalensis	0	1	26	6140	6115
88	26	26	52.0	100.000	26	8.78e-04	0	0	100	100	Phocoena dioptrica isolate 981 mitochondrion, complete genome	Phocoena dioptrica	0	1	26	6118	6093
88	26	26	52.0	100.000	26	8.78e-04	0	0	100	100	Phocoena dioptrica isolate 7014 mitochondrion, complete genome	Phocoena dioptrica	0	1	26	6118	6093
88	26	26	52.0	100.000	26	8.78e-04	0	0	100	100	Campephilus melanoleucos isolate W37 cytochrome oxidase subunit I (CO1) gene, partial cds; mitochondrial	Campephilus melanoleucos	0	1	26	681	656
88	26	26	52.0	100.000	26	8.78e-04	0	0	100	100	Campephilus magellanicus voucher MACN-Or-ct 705 cytochrome oxidase subunit 1 (COI) gene, partial cds; mitochondrial	Campephilus magellanicus	0	1	26	681	656
88	26	26	52.0	100.000	26	8.78e-04	0	0	100	100	Campephilus magellanicus voucher MACN-Or-ct 618 cytochrome oxidase subunit 1 (COI) gene, partial cds; mitochondrial	Campephilus magellanicus	0	1	26	681	656
88	26	26	52.0	100.000	26	8.78e-04	0	0	100	100	Campephilus pollens voucher LSU 8360 cytochrome oxidase subunit 1 (CO1) gene, partial cds; mitochondrial	Campephilus pollens	0	1	26	725	700
88	26	26	52.0	100.000	26	8.78e-04	0	0	100	100	Campephilus melanoleucos cytochrome oxidase subunit I (COI) gene, partial cds; mitochondrial	Campephilus melanoleucos	0	1	26	734	709
88	23	23	46.1	100.000	23	0.054	0	0	88	88	Bradyrhizobium daqingense strain CCBAU 15774 chromosome, complete genome	Bradyrhizobium daqingense	0	1	23	4486133	4486155
88	20	20	40.1	100.000	20	3.3	0	0	88	77	Bradyrhizobium daqingense strain CCBAU 15774 chromosome, complete genome	Bradyrhizobium daqingense	0	1	20	292876	292895
