0	26	26	52.0	100.000	26	8.78e-04	0	0	100	100	Thorius troglodytes voucher IBH:22597 cytochrome c oxidase subunit I (cox1) gene, partial cds; tRNA-Ser and tRNA-Asp genes, complete sequence; cytochrome c oxidase subunit II (cox2) gene, complete cds; and tRNA-Lys gene, partial sequence; mitochondrial	Thorius troglodytes	0	1	26	398	373
0	26	26	52.0	100.000	26	8.78e-04	0	0	100	100	Gigantactis vanhoeffeni mitochondrial DNA, complete genome	Gigantactis vanhoeffeni	0	1	26	6178	6153
0	23	23	46.1	100.000	23	0.054	0	0	88	88	Eocanthecona thomsoni mitochondrion, complete genome	Eocanthecona thomsoni	0	4	26	2149	2127
0	23	23	46.1	100.000	23	0.054	0	0	88	88	Proasellus escolai genome assembly, organelle: mitochondrion	Proasellus escolai	0	4	26	8503	8481
0	23	23	46.1	100.000	23	0.054	0	0	88	88	Amerodectes cf. dumetellae/tiaris LGAP60_AC22_3059 isolate 3059 cytochrome c oxidase subunit I (COX1) gene, partial cds; mitochondrial	Amerodectes cf. dumetellae/tiaris LGAP60_AC22_3059	0	1	23	440	418
0	23	23	46.1	100.000	23	0.054	0	0	88	88	Crenicichla multispinosa voucher GF15-252 cytochrome oxidase subunit 1 (COI) gene, partial cds; mitochondrial	Crenicichla multispinosa	0	4	26	695	673
0	23	23	46.1	100.000	23	0.054	0	0	88	88	Crenicichla multispinosa voucher GFSU14-325 cytochrome oxidase subunit 1 (COI) gene, partial cds; mitochondrial	Crenicichla multispinosa	0	4	26	695	673
0	23	23	46.1	100.000	23	0.054	0	0	88	88	Crenicichla multispinosa voucher SU08-184 cytochrome oxidase subunit 1 (COI) gene, partial cds; mitochondrial	Crenicichla multispinosa	0	4	26	695	673
0	23	23	46.1	100.000	23	0.054	0	0	88	88	Crenicichla multispinosa voucher GFSU14-251 cytochrome oxidase subunit 1 (COI) gene, partial cds; mitochondrial	Crenicichla multispinosa	0	4	26	695	673
0	23	23	46.1	100.000	23	0.054	0	0	88	88	Crenicichla multispinosa voucher GFSU14-250 cytochrome oxidase subunit 1 (COI) gene, partial cds; mitochondrial	Crenicichla multispinosa	0	4	26	695	673
1	26	26	52.0	100.000	26	8.78e-04	0	0	100	100	Exoglossum maxillingua mitochondrial DNA, complete genome, except for D-loop	Exoglossum maxillingua	0	1	26	6201	6176
1	26	26	52.0	100.000	26	8.78e-04	0	0	100	100	Coscinasterias muricata strain WA-N2 cytochrome oxidase subunit I (CO1) gene, partial cds; mitochondrial gene for mitochondrial product	Coscinasterias muricata	0	1	26	446	421
1	26	26	52.0	100.000	26	8.78e-04	0	0	100	100	Coscinasterias muricata strain WA-G2 cytochrome oxidase subunit I (CO1) gene, partial cds; mitochondrial gene for mitochondrial product	Coscinasterias muricata	0	1	26	453	428
1	26	26	52.0	100.000	26	8.78e-04	0	0	100	100	Coscinasterias muricata strain SA-NM cytochrome oxidase subunit I (CO1) gene, partial cds; mitochondrial gene for mitochondrial product	Coscinasterias muricata	0	1	26	452	427
1	23	23	46.1	100.000	23	0.054	0	0	88	88	Agrobacterium sp. CGMCC 11546 chromosome 2, complete sequence	Agrobacterium sp. CGMCC 11546	0	1	23	533493	533515
1	23	23	46.1	100.000	23	0.054	0	0	96	88	Proteobacteria bacterium isolate PRO20 chromosome	Pseudomonadota bacterium	0	1	23	47249	47271
1	18	18	36.2	100.000	18	52	0	0	96	69	Proteobacteria bacterium isolate PRO20 chromosome	Pseudomonadota bacterium	0	8	25	556769	556786
1	23	23	46.1	100.000	23	0.054	0	0	88	88	Actinomadura verrucosospora strain NRRL:B18236 chromosome	Actinomadura verrucosospora	0	1	23	9543147	9543169
1	23	23	46.1	100.000	23	0.054	0	0	88	88	Actinomadura verrucosospora strain NRRL:B18236 chromosome	Actinomadura verrucosospora	0	1	23	9387883	9387861
1	23	19	38.2	95.652	22	13	0	0	88	88	Actinomadura verrucosospora strain NRRL:B18236 chromosome	Actinomadura verrucosospora	1	1	23	8970802	8970780
1	23	23	46.1	100.000	23	0.054	0	0	88	88	Pseudomonas umsongensis strain CY-1 chromosome, complete genome	Pseudomonas umsongensis	0	1	23	5927289	5927311
1	23	23	46.1	100.000	23	0.054	0	0	88	88	Bradyrhizobium sp. CCBAU 051011 chromosome, complete genome	Bradyrhizobium sp. CCBAU 051011	0	1	23	6119461	6119483
1	23	23	46.1	100.000	23	0.054	0	0	88	88	Ensifer adhaerens strain Corn53 chromosome, complete genome	Ensifer adhaerens	0	1	23	690959	690981
2	26	26	52.0	100.000	26	8.78e-04	0	0	100	100	Pseudomonas sp. CC6-YY-74, complete genome	Pseudomonas sp. CC6-YY-74	0	1	26	1212569	1212594
2	26	26	52.0	100.000	26	8.78e-04	0	0	100	100	Bordetella flabilis strain AU10664 chromosome, complete genome	Bordetella flabilis	0	1	26	2393675	2393700
2	26	18	36.2	92.308	24	52	0	0	100	100	Bordetella flabilis strain AU10664 chromosome, complete genome	Bordetella flabilis	2	1	26	179652	179627
2	26	18	36.2	92.308	24	52	0	0	100	100	Bordetella flabilis strain AU10664 chromosome, complete genome	Bordetella flabilis	2	1	26	4321904	4321879
2	26	26	52.0	100.000	26	8.78e-04	0	0	100	100	Haloplanus sp. GDY1 chromosome, complete genome	Haloplanus sp. GDY1	0	1	26	1973553	1973578
2	26	26	52.0	100.000	26	8.78e-04	0	0	100	100	Salinarchaeum laminariae strain R26 chromosome	Salinarchaeum laminariae	0	1	26	2418464	2418489
2	26	26	52.0	100.000	26	8.78e-04	0	0	100	100	Rhizobium sp. C104 plasmid pRSpC104e, complete sequence	Rhizobium sp. C104	0	1	26	60920	60895
2	26	26	52.0	100.000	26	8.78e-04	0	0	100	100	Rhizobium leguminosarum bv. trifolii WSM2304 plasmid pRLG201, complete sequence	Rhizobium leguminosarum bv. trifolii WSM2304	0	1	26	875050	875075
2	23	23	46.1	100.000	23	0.054	0	0	88	88	Paraglaciecola mesophila strain GPM4 chromosome, complete genome	Paraglaciecola mesophila	0	4	26	3103677	3103655
2	23	23	46.1	100.000	23	0.054	0	0	88	88	Sphingomonas suaedae strain XS-10 chromosome, complete genome	Sphingomonas suaedae	0	4	26	1896314	1896292
2	23	23	46.1	100.000	23	0.054	0	0	88	88	Halostella pelagica strain DL-M4 chromosome, complete genome	Halostella pelagica	0	4	26	2239267	2239245
2	23	19	38.2	95.652	22	13	0	0	88	88	Halostella pelagica strain DL-M4 chromosome, complete genome	Halostella pelagica	1	4	26	2132839	2132861
2	23	23	46.1	100.000	23	0.054	0	0	88	88	Paucimonas lemoignei strain NCTC10937 genome assembly, chromosome: 1	Paucimonas lemoignei	0	4	26	72488	72466
3	26	26	52.0	100.000	26	8.78e-04	0	0	100	100	Sicus ferrugineus genome assembly, chromosome: X	Sicus ferrugineus	0	1	26	5514758	5514783
3	26	26	52.0	100.000	26	8.78e-04	0	0	100	100	TPA_asm: Pogonomyrmex occidentalis mitochondrion sequence	Pogonomyrmex occidentalis	0	1	26	21316	21341
3	26	26	52.0	100.000	26	8.78e-04	0	0	100	100	TPA_asm: Pogonomyrmex occidentalis mitochondrion sequence	Pogonomyrmex occidentalis	0	1	26	21514	21539
3	26	26	52.0	100.000	26	8.78e-04	0	0	100	100	Notodromas monacha	Notodromas monacha	0	1	26	12374	12399
3	26	26	52.0	100.000	26	8.78e-04	0	0	100	100	Cyprideis torosa	Cyprideis torosa	0	1	26	12366	12391
3	26	26	52.0	100.000	26	8.78e-04	0	0	100	100	Darwinula stevensoni	Darwinula stevensoni	0	1	26	12339	12364
3	26	26	52.0	100.000	26	8.78e-04	0	0	100	100	Scolopendra subspinipes subspinipes cytochrome oxidase subunit I (COI) gene, partial cds; mitochondrial	Scolopendra subspinipes subspinipes	0	1	26	76	101
3	26	26	52.0	100.000	26	8.78e-04	0	0	100	100	Longitarsus albineus voucher 10B cytochrome oxidase subunit 1 (COI) gene, partial cds; mitochondrial	Longitarsus albineus	0	1	26	685	660
3	26	26	52.0	100.000	26	8.78e-04	0	0	100	100	Longitarsus albineus voucher 10A cytochrome oxidase subunit 1 (COI) gene, partial cds; mitochondrial	Longitarsus albineus	0	1	26	686	661
3	26	26	52.0	100.000	26	8.78e-04	0	0	100	100	Longitarsus albineus voucher 10C cytochrome oxidase subunit 1 (COI) gene, partial cds; mitochondrial	Longitarsus albineus	0	1	26	686	661
4	26	26	52.0	100.000	26	8.78e-04	0	0	100	100	Oreaster reticulatus isolate Or#10 voucher FSBC I 135398 cytochrome oxidase subunit I (COI) gene, partial cds; mitochondrial	Oreaster reticulatus	0	1	26	473	448
4	26	26	52.0	100.000	26	8.78e-04	0	0	100	100	Oreaster reticulatus isolate Or8 voucher FSBC I 135398 tRNA-Ala gene, partial sequence; tRNA-Leu, tRNA-Asn, tRNA-Gly, and tRNA-Pro genes, complete sequence; and cytochrome oxidase subunit I (COI) gene, partial cds; mitochondrial	Oreaster reticulatus	0	1	26	1102	1077
4	26	26	52.0	100.000	26	8.78e-04	0	0	100	100	Oreaster reticulatus isolate Or7 voucher FSBC I 135398 cytochrome oxidase subunit I (COI) gene, partial cds; mitochondrial	Oreaster reticulatus	0	1	26	546	521
4	26	26	52.0	100.000	26	8.78e-04	0	0	100	100	Oreaster reticulatus isolate Or6 voucher FSBC I 135398 cytochrome oxidase subunit I (COI) gene, partial cds; mitochondrial	Oreaster reticulatus	0	1	26	546	521
4	26	26	52.0	100.000	26	8.78e-04	0	0	100	100	Oreaster reticulatus isolate Or5 voucher FSBC I 135398 cytochrome oxidase subunit I (COI) gene, partial cds; mitochondrial	Oreaster reticulatus	0	1	26	546	521
4	26	26	52.0	100.000	26	8.78e-04	0	0	100	100	Oreaster reticulatus isolate Or4 voucher FSBC I 135398 cytochrome oxidase subunit I (COI) gene, partial cds; mitochondrial	Oreaster reticulatus	0	1	26	546	521
4	26	26	52.0	100.000	26	8.78e-04	0	0	100	100	Oreaster reticulatus isolate Or3 voucher FSBC I 135398 tRNA-Ala gene, partial sequence; tRNA-Leu, tRNA-Asn, tRNA-Gly, and tRNA-Pro genes, complete sequence; and cytochrome oxidase subunit I (COI) gene, partial cds; mitochondrial	Oreaster reticulatus	0	1	26	1102	1077
4	26	26	52.0	100.000	26	8.78e-04	0	0	100	100	Oreaster reticulatus isolate Or2 voucher FSBC I 135398 cytochrome oxidase subunit I (COI) gene, partial cds; mitochondrial	Oreaster reticulatus	0	1	26	546	521
4	26	26	52.0	100.000	26	8.78e-04	0	0	100	100	Oreaster reticulatus isolate Or1 voucher FSBC I 135398 cytochrome oxidase subunit I (COI) gene, partial cds; mitochondrial	Oreaster reticulatus	0	1	26	546	521
4	26	26	52.0	100.000	26	8.78e-04	0	0	100	100	Oreaster reticulatus voucher FSBC I 115738 tRNA-Ala gene, partial sequence; tRNA-Leu, tRNA-Asn, tRNA-Gly, and tRNA-Pro genes, complete sequence; and cytochrome oxidase subunit I (COI) gene, partial cds; mitochondrial	Oreaster reticulatus	0	1	26	1050	1025
5	26	26	52.0	100.000	26	8.78e-04	0	0	100	100	Coregonus artedi isolate NEFC F16-263 mitochondrion, complete genome	Coregonus artedi	0	1	26	6202	6177
5	26	26	52.0	100.000	26	8.78e-04	0	0	100	100	Coregonus artedi isolate NEFC F16-262 mitochondrion, complete genome	Coregonus artedi	0	1	26	6202	6177
5	26	26	52.0	100.000	26	8.78e-04	0	0	100	100	Schizopygopsis malacanthus chengi isolate 3 cytochrome oxidase subunit I (COX1) gene, partial cds; mitochondrial	Schizopygopsis malacanthus chengi	0	1	26	608	583
5	26	26	52.0	100.000	26	8.78e-04	0	0	100	100	Coregonus artedi strain NEFC_F16-524 mitochondrion, complete genome.	Coregonus artedi	0	1	26	6202	6177
5	26	26	52.0	100.000	26	8.78e-04	0	0	100	100	Coregonus artedi voucher NEFC_F16-375 mitochondrion, complete genome.	Coregonus artedi	0	1	26	6202	6177
5	26	26	52.0	100.000	26	8.78e-04	0	0	100	100	Coregonus autumnalis isolate BLM3 COI gene, partial cds; mitochondrial	Coregonus autumnalis	0	1	26	569	544
5	26	26	52.0	100.000	26	8.78e-04	0	0	100	100	Coregonus autumnalis isolate BLM1 COI gene, partial cds; mitochondrial	Coregonus autumnalis	0	1	26	569	544
5	26	26	52.0	100.000	26	8.78e-04	0	0	100	100	Schizopygopsis malacanthus chengi mitochondrion, partial genome	Schizopygopsis malacanthus chengi	0	1	26	6209	6184
5	26	26	52.0	100.000	26	8.78e-04	0	0	100	100	Uca annulipes isolate Ua_H19 cytochrome oxidase subunit I (COI) gene, partial cds; mitochondrial	Austruca annulipes	0	1	26	654	629
5	26	26	52.0	100.000	26	8.78e-04	0	0	100	100	Uca annulipes isolate Ua_H18 cytochrome oxidase subunit I (COI) gene, partial cds; mitochondrial	Austruca annulipes	0	1	26	654	629
6	26	26	52.0	100.000	26	8.78e-04	0	0	100	100	Parnisa sp. ERLG-2019 cytochrome c oxidase subunit I (COI) gene, partial cds; mitochondrial	Parnisa sp. ERLG-2019	0	1	26	668	643
6	26	26	52.0	100.000	26	8.78e-04	0	0	100	100	Choeradoplana pucupucu voucher MZUSP PL 541 cytochrome oxidase subunit I (Cox1) gene, partial cds; mitochondrial	Choeradoplana pucupucu	0	1	26	503	478
6	26	26	52.0	100.000	26	8.78e-04	0	0	100	100	Hemiamphisiella terricola terricola isolate INHC135 cytochrome c oxidase subunit 1 (CO1) gene, partial cds; mitochondrial	Hemiamphisiella terricola terricola	0	1	26	348	323
6	26	26	52.0	100.000	26	8.78e-04	0	0	100	100	Eptesicus fuscus mitochondrion, partial genome	Eptesicus fuscus	0	1	26	6155	6130
6	26	26	52.0	100.000	26	8.78e-04	0	0	100	100	Yuriria alta mitochondrial DNA, complete genome	Yuriria alta	0	1	26	6212	6187
6	26	26	52.0	100.000	26	8.78e-04	0	0	100	100	Cordyceps militaris isolate CM09-31-28 mitochondrion, complete genome	Cordyceps militaris	0	1	26	15969	15944
6	26	26	52.0	100.000	26	8.78e-04	0	0	100	100	Cordyceps militaris isolate V40-4 mitochondrion, complete genome	Cordyceps militaris	0	1	26	15963	15938
6	26	26	52.0	100.000	26	8.78e-04	0	0	100	100	Cordyceps militaris isolate CM06 mitochondrion, complete genome	Cordyceps militaris	0	1	26	15962	15937
6	26	26	52.0	100.000	26	8.78e-04	0	0	100	100	Xylonichus sp. NLG-2014 isolate COL066 cytochrome oxidase subunit 1 (COI) gene, partial cds; mitochondrial	Xylonichus sp. NLG-2014	0	1	26	440	415
6	26	26	52.0	100.000	26	8.78e-04	0	0	100	100	Cordyceps militaris isolate F01 mitochondrion, partial genome	Cordyceps militaris	0	1	26	9486	9461
7	26	26	52.0	100.000	26	8.78e-04	0	0	100	100	Notothenia rossii mitochondrion, complete genome	Notothenia rossii	0	1	26	7680	7655
7	26	26	52.0	100.000	26	8.78e-04	0	0	100	100	Proechimys gularis isolate ROM105297 mitochondrion, complete genome	Proechimys gularis	0	1	26	6054	6029
7	26	26	52.0	100.000	26	8.78e-04	0	0	100	100	Hemitomaspis caligata isolate CER194 cytochrome oxidase subunit I (COI) gene, partial cds; mitochondrial	Hemitomaspis caligata	0	1	26	50	25
7	26	26	52.0	100.000	26	8.78e-04	0	0	100	100	Cobitis sp. BIWAE type C mitochondrial DNA, complete genome, specimen_voucher: CBM:ZF:11450	Cobitis sp. BIWAE type C	0	1	26	6191	6166
7	26	26	52.0	100.000	26	8.78e-04	0	0	100	100	Orthogeomys hispidus voucher SP12872 cytochrome oxidase subunit 1 (CO1) gene, partial cds; mitochondrial	Orthogeomys hispidus	0	1	26	668	643
7	26	26	52.0	100.000	26	8.78e-04	0	0	100	100	Rexea solandri mitochondrion, complete genome	Rexea solandri	0	1	26	6208	6183
7	26	26	52.0	100.000	26	8.78e-04	0	0	100	100	Percina vigil voucher 758pvcur_ATU cytochrome oxidase subunit I (COI) gene, partial cds; mitochondrial	Percina vigil	0	1	26	695	670
7	26	26	52.0	100.000	26	8.78e-04	0	0	100	100	Percina vigil voucher 805pvcur_ATU cytochrome oxidase subunit I (COI) gene, partial cds; mitochondrial	Percina vigil	0	1	26	695	670
7	26	26	52.0	100.000	26	8.78e-04	0	0	100	100	Percina vigil voucher 793pvsal_ATU cytochrome oxidase subunit I (COI) gene, partial cds; mitochondrial	Percina vigil	0	1	26	695	670
7	26	26	52.0	100.000	26	8.78e-04	0	0	100	100	Percina vigil voucher 794pvoua_ATU cytochrome oxidase subunit I (COI) gene, partial cds; mitochondrial	Percina vigil	0	1	26	695	670
8	26	26	52.0	100.000	26	8.78e-04	0	0	100	100	Channa argus mitochondrion, complete genome	Channa argus	0	1	26	6201	6176
8	26	26	52.0	100.000	26	8.78e-04	0	0	100	100	Foraminitermes rhinoceros isolate BDIT108 mitochondrion, complete genome	Foraminitermes rhinoceros	0	1	26	2205	2180
8	26	26	52.0	100.000	26	8.78e-04	0	0	100	100	Rhinogobius cliffordpopei mitochondrion, complete genome	Rhinogobius cliffordpopei	0	1	26	6210	6185
8	26	26	52.0	100.000	26	8.78e-04	0	0	100	100	Channa argus haplotype BtcaH3 cytochrome c oxidase subunit I (CO1) gene, complete cds; mitochondrial	Channa argus	0	1	26	731	706
8	26	26	52.0	100.000	26	8.78e-04	0	0	100	100	Channa argus haplotype BtcaH2 cytochrome c oxidase subunit I (CO1) gene, complete cds; mitochondrial	Channa argus	0	1	26	731	706
8	26	26	52.0	100.000	26	8.78e-04	0	0	100	100	Channa argus haplotype BtcaH1 cytochrome c oxidase subunit I (CO1) gene, complete cds; mitochondrial	Channa argus	0	1	26	731	706
8	26	26	52.0	100.000	26	8.78e-04	0	0	100	100	Channa argus haplotype WtcaH3 cytochrome c oxidase subunit I (CO1) gene, complete cds; mitochondrial	Channa argus	0	1	26	731	706
8	26	26	52.0	100.000	26	8.78e-04	0	0	100	100	Channa argus haplotype WtcaH2 cytochrome c oxidase subunit I (CO1) gene, complete cds; mitochondrial	Channa argus	0	1	26	731	706
8	26	26	52.0	100.000	26	8.78e-04	0	0	100	100	Channa argus haplotype WtcaH1 cytochrome c oxidase subunit I (CO1) gene, complete cds; mitochondrial	Channa argus	0	1	26	731	706
8	26	26	52.0	100.000	26	8.78e-04	0	0	100	100	Rhinogobius cliffordpopei mitochondrion, complete genome	Rhinogobius cliffordpopei	0	1	26	6224	6199
9	23	23	46.1	100.000	23	0.054	0	0	88	88	Pyropia yezoensis mitochondrion, complete genome	Neopyropia yezoensis	0	1	23	25112	25134
9	23	23	46.1	100.000	23	0.054	0	0	88	88	Microvirga sp. VF16 chromosome, complete genome	Microvirga sp. VF16	0	4	26	1692782	1692804
9	20	16	32.2	95.000	19	815	0	0	88	77	Microvirga sp. VF16 chromosome, complete genome	Microvirga sp. VF16	1	7	26	1665539	1665520
9	23	23	46.1	100.000	23	0.054	0	0	88	88	Agrobacterium vitis VAR06-30 DNA, chromosome 1, complete sequence	Agrobacterium vitis	0	4	26	3322999	3323021
9	23	23	46.1	100.000	23	0.054	0	0	88	88	Menida violacea mitochondrion, complete genome	Menida violacea	0	1	23	2134	2112
9	23	23	46.1	100.000	23	0.054	0	0	88	88	Epilohmannia aff. pallida AD1282 voucher UMMZ BMOC 08-0812-001 AD1282 cytochrome oxidase subunit I (COXI) gene, partial cds; mitochondrial	Epilohmannia aff. pallida AD1282	0	4	26	685	663
9	23	23	46.1	100.000	23	0.054	0	0	88	88	Pentatomidae sp. isolate 19092807 cytochrome c oxidase subunit I (COX1) gene, partial cds; mitochondrial	Pentatomidae sp.	0	1	23	659	637
9	23	23	46.1	100.000	23	0.054	0	0	88	88	Agrobacterium vitis strain CG78 chromosome 1, complete sequence	Agrobacterium vitis	0	4	26	450893	450871
9	23	23	46.1	100.000	23	0.054	0	0	88	88	Agrobacterium vitis strain CG678 chromosome 1, complete sequence	Agrobacterium vitis	0	4	26	450893	450871
9	23	23	46.1	100.000	23	0.054	0	0	88	88	Plectorhinchus chaetodonoides mitochondrion, complete genome	Plectorhinchus chaetodonoides	0	1	23	6221	6199
9	23	23	46.1	100.000	23	0.054	0	0	88	88	Agrobacterium vitis VAT03-9 DNA, chromosome 1, complete sequence	Agrobacterium vitis	0	4	26	2614888	2614866
10	26	26	52.0	100.000	26	8.78e-04	0	0	100	100	Lontra canadensis ATP synthase F0 subunit 6 (ATP6), ATP synthase F0 subunit 8 (ATP8), cytochrome c oxidase subunit I (COX1), cytochrome c oxidase subunit II (COX2), cytochrome c oxidase subunit III (COX3), NADH dehydrogenase subunit 1 (ND1), NADH dehydrogenase subunit 2 (ND2), NADH dehydrogenase subunit 3 (ND3), NADH dehydrogenase subunit 4 (ND4), NADH dehydrogenase subunit 4L (ND4L), and NADH dehydrogenase subunit 5 (ND5) genes, complete cds; mitochondrial	Lontra canadensis	0	1	26	1816	1791
10	23	23	46.1	100.000	23	0.054	0	0	88	88	Cryptopsaras couesii isolate CC81C mitochondrion, partial genome	Cryptopsaras couesii	0	4	26	9562	9584
10	23	23	46.1	100.000	23	0.054	0	0	88	88	Cryptopsaras couesii isolate CCS2C mitochondrion, partial genome	Cryptopsaras couesii	0	4	26	9560	9582
10	23	23	46.1	100.000	23	0.054	0	0	88	88	Cryptopsaras couesii isolate CC26E mitochondrion, partial genome	Cryptopsaras couesii	0	4	26	9565	9587
10	23	23	46.1	100.000	23	0.054	0	0	88	88	Pseudomonas sp. PIA16 chromosome, complete genome	Pseudomonas sp. PIA16	0	1	23	2542422	2542444
10	23	23	46.1	100.000	23	0.054	0	0	88	88	Cryptopsaras couesii isolate ON76E mitochondrion, partial genome	Cryptopsaras couesii	0	4	26	4302	4280
10	23	23	46.1	100.000	23	0.054	0	0	88	88	Cryptopsaras couesii isolate CCS1E mitochondrion, partial genome	Cryptopsaras couesii	0	4	26	876	854
10	23	23	46.1	100.000	23	0.054	0	0	88	88	Cryptopsaras couesii isolate CC32E mitochondrion, partial genome	Cryptopsaras couesii	0	4	26	7889	7867
10	23	23	46.1	100.000	23	0.054	0	0	88	88	Pimoa reniformis isolate Sc26 cytochrome c oxidase subunit I (COI) gene, partial cds; mitochondrial	Pimoa reniformis	0	4	26	543	521
10	23	23	46.1	100.000	23	0.054	0	0	88	88	Pimoa reniformis isolate Sc7 cytochrome c oxidase subunit I (COI) gene, partial cds; mitochondrial	Pimoa reniformis	0	4	26	543	521
11	26	26	52.0	100.000	26	8.78e-04	0	0	100	100	Halomonas meridiana Slthf1 DNA, complete genome	Halomonas meridiana	0	1	26	1873421	1873446
11	26	26	52.0	100.000	26	8.78e-04	0	0	100	100	Paramoeba aparasomata mitochondrion, complete genome	Paramoeba aparasomata	0	1	26	21644	21619
11	26	26	52.0	100.000	26	8.78e-04	0	0	100	100	Sicarius fumosus isolate Sic560 cytochrome c oxidase subunit I gene, partial cds; mitochondrial	Sicarius fumosus	0	1	26	392	367
11	26	26	52.0	100.000	26	8.78e-04	0	0	100	100	Sicarius fumosus isolate Sic555 cytochrome c oxidase subunit I gene, partial cds; mitochondrial	Sicarius fumosus	0	1	26	392	367
11	26	26	52.0	100.000	26	8.78e-04	0	0	100	100	Toxarium undulatum strain ECT3802 mitochondrion, complete genome	Toxarium undulatum	0	1	26	10275	10250
11	26	26	52.0	100.000	26	8.78e-04	0	0	100	100	Toxarium undulatum strain ECT3802 mitochondrion, complete genome	Toxarium undulatum	0	1	26	10275	10250
11	26	26	52.0	100.000	26	8.78e-04	0	0	100	100	Draconarius transversus isolate ZZ492 cytochrome oxidase subunit I (COI) gene, partial cds; mitochondrial	Draconarius transversus	0	1	26	656	631
11	26	26	52.0	100.000	26	8.78e-04	0	0	100	100	Tigriopus japonicus isolate QD1 cytochrome oxidase subunit 1 (COI) gene, partial cds; mitochondrial	Tigriopus japonicus	0	1	26	695	670
11	26	26	52.0	100.000	26	8.78e-04	0	0	100	100	Synotaxus sp. LB-2014b cytochrome c oxidase subunit I (COI) gene, partial cds; mitochondrial	Synotaxus sp. LB-2014b	0	1	26	668	643
11	26	26	52.0	100.000	26	8.78e-04	0	0	100	100	Pseudoacanthocephalus lucidus mitochondrial COX1 gene for cytochrome c oxidase subunit 1, partial cds, sample code: 43/Ro/Misasa	Pseudoacanthocephalus lucidus	0	1	26	506	481
12	26	26	52.0	100.000	26	8.78e-04	0	0	100	100	Nasocoris lautereri voucher AMNH:PBI 00341015 cytochrome c oxidase subunit I (COI) gene, partial cds; mitochondrial	Nasocoris lautereri	0	1	26	655	630
12	26	26	52.0	100.000	26	8.78e-04	0	0	100	100	Alectorobius spheniscus isolate Os34 cytochrome oxidase subunit I (COI) gene, partial cds; mitochondrial	Alectorobius spheniscus	0	1	26	480	455
12	26	26	52.0	100.000	26	8.78e-04	0	0	100	100	Nannosquillidae sp. 1 KDF-2019 isolate LI15030 cytochrome oxidase subunit 1 (CO1) gene, partial cds; mitochondrial	Nannosquillidae sp. 1 KDF-2019	0	1	26	705	680
12	26	26	52.0	100.000	26	8.78e-04	0	0	100	100	Nannosquillidae sp. 1 KDF-2019 isolate LI15028 cytochrome oxidase subunit 1 (CO1) gene, partial cds; mitochondrial	Nannosquillidae sp. 1 KDF-2019	0	1	26	705	680
12	26	26	52.0	100.000	26	8.78e-04	0	0	100	100	Drosophila nigrocirrus voucher M09228 cytochrome c oxidase subunit I (COI) gene, partial cds; mitochondrial	Drosophila nigrocirrus	0	1	26	684	659
12	26	26	52.0	100.000	26	8.78e-04	0	0	100	100	Paroedura picta mitochondrial DNA, complete genome	Paroedura picta	0	1	26	5993	5968
12	26	26	52.0	100.000	26	8.78e-04	0	0	100	100	Neopanorpa sheni cytochrome oxidase subunit I (COI) gene, partial cds; mitochondrial	Neopanorpa sheni	0	1	26	437	412
12	26	26	52.0	100.000	26	8.78e-04	0	0	100	100	Echinometra mathaei S292 mitochondrial COX1 gene for cytochrome c oxidase subunit 1, partial cds	Echinometra mathaei	0	1	26	641	616
12	26	26	52.0	100.000	26	8.78e-04	0	0	100	100	Echinometra mathaei S172 mitochondrial COX1 gene for cytochrome c oxidase subunit 1, partial cds	Echinometra mathaei	0	1	26	641	616
12	26	26	52.0	100.000	26	8.78e-04	0	0	100	100	Echinometra mathaei S302 mitochondrial COX1 gene for cytochrome c oxidase subunit 1, partial cds	Echinometra mathaei	0	1	26	641	616
13	26	26	52.0	100.000	26	8.78e-04	0	0	100	100	Geryonia proboscidalis mitochondrion, partial genome	Geryonia proboscidalis	0	1	26	2470	2495
13	26	26	52.0	100.000	26	8.78e-04	0	0	100	100	Stylatula elongata mitochondrion, complete genome	Stylatula elongata	0	1	26	860	835
13	26	26	52.0	100.000	26	8.78e-04	0	0	100	100	Ceratias uranoscopus mitochondrial DNA, complete genome	Ceratias uranoscopus	0	1	26	7444	7419
13	23	23	46.1	100.000	23	0.054	0	0	88	88	Calineuria stigmatica mitochondrion, partial genome	Calineuria stigmatica	0	1	23	2157	2135
13	23	23	46.1	100.000	23	0.054	0	0	88	88	Pullosquilla litoralis isolate PuLiA3 cytochrome oxidase subunit 1 (CO1, COX1) gene, partial cds; mitochondrial	Pullosquilla litoralis	0	1	23	705	683
13	23	23	46.1	100.000	23	0.054	0	0	88	88	Pullosquilla litoralis isolate PuLiA2 cytochrome oxidase subunit 1 (CO1, COX1) gene, partial cds; mitochondrial	Pullosquilla litoralis	0	1	23	705	683
13	23	23	46.1	100.000	23	0.054	0	0	88	88	Pullosquilla litoralis isolate PuLiA1 cytochrome oxidase subunit 1 (CO1, COX1) gene, partial cds; mitochondrial	Pullosquilla litoralis	0	1	23	705	683
13	23	23	46.1	100.000	23	0.054	0	0	88	88	Stomias atriventer voucher CSULA 16-01 mitochondrion, complete genome	Stomias atriventer	0	1	23	6182	6160
13	23	23	46.1	100.000	23	0.054	0	0	88	88	Tesserocerus belti voucher TsTes03 cytochrome oxidase subunit 1 (COI) gene, partial cds; mitochondrial	Tesserocerus belti	0	1	23	479	457
13	23	23	46.1	100.000	23	0.054	0	0	88	88	Lepidodermella squamata mitochondrion, complete genome	Lepidodermella squamata	0	4	26	13550	13528
14	23	23	46.1	100.000	23	0.054	0	0	88	88	Rhinogobius formosanus mitochondrion, complete genome	Rhinogobius formosanus	0	1	23	6202	6180
14	23	23	46.1	100.000	23	0.054	0	0	88	88	Halomonas meridiana strain SCSIO 43005 chromosome, complete genome	Halomonas meridiana	0	4	26	1751948	1751926
14	23	23	46.1	100.000	23	0.054	0	0	88	88	Rhinogobius similis haplotype Hap_10 cytochrome c oxidase subunit I (COI) gene, partial cds; mitochondrial	Rhinogobius similis	0	1	23	683	661
14	23	23	46.1	100.000	23	0.054	0	0	88	88	Rhinogobius similis haplotype Hap_8 cytochrome c oxidase subunit I (COI) gene, partial cds; mitochondrial	Rhinogobius similis	0	1	23	683	661
14	23	23	46.1	100.000	23	0.054	0	0	88	88	Rhinogobius similis haplotype Hap_7 cytochrome c oxidase subunit I (COI) gene, partial cds; mitochondrial	Rhinogobius similis	0	1	23	683	661
14	23	23	46.1	100.000	23	0.054	0	0	88	88	Rhinogobius similis haplotype Hap_6 cytochrome c oxidase subunit I (COI) gene, partial cds; mitochondrial	Rhinogobius similis	0	1	23	683	661
