118	26	26	52.0	100.000	26	8.78e-04	0	0	100	100	Draconarius trifasciatus isolate ZZ037 cytochrome oxidase subunit I (COI) gene, partial cds; mitochondrial	Draconarius trifasciatus	0	1	26	656	631
118	26	26	52.0	100.000	26	8.78e-04	0	0	100	100	Onchocerca cervipedis voucher MNHN:97YT cytochrome c oxidase subunit I (COX1) gene, partial cds; mitochondrial	Onchocerca cervipedis	0	1	26	451	426
118	26	26	52.0	100.000	26	8.78e-04	0	0	100	100	Austrodomus zuluensis isolate ARAMR000738 cytchrome oxidase subunit I (COI) gene, partial cds; mitochondrial	Austrodomus zuluensis	0	1	26	684	659
118	26	26	52.0	100.000	26	8.78e-04	0	0	100	100	Filistata insidiatrix isolate ARASP000043 cytchrome oxidase subunit I (COI) gene, partial cds; mitochondrial	Filistata insidiatrix	0	1	26	684	659
118	26	26	52.0	100.000	26	8.78e-04	0	0	100	100	Myrmeleon sp. 3 AS-2014 cytochrome oxidase subunit I (COI) gene, partial cds; mitochondrial	Myrmeleon sp. 3 AS-2014	0	1	26	551	526
119	23	23	46.1	100.000	23	0.054	0	0	88	88	Idiomarina andamanensis strain W-5T chromosome	Idiomarina andamanensis	0	1	23	2079761	2079783
119	23	23	46.1	100.000	23	0.054	0	0	88	88	Microbulbifer sp. GL-2 DNA, complete genome	Microbulbifer sp. GL-2	0	1	23	1487694	1487716
119	23	23	46.1	100.000	23	0.054	0	0	88	88	Muscina stabulans isolate HN201912123 cytochrome oxidase subunit I (COI) gene, partial cds; mitochondrial	Muscina stabulans	0	4	26	56	34
119	23	23	46.1	100.000	23	0.054	0	0	88	88	Sceleocantha sp. 4 MJ-2019 mitochondrion, partial genome	Sceleocantha sp. 4 MJ-2019	0	4	26	2145	2123
119	23	23	46.1	100.000	23	0.054	0	0	88	88	Pullosquilla thomassini isolate LI15010_2 cytochrome oxidase subunit 1 (CO1) gene, partial cds; mitochondrial	Pullosquilla thomassini	0	4	26	702	680
119	23	23	46.1	100.000	23	0.054	0	0	88	88	Chionodraco rastrospinosus mitochondrion, complete genome	Chionodraco rastrospinosus	0	4	26	6199	6177
119	23	23	46.1	100.000	23	0.054	0	0	88	88	Cacopsylla heterogena isolate CHBT.5 cytochrome oxidase subunit I (COI) gene, partial cds; mitochondrial	Cacopsylla heterogena	0	4	26	489	467
119	23	23	46.1	100.000	23	0.054	0	0	88	88	Cacopsylla heterogena isolate CHBT.12 cytochrome oxidase subunit I (COI) gene, partial cds; mitochondrial	Cacopsylla heterogena	0	4	26	486	464
119	23	23	46.1	100.000	23	0.054	0	0	88	88	Cacopsylla heterogena isolate CHBT.11 cytochrome oxidase subunit I (COI) gene, partial cds; mitochondrial	Cacopsylla heterogena	0	4	26	491	469
119	23	23	46.1	100.000	23	0.054	0	0	88	88	Cacopsylla heterogena isolate CHBT.10 cytochrome oxidase subunit I (COI) gene, partial cds; mitochondrial	Cacopsylla heterogena	0	4	26	486	464
120	26	26	52.0	100.000	26	8.78e-04	0	0	100	100	Dryophytes japonicus voucher IABHU6123 mitochondrion, complete genome	Dryophytes japonicus	0	1	26	10367	10342
120	26	26	52.0	100.000	26	8.78e-04	0	0	100	100	Orosius orientalis mitochondrion, partial genome	Orosius orientalis	0	1	26	2131	2106
120	26	26	52.0	100.000	26	8.78e-04	0	0	100	100	Marsupenaeus japonicus isolate 23JAP cytochrome oxidase subunit I (COI) gene, partial cds; mitochondrial	Penaeus japonicus	0	1	26	683	658
120	26	26	52.0	100.000	26	8.78e-04	0	0	100	100	Marsupenaeus japonicus isolate 8JAP cytochrome oxidase subunit I (COI) gene, partial cds; mitochondrial	Penaeus japonicus	0	1	26	683	658
120	26	26	52.0	100.000	26	8.78e-04	0	0	100	100	Marsupenaeus japonicus isolate 4JAP cytochrome oxidase subunit I (COI) gene, partial cds; mitochondrial	Penaeus japonicus	0	1	26	683	658
120	26	26	52.0	100.000	26	8.78e-04	0	0	100	100	Marsupenaeus japonicus isolate 2JAP cytochrome oxidase subunit I (COI) gene, partial cds; mitochondrial	Penaeus japonicus	0	1	26	686	661
120	26	26	52.0	100.000	26	8.78e-04	0	0	100	100	Marsupenaeus japonicus isolate 1JAP cytochrome oxidase subunit I (COI) gene, partial cds; mitochondrial	Penaeus japonicus	0	1	26	686	661
120	26	26	52.0	100.000	26	8.78e-04	0	0	100	100	Orosius orientalis voucher ww00802 cytochrome oxidase subunit 1 (COI) gene, partial cds; mitochondrial	Orosius orientalis	0	1	26	684	659
120	26	26	52.0	100.000	26	8.78e-04	0	0	100	100	Aspergillus campestris strain NRRL 13001 cytochrome oxidase subunit 1 (cox1) gene, partial cds; mitochondrial	Aspergillus campestris	0	1	26	307	282
120	26	26	52.0	100.000	26	8.78e-04	0	0	100	100	Hyla japonica isolate HjaponicaHjM1 cytochrome oxidase subunit I (COI) gene, partial cds; mitochondrial	Dryophytes japonicus	0	1	26	143	118
121	26	26	52.0	100.000	26	8.78e-04	0	0	100	100	Sicarius fumosus isolate Sic558 cytochrome c oxidase subunit I gene, partial cds; mitochondrial	Sicarius fumosus	0	1	26	392	367
121	26	26	52.0	100.000	26	8.78e-04	0	0	100	100	Iodobacter fluviatilis strain PCH194 chromosome, complete genome	Iodobacter fluviatilis	0	1	26	1657559	1657534
121	26	26	52.0	100.000	26	8.78e-04	0	0	100	100	Achromobacter sp. 77 chromosome, complete genome	Achromobacter sp. 77	0	1	26	3080992	3080967
121	17	17	34.2	100.000	17	206	0	0	100	65	Achromobacter sp. 77 chromosome, complete genome	Achromobacter sp. 77	0	1	17	4543424	4543408
121	17	17	34.2	100.000	17	206	0	0	100	65	Achromobacter sp. 77 chromosome, complete genome	Achromobacter sp. 77	0	1	17	4626061	4626045
121	26	26	52.0	100.000	26	8.78e-04	0	0	100	100	Acanthodactylus schmidti voucher SB642 mitochondrion, complete genome	Acanthodactylus schmidti	0	1	26	5993	5968
121	23	23	46.1	100.000	23	0.054	0	0	88	88	Stilbonematinae gen. sp. 'oahu 1' mitochondrial COI gene for cytochrome oxidase subunit 1, isolate Paralaxus 'oahu 1' HW15003/2028H	Stilbonematinae gen. sp. 'oahu 1'	0	4	26	722	700
121	23	23	46.1	100.000	23	0.054	0	0	88	88	Globodera rostochiensis isolate CD2618b cytochrome c oxidase subunit I (COI) gene, partial cds; mitochondrial	Globodera rostochiensis	0	4	26	47	25
121	23	23	46.1	100.000	23	0.054	0	0	88	88	Globodera rostochiensis isolate CD2618a cytochrome c oxidase subunit I (COI) gene, partial cds; mitochondrial	Globodera rostochiensis	0	4	26	47	25
121	23	23	46.1	100.000	23	0.054	0	0	88	88	Eucalanus bungii voucher LCS_22 cytochrome oxidase subunit 1 (COI) gene, partial cds; mitochondrial	Eucalanus bungii	0	1	23	697	675
121	23	23	46.1	100.000	23	0.054	0	0	88	88	Tyrophagus longior isolate AD1725 cytochrome oxidase subunit I (COX1) gene, partial cds; mitochondrial	Tyrophagus longior	0	4	26	683	661
121	23	23	46.1	100.000	23	0.054	0	0	88	88	Boodlea composita contig_40 mitochondrion sequence	Boodlea composita	0	4	26	12597	12575
122	26	26	52.0	100.000	26	8.78e-04	0	0	100	100	Calliope calliope voucher SYSb1528 cytochrome c oxidase subunit 1 (COI) gene, partial cds; mitochondrial	Calliope calliope	0	1	26	665	640
122	26	26	52.0	100.000	26	8.78e-04	0	0	100	100	Calliope calliope voucher SYSb1527 cytochrome c oxidase subunit 1 (COI) gene, partial cds; mitochondrial	Calliope calliope	0	1	26	665	640
122	26	26	52.0	100.000	26	8.78e-04	0	0	100	100	Calliope calliope voucher SYSb1524 cytochrome c oxidase subunit 1 (COI) gene, partial cds; mitochondrial	Calliope calliope	0	1	26	665	640
122	26	26	52.0	100.000	26	8.78e-04	0	0	100	100	Calliope calliope mitochondrion, complete genome	Calliope calliope	0	1	26	6320	6295
122	26	26	52.0	100.000	26	8.78e-04	0	0	100	100	Luscinia calliope mitochondrial COI gene for cytochrome oxidase subunit I, partial cds, isolate: YIO173-10	Calliope calliope	0	1	26	681	656
122	26	26	52.0	100.000	26	8.78e-04	0	0	100	100	Thulinius sp. DVL-2010 mitochondrion, complete genome	Thulinius sp. DVL-2010	0	1	26	14233	14208
122	26	26	52.0	100.000	26	8.78e-04	0	0	100	100	Luscinia calliope mitochondrion, complete genome	Calliope calliope	0	1	26	6144	6119
122	26	26	52.0	100.000	26	8.78e-04	0	0	100	100	Luscinia calliope voucher ZMMU RYA 1658 cytochrome oxidase subunit 1 (COI) gene, partial cds; mitochondrial	Calliope calliope	0	1	26	681	656
122	26	26	52.0	100.000	26	8.78e-04	0	0	100	100	Luscinia calliope voucher ZMMU RYA 1680 cytochrome oxidase subunit 1 (COI) gene, partial cds; mitochondrial	Calliope calliope	0	1	26	681	656
122	26	26	52.0	100.000	26	8.78e-04	0	0	100	100	Luscinia calliope voucher ZMMU RYA 1682 cytochrome oxidase subunit 1 (COI) gene, partial cds; mitochondrial	Calliope calliope	0	1	26	681	656
123	26	26	52.0	100.000	26	8.78e-04	0	0	100	100	Tiaroga cobitis mitochondrion, complete genome	Tiaroga cobitis	0	1	26	6216	6191
123	26	26	52.0	100.000	26	8.78e-04	0	0	100	100	Batrachuperus sp. 2 PZ-2020 voucher HNUSTM1507121 mitochondrion, complete genome	Batrachuperus sp. 2 PZ-2020	0	1	26	6082	6057
123	26	26	52.0	100.000	26	8.78e-04	0	0	100	100	Chiropsalmus quadrumanus isolate KUFOS-ChQs-5 cytochrome c oxidase subunit 1 (COI) gene, partial cds; mitochondrial	Chiropsalmus quadrumanus	0	1	26	650	625
123	26	26	52.0	100.000	26	8.78e-04	0	0	100	100	Chiropsalmus quadrumanus isolate KUFOS-ChQs-4 cytochrome c oxidase subunit 1 (COI) gene, partial cds; mitochondrial	Chiropsalmus quadrumanus	0	1	26	650	625
123	26	26	52.0	100.000	26	8.78e-04	0	0	100	100	Chiropsalmus quadrumanus isolate KUFOS-ChQs-3 cytochrome c oxidase subunit 1 (COI) gene, partial cds; mitochondrial	Chiropsalmus quadrumanus	0	1	26	650	625
123	26	26	52.0	100.000	26	8.78e-04	0	0	100	100	Chiropsalmus quadrumanus isolate KUFOS-ChQs-2 cytochrome c oxidase subunit 1 (COI) gene, partial cds; mitochondrial	Chiropsalmus quadrumanus	0	1	26	650	625
123	26	26	52.0	100.000	26	8.78e-04	0	0	100	100	Chiropsalmus quadrumanus isolate KUFOS-ChQs-1 cytochrome c oxidase subunit 1 (COI) gene, partial cds; mitochondrial	Chiropsalmus quadrumanus	0	1	26	650	625
123	26	26	52.0	100.000	26	8.78e-04	0	0	100	100	Chiropsalmus quadrumanus cytochrome c oxidase subunit I gene, partial cds; mitochondrial	Chiropsalmus quadrumanus	0	1	26	587	562
123	26	26	52.0	100.000	26	8.78e-04	0	0	100	100	Batrachuperus sp. 2 JF-2008 isolate Hap139 cytochrome c oxidase subunit 1 (COX1) gene, partial cds; mitochondrial	Batrachuperus sp. 2 JF-2008	0	1	26	659	634
123	26	26	52.0	100.000	26	8.78e-04	0	0	100	100	Batrachuperus sp. 2 JF-2008 isolate Hap149 cytochrome c oxidase subunit 1 (COX1) gene, partial cds; mitochondrial	Batrachuperus sp. 2 JF-2008	0	1	26	659	634
124	26	26	52.0	100.000	26	8.78e-04	0	0	100	100	Triplophysa sellaefer isolate 203571 cytochrome c oxidase subunit I (COI) gene, partial cds; mitochondrial	Triplophysa sellaefer	0	1	26	728	703
124	26	26	52.0	100.000	26	8.78e-04	0	0	100	100	Triplophysa sellaefer isolate 203576 cytochrome c oxidase subunit I (COI) gene, partial cds; mitochondrial	Triplophysa sellaefer	0	1	26	707	682
124	26	26	52.0	100.000	26	8.78e-04	0	0	100	100	Triplophysa sellaefer voucher IHB20151303 mitochondrion, complete genome	Triplophysa sellaefer	0	1	26	6195	6170
124	26	26	52.0	100.000	26	8.78e-04	0	0	100	100	Halichondria panicea voucher M24E cytochrome oxidase subunit I (COI) gene, partial cds; mitochondrial	Halichondria panicea	0	1	26	605	580
124	26	26	52.0	100.000	26	8.78e-04	0	0	100	100	Hoplopleura pacifica minichromosome trnI-cox1 mitochondrion, complete sequence	Hoplopleura pacifica	0	1	26	954	929
124	26	26	52.0	100.000	26	8.78e-04	0	0	100	100	Halichondria bowerbanki voucher OD061808 cytochrome c oxidase subunit I (COX1) gene, partial cds; mitochondrial	Halichondria bowerbanki	0	1	26	557	532
124	26	26	52.0	100.000	26	8.78e-04	0	0	100	100	Halichondria bowerbanki voucher OD061806 cytochrome c oxidase subunit I (COX1) gene, partial cds; mitochondrial	Halichondria bowerbanki	0	1	26	557	532
124	26	26	52.0	100.000	26	8.78e-04	0	0	100	100	Halichondria bowerbanki voucher OD061805 cytochrome c oxidase subunit I (COX1) gene, partial cds; mitochondrial	Halichondria bowerbanki	0	1	26	557	532
124	26	26	52.0	100.000	26	8.78e-04	0	0	100	100	Halichondria bowerbanki voucher OD061803 cytochrome c oxidase subunit I (COX1) gene, partial cds; mitochondrial	Halichondria bowerbanki	0	1	26	557	532
124	26	26	52.0	100.000	26	8.78e-04	0	0	100	100	Halichondria bowerbanki voucher OD061801 cytochrome c oxidase subunit I (COX1) gene, partial cds; mitochondrial	Halichondria bowerbanki	0	1	26	557	532
125	26	26	52.0	100.000	26	8.78e-04	0	0	100	100	Lambis lambis mitochondrion, complete genome	Lambis lambis	0	1	26	722	697
125	26	26	52.0	100.000	26	8.78e-04	0	0	100	100	Corynosoma semerme Cc73 mitochondrial cox1 gene for cytochrome c oxidase 1, partial cds	Corynosoma semerme	0	1	26	665	640
125	26	26	52.0	100.000	26	8.78e-04	0	0	100	100	Corynosoma semerme AbG1506_10_3 mitochondrial cox1 gene for cytochrome c oxidase 1, partial cds	Corynosoma semerme	0	1	26	665	640
125	26	26	52.0	100.000	26	8.78e-04	0	0	100	100	Corynosoma semerme AbG1506_10_2 mitochondrial cox1 gene for cytochrome c oxidase 1, partial cds	Corynosoma semerme	0	1	26	665	640
125	26	26	52.0	100.000	26	8.78e-04	0	0	100	100	Corynosoma semerme AbG1506_10_1 mitochondrial cox1 gene for cytochrome c oxidase 1, partial cds	Corynosoma semerme	0	1	26	665	640
125	26	26	52.0	100.000	26	8.78e-04	0	0	100	100	Nassarius acuticostus mitochondrion, partial genome	Nassarius acuticostus	0	1	26	722	697
125	26	26	52.0	100.000	26	8.78e-04	0	0	100	100	Aillutticus nitens voucher UBC:W.Maddison d189/d385 cytochrome oxidase subunit I (COI) gene, partial cds; mitochondrial	Aillutticus nitens	0	1	26	436	411
125	26	26	52.0	100.000	26	8.78e-04	0	0	100	100	Eupyrgota luteola voucher YSUW00032301 cytochrome oxidase subunit 1 (COX1) gene, partial cds; mitochondrial	Eupyrgota luteola	0	1	26	719	694
125	26	26	52.0	100.000	26	8.78e-04	0	0	100	100	Cicurina hoodensis haplotype TX034 cytochrome oxidase subunit I (COI) gene, partial cds; mitochondrial	Cicurina hoodensis	0	1	26	434	409
125	26	26	52.0	100.000	26	8.78e-04	0	0	100	100	Cicurina hoodensis haplotype TX033 cytochrome oxidase subunit I (COI) gene, partial cds; mitochondrial	Cicurina hoodensis	0	1	26	433	408
126	26	26	52.0	100.000	26	8.78e-04	0	0	100	100	Prosoeca marinusi voucher NV304 cytochrome c oxidase subunit I (COX1) gene, partial cds; mitochondrial	Prosoeca marinusi	0	1	26	610	585
126	26	26	52.0	100.000	26	8.78e-04	0	0	100	100	uncultured Rickettsia sp. partial CoxA gene for Cytochrome oxidase c subunit 1	uncultured Rickettsia sp.	0	1	26	412	387
126	26	26	52.0	100.000	26	8.78e-04	0	0	100	100	uncultured Rickettsia sp. partial CoxA gene for Cytochrome oxidase c subunit 1	uncultured Rickettsia sp.	0	1	26	412	387
126	26	26	52.0	100.000	26	8.78e-04	0	0	100	100	Pinnularia borealis complex sp. voucher TDP20A_14 cytochrome oxidase subunit 1 (COI) gene, partial cds; mitochondrial	Pinnularia borealis complex sp.	0	1	26	524	499
126	26	26	52.0	100.000	26	8.78e-04	0	0	100	100	Roya anglica culture ACOI:799 mitochondrion, complete genome	Roya anglica	0	1	26	64658	64633
126	26	26	52.0	100.000	26	8.78e-04	0	0	100	100	Roya anglica mitochondrion, complete genome	Roya anglica	0	1	26	64658	64633
126	26	26	52.0	100.000	26	8.78e-04	0	0	100	100	Hydroclathrus clathratus KU-d11892 mitochondrial cox1 gene for cytochrome oxidase subunit 1, partial cds	Hydroclathrus clathratus	0	1	26	687	662
126	26	26	52.0	100.000	26	8.78e-04	0	0	100	100	Prismognathus prossi mitochondrion, complete genome	Prismognathus prossi	0	1	26	2121	2096
126	26	26	52.0	100.000	26	8.78e-04	0	0	100	100	Tarphiota fucicola isolate CNUIC0494 cytochrome oxidase subunit I (CO1) gene, partial cds; mitochondrial	Tarphiota fucicola	0	1	26	650	625
126	26	26	52.0	100.000	26	8.78e-04	0	0	100	100	Rhopiella hirsuta voucher SIO-BICP00029 cytochrome c oxidase subunit I (COI) gene, partial cds; mitochondrial	Rhopiella hirsuta	0	1	26	521	496
127	26	26	52.0	100.000	26	8.78e-04	0	0	100	100	Synodus variegatus mitochondrion, complete genome	Synodus variegatus	0	1	26	6168	6143
127	23	23	46.1	100.000	23	0.054	0	0	88	88	Hiatula diphos isolate Nanridao46 cytochrome c oxidase subunit I (COI) gene, partial cds; mitochondrial	Hiatula diphos	0	4	26	701	679
127	23	23	46.1	100.000	23	0.054	0	0	88	88	Hiatula diphos isolate Nanridao36 cytochrome c oxidase subunit I (COI) gene, partial cds; mitochondrial	Hiatula diphos	0	4	26	701	679
127	23	23	46.1	100.000	23	0.054	0	0	88	88	Hiatula diphos isolate Nanridao24 cytochrome c oxidase subunit I (COI) gene, partial cds; mitochondrial	Hiatula diphos	0	4	26	701	679
127	23	23	46.1	100.000	23	0.054	0	0	88	88	Hiatula diphos isolate Nanridao13 cytochrome c oxidase subunit I (COI) gene, partial cds; mitochondrial	Hiatula diphos	0	4	26	701	679
127	23	23	46.1	100.000	23	0.054	0	0	88	88	Hiatula diphos isolate Nanridao12 cytochrome c oxidase subunit I (COI) gene, partial cds; mitochondrial	Hiatula diphos	0	4	26	701	679
127	23	23	46.1	100.000	23	0.054	0	0	88	88	Hiatula diphos isolate Nanridao11 cytochrome c oxidase subunit I (COI) gene, partial cds; mitochondrial	Hiatula diphos	0	4	26	701	679
127	23	23	46.1	100.000	23	0.054	0	0	88	88	Hiatula diphos isolate Nanridao06 cytochrome c oxidase subunit I (COI) gene, partial cds; mitochondrial	Hiatula diphos	0	4	26	701	679
127	23	23	46.1	100.000	23	0.054	0	0	88	88	Hiatula diphos isolate Nanridao05 cytochrome c oxidase subunit I (COI) gene, partial cds; mitochondrial	Hiatula diphos	0	4	26	701	679
127	23	23	46.1	100.000	23	0.054	0	0	88	88	Hiatula diphos isolate Nanridao01 cytochrome c oxidase subunit I (COI) gene, partial cds; mitochondrial	Hiatula diphos	0	4	26	701	679
128	26	26	52.0	100.000	26	8.78e-04	0	0	100	100	Sarcocystis sp. voucher M13-114E cytochrome c oxidase subunit I (cox1) gene, partial cds; mitochondrial	Sarcocystis sp.	0	1	26	621	596
128	26	26	52.0	100.000	26	8.78e-04	0	0	100	100	Sarcocystis sp. voucher M13-111C cytochrome c oxidase subunit I (cox1) gene, partial cds; mitochondrial	Sarcocystis sp.	0	1	26	621	596
128	26	26	52.0	100.000	26	8.78e-04	0	0	100	100	Sarcocystis sp. voucher M13-109E cytochrome c oxidase subunit I (cox1) gene, partial cds; mitochondrial	Sarcocystis sp.	0	1	26	563	538
128	26	26	52.0	100.000	26	8.78e-04	0	0	100	100	Sarcocystis sp. voucher M12-178E Cytochrome c oxidase subunit I (cox1) gene, partial cds; mitochondrial	Sarcocystis sp.	0	1	26	637	612
128	26	26	52.0	100.000	26	8.78e-04	0	0	100	100	Sarcocystis sp. voucher M12-155E Cytochrome c oxidase subunit I (cox1) gene, partial cds; mitochondrial	Sarcocystis sp.	0	1	26	571	546
128	26	26	52.0	100.000	26	8.78e-04	0	0	100	100	Sarcocystis sp. voucher M12-146C cytochrome c oxidase subunit I (cox1) gene, partial cds; mitochondrial	Sarcocystis sp.	0	1	26	455	430
128	26	26	52.0	100.000	26	8.78e-04	0	0	100	100	Sarcocystis lutrae isolate Np1 cytochrome c oxidase subunit I (cox1) gene, partial cds; mitochondrial	Sarcocystis lutrae	0	1	26	565	540
128	26	26	52.0	100.000	26	8.78e-04	0	0	100	100	Sarcocystis lutrae isolate Pl1 cytochrome c oxidase subunit I (cox1) gene, partial cds; mitochondrial	Sarcocystis lutrae	0	1	26	679	654
128	26	26	52.0	100.000	26	8.78e-04	0	0	100	100	Sarcocystis neurona cytochrome c oxidase subunit I (COX1) gene, partial cds; mitochondrial	Sarcocystis neurona	0	1	26	432	407
128	26	26	52.0	100.000	26	8.78e-04	0	0	100	100	Sarcocystis sp. isolate Sarco-BA1 cytochrome c oxidase subunit I (cox1) gene, partial cds; mitochondrial	Sarcocystis sp.	0	1	26	432	407
129	26	26	52.0	100.000	26	8.78e-04	0	0	100	100	Hyalomma dromedarii voucher Tick9 cytochrome c oxidase subunit I (COX1) gene, partial cds; mitochondrial	Hyalomma dromedarii	0	1	26	617	592
129	26	26	52.0	100.000	26	8.78e-04	0	0	100	100	Hyalomma dromedarii voucher Tick86 cytochrome c oxidase subunit I (COX1) gene, partial cds; mitochondrial	Hyalomma dromedarii	0	1	26	617	592
129	26	26	52.0	100.000	26	8.78e-04	0	0	100	100	Hyalomma dromedarii voucher Tick85 cytochrome c oxidase subunit I (COX1) gene, partial cds; mitochondrial	Hyalomma dromedarii	0	1	26	617	592
129	26	26	52.0	100.000	26	8.78e-04	0	0	100	100	Hyalomma dromedarii voucher Tick76 cytochrome c oxidase subunit I (COX1) gene, partial cds; mitochondrial	Hyalomma dromedarii	0	1	26	650	625
129	26	26	52.0	100.000	26	8.78e-04	0	0	100	100	Hyalomma dromedarii voucher Tick78 cytochrome c oxidase subunit I (COX1) gene, partial cds; mitochondrial	Hyalomma dromedarii	0	1	26	617	592
129	26	26	52.0	100.000	26	8.78e-04	0	0	100	100	Hyalomma dromedarii voucher Tick74 cytochrome c oxidase subunit I (COX1) gene, partial cds; mitochondrial	Hyalomma dromedarii	0	1	26	650	625
129	26	26	52.0	100.000	26	8.78e-04	0	0	100	100	Hyalomma dromedarii voucher Tick7 cytochrome c oxidase subunit I (COX1) gene, partial cds; mitochondrial	Hyalomma dromedarii	0	1	26	617	592
129	26	26	52.0	100.000	26	8.78e-04	0	0	100	100	Hyalomma dromedarii voucher Tick60 cytochrome c oxidase subunit I (COX1) gene, partial cds; mitochondrial	Hyalomma dromedarii	0	1	26	632	607
129	26	26	52.0	100.000	26	8.78e-04	0	0	100	100	Hyalomma dromedarii voucher Tick5 cytochrome c oxidase subunit I (COX1) gene, partial cds; mitochondrial	Hyalomma dromedarii	0	1	26	617	592
129	26	26	52.0	100.000	26	8.78e-04	0	0	100	100	Hyalomma dromedarii voucher Tick43 cytochrome c oxidase subunit I (COX1) gene, partial cds; mitochondrial	Hyalomma dromedarii	0	1	26	617	592
130	26	26	52.0	100.000	26	8.78e-04	0	0	100	100	Vibrio europaeus strain NPI-1 chromosome 2, complete sequence	Vibrio europaeus	0	1	26	356715	356690
130	26	26	52.0	100.000	26	8.78e-04	0	0	100	100	Pelagibacterium halotolerans strain ANSP101 chromosome, complete genome	Pelagibacterium halotolerans	0	1	26	2926269	2926294
130	26	26	52.0	100.000	26	8.78e-04	0	0	100	100	Alteromonas mediterranea strain AltCH17 chromosome, complete genome	Alteromonas mediterranea	0	1	26	4387097	4387122
130	26	26	52.0	100.000	26	8.78e-04	0	0	100	100	Labrenzia sp. THAF82 chromosome, complete genome	Labrenzia sp. THAF82	0	1	26	5243386	5243411
130	26	26	52.0	100.000	26	8.78e-04	0	0	100	100	Alteromonas mediterranea strain PT15 chromosome, complete genome	Alteromonas mediterranea	0	1	26	4174154	4174179
130	26	26	52.0	100.000	26	8.78e-04	0	0	100	100	Alteromonas mediterranea strain PT11 chromosome, complete genome	Alteromonas mediterranea	0	1	26	4222281	4222306
130	26	26	52.0	100.000	26	8.78e-04	0	0	100	100	Thalassotalea sp. HSM 43 chromosome, complete genome	Thalassotalea sp. HSM 43	0	1	26	1568435	1568410
130	26	26	52.0	100.000	26	8.78e-04	0	0	100	100	Parashewanella spongiae strain HJ039 chromosome, complete genome	Parashewanella spongiae	0	1	26	51663	51688
130	26	26	52.0	100.000	26	8.78e-04	0	0	100	100	Mesorhizobium sp. M7A.F.Ce.TU.012.03.2.1 chromosome	Mesorhizobium sp. M7A.F.Ce.TU.012.03.2.1	0	1	26	6212517	6212542
130	17	17	34.2	100.000	17	206	0	0	100	65	Mesorhizobium sp. M7A.F.Ce.TU.012.03.2.1 chromosome	Mesorhizobium sp. M7A.F.Ce.TU.012.03.2.1	0	10	26	5350348	5350332
130	26	26	52.0	100.000	26	8.78e-04	0	0	100	100	Rhodobiaceae bacterium strain SMS8 chromosome, complete genome	Rhodobiaceae bacterium	0	1	26	204232	204207
131	26	26	52.0	100.000	26	8.78e-04	0	0	100	100	Ceutorhynchus obstrictus mitochondrion, complete genome	Ceutorhynchus obstrictus	0	1	26	2098	2073
131	26	26	52.0	100.000	26	8.78e-04	0	0	100	100	Strongyloides papillosus SPL1 mitochondrial cox1 gene for cytochrome oxidase subunit 1, partial cds	Strongyloides papillosus	0	1	26	433	408
131	26	26	52.0	100.000	26	8.78e-04	0	0	100	100	Laimosemion sp. Atabapo isolate IVE_12-13_A cytochrome oxidase subunit I (COX1) gene, partial cds; mitochondrial	Laimosemion sp. Atabapo	0	1	26	48	23
131	26	26	52.0	100.000	26	8.78e-04	0	0	100	100	Tettigades undata isolate PL811x9 mitochondrion, partial genome	Tettigades undata	0	1	26	2106	2081
131	26	26	52.0	100.000	26	8.78e-04	0	0	100	100	Tettigades undata isolate PL811x8 mitochondrion, partial genome	Tettigades undata	0	1	26	2106	2081
131	26	26	52.0	100.000	26	8.78e-04	0	0	100	100	Tettigades undata isolate PL811x6 mitochondrion, partial genome	Tettigades undata	0	1	26	2106	2081
131	26	26	52.0	100.000	26	8.78e-04	0	0	100	100	Tettigades undata isolate PL811x5 mitochondrion, partial genome	Tettigades undata	0	1	26	2106	2081
131	26	26	52.0	100.000	26	8.78e-04	0	0	100	100	Tettigades undata isolate PL809x1 mitochondrion, partial genome	Tettigades undata	0	1	26	2106	2081
131	26	26	52.0	100.000	26	8.78e-04	0	0	100	100	Tettigades undata isolate JM038 mitochondrion, partial genome	Tettigades undata	0	1	26	2106	2081
131	26	26	52.0	100.000	26	8.78e-04	0	0	100	100	Tettigades undata isolate JM032 mitochondrion, partial genome	Tettigades undata	0	1	26	2106	2081
132	26	26	52.0	100.000	26	8.78e-04	0	0	100	100	Nanorana ventripunctata mitochondrion, complete genome	Nanorana ventripunctata	0	1	26	6341	6316
132	23	23	46.1	100.000	23	0.054	0	0	88	88	Mecomma ambulans mitochondrion, partial genome	Mecomma ambulans	0	4	26	2073	2051
132	23	23	46.1	100.000	23	0.054	0	0	88	88	Thais scalaris mitochondrial partial COI gene for cytochrome oxidase subunit 1, specimen voucher NHMUK:20080912	Thais scalaris	0	4	26	681	659
132	26	22	44.1	96.154	25	0.21	0	0	100	100	Pontostratiotes sp. D46DZMB cytochrome oxidase subunit I (COI) gene, partial cds; mitochondrial	Pontostratiotes sp. D46DZMB	1	1	26	685	660
132	26	22	44.1	96.154	25	0.21	0	0	100	100	Pyropia yezoensis strain RZ-58 mitochondrion, complete genome	Neopyropia yezoensis	1	1	26	30619	30644
132	26	22	44.1	96.154	25	0.21	0	0	100	100	Pratylenchus sp. 7 TSH-2019 isolate N10772 cytochrome oxidase subunit 1 (cox1) gene, partial cds; mitochondrial	Pratylenchus sp. 7 TSH-2019	1	1	26	336	311
132	26	22	44.1	96.154	25	0.21	0	0	100	100	Pratylenchus sp. 7 TSH-2019 isolate N10770 cytochrome oxidase subunit 1 (cox1) gene, partial cds; mitochondrial	Pratylenchus sp. 7 TSH-2019	1	1	26	336	311
132	26	22	44.1	96.154	25	0.21	0	0	100	100	TPA_asm: Leishmania hertigi strain M4051 kinetoplast, complete sequence	Leishmania hertigi	1	1	26	8983	9008
132	26	22	44.1	96.154	25	0.21	0	0	100	100	Metanonychus idahoensis cytochrome oxidase subunit I (COI) gene, partial cds; mitochondrial	Metanonychus idahoensis	1	1	26	650	625
132	26	22	44.1	96.154	25	0.21	0	0	100	100	Metanonychus idahoensis cytochrome oxidase subunit I (COI) gene, partial cds; mitochondrial	Metanonychus idahoensis	1	1	26	440	415
133	26	26	52.0	100.000	26	8.78e-04	0	0	100	100	Dermacentor raskemensis isolate B-1109 cytochrome c oxidase subunit I (COX1) gene, partial cds; mitochondrial	Dermacentor raskemensis	0	1	26	731	706
