63	23	23	46.1	100.000	23	0.022	0	0	100	100	Francisella tularensis subsp. holarctica strain B-8367 chromosome, complete genome	Francisella tularensis subsp. holarctica	0	1	23	1774999	1775021
63	23	23	46.1	100.000	23	0.022	0	0	100	100	Lentilitoribacter sp. Alg239-R112 genome assembly, chromosome: I	Lentilitoribacter sp. Alg239-R112	0	1	23	1400107	1400085
63	23	23	46.1	100.000	23	0.022	0	0	100	100	Aspergillus pseudonomiae tRNA synthetases class II (A)-domain-containing protein (BDV37DRAFT_159563), mRNA	Aspergillus pseudonomiae	0	1	23	182	204
63	23	23	46.1	100.000	23	0.022	0	0	100	100	Aliivibrio wodanis 06/09/160 chromosome 1 complete sequence	Aliivibrio wodanis	0	1	23	604560	604582
63	23	23	46.1	100.000	23	0.022	0	0	100	100	Francisella tularensis strain FDAARGOS_599 chromosome, complete genome	Francisella tularensis	0	1	23	885439	885461
63	23	23	46.1	100.000	23	0.022	0	0	100	100	Francisella tularensis strain FDAARGOS_595 chromosome, complete genome	Francisella tularensis	0	1	23	582046	582024
63	23	23	46.1	100.000	23	0.022	0	0	100	100	Francisella tularensis strain FDAARGOS_598 chromosome, complete genome	Francisella tularensis	0	1	23	7232	7210
64	23	23	46.1	100.000	23	0.022	0	0	100	100	Coccidioides immitis RS alanine-tRNA ligase (CIMG_02281), mRNA	Coccidioides immitis RS	0	1	23	698	720
64	23	23	46.1	100.000	23	0.022	0	0	100	100	Coccidioides posadasii C735 delta SOWgp Alanyl-tRNA synthetase, cytoplasmic, putative (CPC735_039370), mRNA	Coccidioides posadasii C735 delta SOWgp	0	1	23	698	720
64	22	22	44.1	100.000	22	0.086	0	0	96	96	Coccidioides posadasii str. Silveira chromosome 1	Coccidioides posadasii str. Silveira	0	1	22	3629205	3629226
64	20	20	40.1	100.000	20	1.3	0	0	87	87	Lonsdalea britannica strain 477 chromosome, complete genome	Lonsdalea britannica	0	3	22	3230512	3230493
64	20	20	40.1	100.000	20	1.3	0	0	87	87	Paraglaciecola mesophila strain GPM4 chromosome, complete genome	Paraglaciecola mesophila	0	4	23	4520402	4520421
64	20	20	40.1	100.000	20	1.3	0	0	87	87	PREDICTED: Crassostrea virginica alanine--tRNA ligase, cytoplasmic-like (LOC111135733), mRNA	Crassostrea virginica	0	4	23	355	374
64	20	20	40.1	100.000	20	1.3	0	0	87	87	Cydistomyia victoriensis voucher PEET1047 alanyl-tRNA synthetase-like protein (aats1) gene, partial cds	Cydistomyia victoriensis	0	1	20	52	71
64	20	20	40.1	100.000	20	1.3	0	0	87	87	Spirometra erinaceieuropaei genome assembly S_erinaceieuropaei ,scaffold SPER_scaffold0004120	Spirometra erinaceieuropaei	0	4	23	12176	12195
64	20	20	40.1	100.000	20	1.3	0	0	87	87	Cheilosia pagana genome assembly, chromosome: 5	Cheilosia pagana	0	4	23	39288745	39288764
64	20	20	40.1	100.000	20	1.3	0	0	87	87	PREDICTED: Carya illinoinensis alanine--tRNA ligase (LOC122308791), mRNA	Carya illinoinensis	0	4	23	465	484
65	20	20	40.1	100.000	20	1.3	0	0	87	87	Blochmannia endosymbiont of Camponotus nipponensis isolate CNIEBac chromosome, complete genome	Blochmannia endosymbiont of Camponotus nipponensis	0	4	23	187831	187812
65	20	20	40.1	100.000	20	1.3	0	0	87	87	Thermanaeromonas toyohensis ToBE genome assembly, chromosome: I	Thermanaeromonas toyohensis ToBE	0	4	23	2459308	2459289
65	20	20	40.1	100.000	20	1.3	0	0	87	87	Candidatus Endolissoclinum faulkneri L5, complete genome	Candidatus Endolissoclinum faulkneri L5	0	4	23	890067	890048
65	20	20	40.1	100.000	20	1.3	0	0	87	87	Idaea aversata genome assembly, chromosome: 3	Idaea aversata	0	4	23	7829368	7829387
65	19	19	38.2	100.000	19	5.3	0	0	87	83	Felis catus Senzu DNA, chromosome: E1, American Shorthair breed	Felis catus	0	5	23	3598437	3598419
65	16	16	32.2	100.000	16	326	0	0	87	70	Felis catus Senzu DNA, chromosome: E1, American Shorthair breed	Felis catus	0	4	19	53055941	53055956
65	23	19	38.2	95.652	22	5.3	0	0	100	100	Chanos chanos genome assembly, chromosome: 4	Chanos chanos	1	1	23	13901600	13901578
65	23	19	38.2	95.652	22	5.3	0	0	100	100	Chlamydia abortus strain 15-58d44 genome assembly, chromosome: I	Chlamydia abortus	1	1	23	489432	489410
65	23	19	38.2	95.652	22	5.3	0	0	100	100	Bdellovibrio sp. qaytius chromosome, complete genome	Bdellovibrio sp. qaytius	1	1	23	504205	504183
65	23	19	38.2	95.652	22	5.3	0	0	100	100	Linum usitatissimum chromosome Lu9	Linum usitatissimum	1	1	23	873786	873764
65	23	19	38.2	95.652	22	5.3	0	0	100	100	Linum usitatissimum chromosome Lu7	Linum usitatissimum	1	1	23	624248	624226
66	22	22	44.1	100.000	22	0.086	0	0	96	96	Dicrocoelium dendriticum genome assembly D_dendriticum_Leon_v1_0_4, scaffold DDEL_contig0049341	Dicrocoelium dendriticum	0	2	23	313	334
66	21	21	42.1	100.000	21	0.34	0	0	96	91	Vibrio fluvialis strain A8 chromosome 1, complete sequence	Vibrio fluvialis	0	2	22	460719	460739
66	20	16	32.2	95.000	19	326	0	0	96	87	Vibrio fluvialis strain A8 chromosome 1, complete sequence	Vibrio fluvialis	1	4	23	485621	485640
66	21	21	42.1	100.000	21	0.34	0	0	96	91	Vibrio fluvialis strain 2015AW-0110 chromosome 1	Vibrio fluvialis	0	2	22	2767810	2767830
66	20	16	32.2	95.000	19	326	0	0	96	87	Vibrio fluvialis strain 2015AW-0110 chromosome 1	Vibrio fluvialis	1	4	23	2807351	2807370
66	21	21	42.1	100.000	21	0.34	0	0	96	91	Vibrio fluvialis strain 2015AW-0221 chromosome 1	Vibrio fluvialis	0	2	22	2995488	2995508
66	20	16	32.2	95.000	19	326	0	0	96	87	Vibrio fluvialis strain 2015AW-0221 chromosome 1	Vibrio fluvialis	1	4	23	3020395	3020414
66	21	21	42.1	100.000	21	0.34	0	0	91	91	Vibrio furnissii strain 2014AW-0008 chromosome 1	Vibrio furnissii	0	2	22	1805349	1805369
66	21	21	42.1	100.000	21	0.34	0	0	96	91	Vibrio fluvialis strain 2015AW-0233 chromosome 1, complete sequence	Vibrio fluvialis	0	2	22	72507	72527
66	20	16	32.2	95.000	19	326	0	0	96	87	Vibrio fluvialis strain 2015AW-0233 chromosome 1, complete sequence	Vibrio fluvialis	1	4	23	108486	108505
66	21	21	42.1	100.000	21	0.34	0	0	91	91	Vibrio furnissii strain 2012V-1225 chromosome 1, complete sequence	Vibrio furnissii	0	2	22	76122	76142
66	21	21	42.1	100.000	21	0.34	0	0	96	91	Vibrio fluvialis strain F8658 chromosome 1, complete sequence	Vibrio fluvialis	0	2	22	1303030	1303050
66	20	16	32.2	95.000	19	326	0	0	96	87	Vibrio fluvialis strain F8658 chromosome 1, complete sequence	Vibrio fluvialis	1	4	23	1373525	1373544
66	21	21	42.1	100.000	21	0.34	0	0	91	91	Vibrio furnissii strain 2013V-1001 chromosome 1, complete sequence	Vibrio furnissii	0	2	22	3041346	3041366
66	21	21	42.1	100.000	21	0.34	0	0	91	91	Vibrio furnissii strain 2419-04 chromosome 1, complete sequence	Vibrio furnissii	0	2	22	1781421	1781441
67	21	21	42.1	100.000	21	0.34	0	0	91	91	PREDICTED: Megalobrama amblycephala uncharacterized LOC125267393 (LOC125267393), mRNA	Megalobrama amblycephala	0	2	22	3816	3836
67	21	21	42.1	100.000	21	0.34	0	0	91	91	PREDICTED: Megalobrama amblycephala uncharacterized LOC125267392 (LOC125267392), mRNA	Megalobrama amblycephala	0	2	22	2732	2752
67	20	20	40.1	100.000	20	1.3	0	0	87	87	Campylobacter corcagiensis strain LMG 27932 chromosome, complete genome	Campylobacter corcagiensis	0	4	23	1137532	1137513
67	20	20	40.1	100.000	20	1.3	0	0	87	87	Aspergillus tanneri Alanine--tRNA ligase (ALA1), partial mRNA	Aspergillus tanneri	0	1	20	232	251
67	20	20	40.1	100.000	20	1.3	0	0	87	87	PREDICTED: Onthophagus taurus alanine--tRNA ligase, cytoplasmic (LOC111418937), mRNA	Onthophagus taurus	0	4	23	522	541
67	20	20	40.1	100.000	20	1.3	0	0	87	87	PREDICTED: Astyanax mexicanus alanyl-tRNA synthetase (aars), transcript variant X6, mRNA	Astyanax mexicanus	0	4	23	310	329
67	20	20	40.1	100.000	20	1.3	0	0	87	87	PREDICTED: Astyanax mexicanus alanyl-tRNA synthetase (aars), transcript variant X5, mRNA	Astyanax mexicanus	0	4	23	329	348
67	20	20	40.1	100.000	20	1.3	0	0	87	87	PREDICTED: Astyanax mexicanus alanyl-tRNA synthetase (aars), transcript variant X4, mRNA	Astyanax mexicanus	0	4	23	361	380
67	20	20	40.1	100.000	20	1.3	0	0	87	87	PREDICTED: Astyanax mexicanus alanyl-tRNA synthetase (aars), transcript variant X3, mRNA	Astyanax mexicanus	0	4	23	359	378
67	20	20	40.1	100.000	20	1.3	0	0	87	87	PREDICTED: Astyanax mexicanus alanyl-tRNA synthetase (aars), transcript variant X2, mRNA	Astyanax mexicanus	0	4	23	908	927
68	23	23	46.1	100.000	23	0.022	0	0	100	100	Polynucleobacter sp. MWH-S4W17 chromosome, complete genome	Polynucleobacter sp. MWH-S4W17	0	1	23	1685720	1685698
68	23	23	46.1	100.000	23	0.022	0	0	100	100	Stylogaster rectinervis isolate 2618 alanyl tRNA transferase (AATS) gene, partial cds	Stylogaster rectinervis	0	1	23	1	23
68	22	22	44.1	100.000	22	0.086	0	0	96	96	Campylobacter lari strain 2014D-0218 chromosome, complete genome	Campylobacter lari	0	2	23	13482	13461
68	20	20	40.1	100.000	20	1.3	0	0	87	87	Campylobacter lari strain SCHS02 chromosome, complete genome	Campylobacter lari	0	4	23	1185513	1185494
68	20	20	40.1	100.000	20	1.3	0	0	87	87	Bemisia tabaci genome assembly, chromosome: 1	Bemisia tabaci	0	4	23	87071760	87071741
68	16	16	32.2	100.000	16	326	0	0	87	70	Bemisia tabaci genome assembly, chromosome: 1	Bemisia tabaci	0	6	21	59636410	59636425
68	20	20	40.1	100.000	20	1.3	0	0	87	87	Polynucleobacter sp. JS-JIR-II-b4 chromosome, complete genome	Polynucleobacter sp. JS-JIR-II-b4	0	1	20	1679242	1679223
68	20	20	40.1	100.000	20	1.3	0	0	87	87	Polynucleobacter sp. MG-6-Vaara-E2 chromosome	Polynucleobacter sp. MG-6-Vaara-E2	0	4	23	1653026	1653007
68	20	20	40.1	100.000	20	1.3	0	0	87	87	Rhagoletis suavis isolate MI_A4 alanyl-tRNA synthetase (AATS) gene, partial cds	Rhagoletis suavis	0	4	23	40	59
68	20	20	40.1	100.000	20	1.3	0	0	87	87	Rhagoletis suavis isolate IA_B3 alanyl-tRNA synthetase (AATS) gene, partial cds	Rhagoletis suavis	0	4	23	43	62
68	20	20	40.1	100.000	20	1.3	0	0	87	87	PREDICTED: Rhopalosiphum maidis alanine--tRNA ligase, cytoplasmic (LOC113553561), mRNA	Rhopalosiphum maidis	0	4	23	478	497
69	23	23	46.1	100.000	23	0.022	0	0	100	100	Vibrio anguillarum strain 4299-E1-R1 chromosome 1	Vibrio anguillarum	0	1	23	2751714	2751692
69	23	23	46.1	100.000	23	0.022	0	0	100	100	Vibrio anguillarum strain PF4-E2-3 chromosome 1	Vibrio anguillarum	0	1	23	2476068	2476046
69	23	23	46.1	100.000	23	0.022	0	0	100	100	Vibrio anguillarum strain PF4-E2-2 chromosome 1	Vibrio anguillarum	0	1	23	2475974	2475952
69	23	23	46.1	100.000	23	0.022	0	0	100	100	Vibrio anguillarum strain PF4-E2-6 chromosome 1	Vibrio anguillarum	0	1	23	2476077	2476055
69	23	23	46.1	100.000	23	0.022	0	0	100	100	Vibrio anguillarum strain PF4-E1-1 chromosome 1	Vibrio anguillarum	0	1	23	2697965	2697943
69	23	23	46.1	100.000	23	0.022	0	0	100	100	Vibrio anguillarum strain PF4-E2-5 chromosome 1	Vibrio anguillarum	0	1	23	2476170	2476148
69	23	23	46.1	100.000	23	0.022	0	0	100	100	Vibrio anguillarum strain PF4-E1-4 chromosome 1	Vibrio anguillarum	0	1	23	2697965	2697943
69	23	23	46.1	100.000	23	0.022	0	0	100	100	Vibrio anguillarum strain PF4-E2-R4 chromosome 1	Vibrio anguillarum	0	1	23	2475898	2475876
69	23	23	46.1	100.000	23	0.022	0	0	100	100	Vibrio anguillarum strain PF4-E1-2 chromosome 1	Vibrio anguillarum	0	1	23	2697969	2697947
69	23	23	46.1	100.000	23	0.022	0	0	100	100	Vibrio anguillarum strain PF4-E2-R1 chromosome 1	Vibrio anguillarum	0	1	23	2476050	2476028
70	23	23	46.1	100.000	23	0.022	0	0	100	100	Toxomerus marginatus isolate 2752 alanyl tRNA transferase (AATS) gene, partial cds	Toxomerus marginatus	0	1	23	1	23
70	23	23	46.1	100.000	23	0.022	0	0	100	100	Australoconops phaeomeros isolate 3097 alanyl tRNA transferase (AATS) gene, partial cds	Australoconops phaeomeros	0	1	23	1	23
70	23	23	46.1	100.000	23	0.022	0	0	100	100	Stylogaster breviventris isolate 2445 alanyl tRNA transferase (AATS) gene, partial cds	Stylogaster breviventris	0	1	23	1	23
70	20	20	40.1	100.000	20	1.3	0	0	87	87	PREDICTED: Pseudochaenichthys georgianus cyclic nucleotide-gated cation channel beta-1-like (LOC117442099), mRNA	Pseudochaenichthys georgianus	0	4	23	249	268
70	20	20	40.1	100.000	20	1.3	0	0	87	87	MAG: Terrestrivirus sp. isolate TEV1 clone Terrestrivirus_7	Terrestrivirus sp.	0	4	23	15446	15465
70	20	20	40.1	100.000	20	1.3	0	0	87	87	PREDICTED: Hippocampus comes alanyl-tRNA synthetase (aars), transcript variant X2, mRNA	Hippocampus comes	0	4	23	371	390
70	20	20	40.1	100.000	20	1.3	0	0	87	87	PREDICTED: Hippocampus comes alanyl-tRNA synthetase (aars), transcript variant X1, mRNA	Hippocampus comes	0	4	23	364	383
70	20	20	40.1	100.000	20	1.3	0	0	87	87	PREDICTED: Cyprinodon variegatus alanine--tRNA ligase, cytoplasmic-like (LOC107081242), mRNA	Cyprinodon variegatus	0	4	23	350	369
70	20	20	40.1	100.000	20	1.3	0	0	87	87	PREDICTED: Cyprinodon variegatus alanine--tRNA ligase, cytoplasmic-like (LOC107081241), mRNA	Cyprinodon variegatus	0	4	23	350	369
70	20	20	40.1	100.000	20	1.3	0	0	87	87	Leishmania panamensis strain MHOM/PA/94/PSC-1 chromosome 33 sequence	Leishmania panamensis	0	1	20	1266031	1266012
71	23	23	46.1	100.000	23	0.022	0	0	100	100	PREDICTED: Scleropages formosus alanyl-tRNA synthetase 2, mitochondrial (aars2), mRNA	Scleropages formosus	0	1	23	340	362
71	23	23	46.1	100.000	23	0.022	0	0	100	100	Scleropages formosus genome assembly, chromosome: 16	Scleropages formosus	0	1	23	17158670	17158692
71	23	23	46.1	100.000	23	0.022	0	0	100	100	PREDICTED: Gouania willdenowi alanyl-tRNA synthetase (aars), mRNA	Gouania willdenowi	0	1	23	394	416
71	23	23	46.1	100.000	23	0.022	0	0	100	100	Anabas testudineus genome assembly, chromosome: 6	Anabas testudineus	0	1	23	5795257	5795235
71	23	23	46.1	100.000	23	0.022	0	0	100	100	Gouania willdenowi genome assembly, chromosome: 6	Gouania willdenowi	0	1	23	57321569	57321547
71	23	23	46.1	100.000	23	0.022	0	0	100	100	PREDICTED: Anabas testudineus alanyl-tRNA synthetase 1 (aars1), mRNA	Anabas testudineus	0	1	23	349	371
71	23	23	46.1	100.000	23	0.022	0	0	100	100	PREDICTED: Oryzias melastigma alanyl-tRNA synthetase 1 (aars1), transcript variant X4, mRNA	Oryzias melastigma	0	1	23	393	415
71	23	23	46.1	100.000	23	0.022	0	0	100	100	PREDICTED: Oryzias melastigma alanyl-tRNA synthetase 1 (aars1), transcript variant X3, mRNA	Oryzias melastigma	0	1	23	393	415
71	23	23	46.1	100.000	23	0.022	0	0	100	100	PREDICTED: Oryzias melastigma alanyl-tRNA synthetase 1 (aars1), transcript variant X2, mRNA	Oryzias melastigma	0	1	23	393	415
71	23	23	46.1	100.000	23	0.022	0	0	100	100	PREDICTED: Oryzias melastigma alanyl-tRNA synthetase 1 (aars1), transcript variant X1, mRNA	Oryzias melastigma	0	1	23	393	415
72	23	23	46.1	100.000	23	0.022	0	0	100	100	Zygosaccharomyces parabailii strain ATCC 60483 chromosome 6, complete sequence	Zygosaccharomyces parabailii	0	1	23	36384	36406
72	23	23	46.1	100.000	23	0.022	0	0	100	100	Zygosaccharomyces parabailii strain ATCC 60483 chromosome 1, complete sequence	Zygosaccharomyces parabailii	0	1	23	183574	183596
72	23	23	46.1	100.000	23	0.022	0	0	100	100	Zygosaccharomyces bailii CLIB 213 genomic, scaffold07	Zygosaccharomyces bailii CLIB 213	0	1	23	452225	452203
72	20	20	40.1	100.000	20	1.3	0	0	87	87	Haemonchus contortus strain NZ_Hco_NP chromosome 1	Haemonchus contortus	0	4	23	76098058	76098077
72	20	16	32.2	95.000	19	326	0	0	87	87	Haemonchus contortus strain NZ_Hco_NP chromosome 1	Haemonchus contortus	1	4	23	76094997	76095016
72	20	20	40.1	100.000	20	1.3	0	0	87	87	PREDICTED: Camelina sativa uncharacterized LOC104722898 (LOC104722898), transcript variant X2, ncRNA	Camelina sativa	0	4	23	660	679
72	20	20	40.1	100.000	20	1.3	0	0	87	87	PREDICTED: Camelina sativa uncharacterized LOC104722898 (LOC104722898), transcript variant X1, ncRNA	Camelina sativa	0	4	23	648	667
72	20	20	40.1	100.000	20	1.3	0	0	87	87	secondary endosymbiont of Trabutina mannipara isolate TRABTM genome assembly, chromosome: I	secondary endosymbiont of Trabutina mannipara	0	4	23	216911	216930
72	20	20	40.1	100.000	20	1.3	0	0	87	87	Dicrocoelium dendriticum genome assembly D_dendriticum_Leon_v1_0_4, scaffold DDEL_contig0049341	Dicrocoelium dendriticum	0	4	23	315	334
72	20	20	40.1	100.000	20	1.3	0	0	87	87	Bacterium isolate Bjer_18-Q3-R1-45_BAT3C.298 chromosome, complete genome	bacterium	0	4	23	332580	332599
72	20	20	40.1	100.000	20	1.3	0	0	87	87	Bacterium isolate Aved_18-Q3-R54-62_BAT3C.210 chromosome, complete genome	bacterium	0	4	23	788543	788562
73	23	23	46.1	100.000	23	0.022	0	0	100	100	Uncultured Gammaproteobacteria bacterium clone uvDeep-PR2-KM13-C171 genomic sequence	uncultured Gammaproteobacteria bacterium	0	1	23	32868	32890
73	22	22	44.1	100.000	22	0.086	0	0	96	96	Telmatherina bonti genome assembly, chromosome: 6	Telmatherina bonti	0	2	23	15664307	15664328
73	22	22	44.1	100.000	22	0.086	0	0	96	96	Eulithis prunata genome assembly, chromosome: 1	Eulithis prunata	0	2	23	5063847	5063868
73	22	22	44.1	100.000	22	0.086	0	0	96	96	Mimas tiliae genome assembly, chromosome: 3	Mimas tiliae	0	2	23	11758104	11758083
73	22	22	44.1	100.000	22	0.086	0	0	96	96	Lymantria monacha genome assembly, chromosome: 3	Lymantria monacha	0	2	23	21043769	21043748
73	20	20	40.1	100.000	20	1.3	0	0	87	87	Phallusia mammillata mRNA for alanine--tRNA ligase, mitochondrial-like (Fars2-001 gene)	Phallusia mammillata	0	4	23	409	428
73	20	20	40.1	100.000	20	1.3	0	0	87	87	Canis lupus familiaris breed Labrador retriever chromosome 12a	Canis lupus familiaris	0	4	23	22367590	22367571
73	20	20	40.1	100.000	20	1.3	0	0	87	87	Canis lupus familiaris breed Labrador retriever chromosome 12b	Canis lupus familiaris	0	4	23	22377635	22377616
73	20	20	40.1	100.000	20	1.3	0	0	87	87	Aquila chrysaetos chrysaetos genome assembly, chromosome: 9	Aquila chrysaetos chrysaetos	0	3	22	44624296	44624315
73	20	20	40.1	100.000	20	1.3	0	0	87	87	Shewanella polaris strain SM1901 chromosome, complete genome	Shewanella polaris	0	4	23	99237	99256
74	23	23	46.1	100.000	23	0.022	0	0	100	100	MAG: Deltaproteobacteria bacterium isolate bin116 chromosome	Deltaproteobacteria bacterium	0	1	23	731694	731716
74	20	20	40.1	100.000	20	1.3	0	0	87	87	PREDICTED: Pantherophis guttatus alanyl-tRNA synthetase 2, mitochondrial (AARS2), transcript variant X2, misc_RNA	Pantherophis guttatus	0	1	20	508	527
74	20	20	40.1	100.000	20	1.3	0	0	87	87	PREDICTED: Pantherophis guttatus alanyl-tRNA synthetase 2, mitochondrial (AARS2), transcript variant X1, mRNA	Pantherophis guttatus	0	1	20	508	527
74	20	20	40.1	100.000	20	1.3	0	0	87	87	PREDICTED: Thamnophis elegans alanyl-tRNA synthetase 2, mitochondrial (AARS2), mRNA	Thamnophis elegans	0	1	20	362	381
74	20	20	40.1	100.000	20	1.3	0	0	87	87	PREDICTED: Pseudonaja textilis alanyl-tRNA synthetase 2, mitochondrial (AARS2), mRNA	Pseudonaja textilis	0	1	20	477	496
74	20	20	40.1	100.000	20	1.3	0	0	87	87	PREDICTED: Notechis scutatus alanyl-tRNA synthetase 2, mitochondrial (AARS2), mRNA	Notechis scutatus	0	1	20	488	507
74	20	20	40.1	100.000	20	1.3	0	0	87	87	PREDICTED: Protobothrops mucrosquamatus alanyl-tRNA synthetase 2, mitochondrial (AARS2), mRNA	Protobothrops mucrosquamatus	0	1	20	314	333
74	20	20	40.1	100.000	20	1.3	0	0	87	87	PREDICTED: Thamnophis sirtalis alanyl-tRNA synthetase 2, mitochondrial (AARS2), transcript variant X2, mRNA	Thamnophis sirtalis	0	1	20	739	758
74	20	20	40.1	100.000	20	1.3	0	0	87	87	PREDICTED: Thamnophis sirtalis alanyl-tRNA synthetase 2, mitochondrial (AARS2), transcript variant X1, mRNA	Thamnophis sirtalis	0	1	20	742	761
74	20	20	40.1	100.000	20	1.3	0	0	87	87	SAR86 cluster bacterium isolate SAR86-D19 chromosome, complete genome	SAR86 cluster bacterium	0	1	20	414963	414982
75	22	22	44.1	100.000	22	0.086	0	0	96	96	Rickettsia endosymbiont of Ceutorhynchus assimilis isolate Rickettsia_endosymbiont_Ceutorhynchus_assimilis genome assembly, chromosome: 1	Rickettsia endosymbiont of Ceutorhynchus assimilis	0	2	23	3380591	3380570
75	20	20	40.1	100.000	20	1.3	0	0	87	87	Steroidobacter denitrificans strain DSM 18526 chromosome, complete genome	Steroidobacter denitrificans	0	4	23	2578731	2578750
75	20	20	40.1	100.000	20	1.3	0	0	87	87	Acidobacteriaceae bacterium ZG23-2 chromosome, complete genome	Acidobacteriaceae bacterium ZG23-2	0	4	23	1450564	1450583
75	20	20	40.1	100.000	20	1.3	0	0	87	87	Filomicrobium sp. isolate ih4 chromosome	Filomicrobium sp.	0	4	23	354851	354870
75	20	20	40.1	100.000	20	1.3	0	0	87	87	Pelobacter carbinolicus DSM 2380, complete genome	Syntrophotalea carbinolica DSM 2380	0	4	23	2832961	2832980
75	20	20	40.1	100.000	20	1.3	0	0	87	87	Heliobacillus mobilis Alanyl-tRNA synthetase gene, partial cds	Heliobacterium mobile	0	4	23	211	230
75	20	20	40.1	100.000	20	1.3	0	0	87	87	Salinimonas iocasae strain KX18D6 chromosome, complete genome	Salinimonas iocasae	0	4	23	2793665	2793646
75	20	20	40.1	100.000	20	1.3	0	0	87	87	Dichelobacter nodosus strain VCS1703A chromosome	Dichelobacter nodosus	0	4	23	305504	305485
75	20	20	40.1	100.000	20	1.3	0	0	87	87	Rhizobium sp. TAL182 chromosome, complete genome	Rhizobium sp. TAL182	0	4	23	2500043	2500024
75	20	20	40.1	100.000	20	1.3	0	0	87	87	Rhizobium sp. N741, complete sequence.	Rhizobium sp. N741	0	4	23	2382238	2382219
76	21	21	42.1	100.000	21	0.34	0	0	91	91	Burkholderia sp. KK1 plasmid pkk1 sequence	Burkholderia sp. KK1	0	1	21	877343	877363
76	21	21	42.1	100.000	21	0.34	0	0	91	91	Burkholderia sp. RPE67 plasmid p1 DNA, complete genome	Burkholderia sp. RPE67	0	1	21	744137	744157
76	21	21	42.1	100.000	21	0.34	0	0	91	91	Burkholderia sp. SFA1 plasmid BSFA1_p1 DNA, complete genome	Burkholderia sp. SFA1	0	1	21	1313401	1313381
76	21	21	42.1	100.000	21	0.34	0	0	91	91	Burkholderia sp. YI23 plasmid byi_1p, complete sequence	Burkholderia sp. YI23	0	1	21	603091	603111
76	20	20	40.1	100.000	20	1.3	0	0	87	87	Myopa tessellatipennis genome assembly, chromosome: X	Myopa tessellatipennis	0	4	23	38549261	38549242
76	20	20	40.1	100.000	20	1.3	0	0	87	87	PREDICTED: Lucilia cuprina alanine--tRNA ligase, cytoplasmic (LOC111686679), mRNA	Lucilia cuprina	0	1	20	379	398
76	20	20	40.1	100.000	20	1.3	0	0	87	87	Endosymbiont of Acanthamoeba sp. UWC8, complete genome	endosymbiont of Acanthamoeba sp. UWC8	0	4	23	177663	177682
76	20	20	40.1	100.000	20	1.3	0	0	87	87	Flavobacterium sp. KSM-R2A25 chromosome, complete genome	Flavobacterium cyclinae	0	4	23	1037811	1037792
76	20	20	40.1	100.000	20	1.3	0	0	87	87	Cerceris rybyensis genome assembly, chromosome: 3	Cerceris rybyensis	0	4	23	19549146	19549127
76	20	20	40.1	100.000	20	1.3	0	0	87	87	Polynucleobacter sp. MWH-UH35A chromosome, complete genome	Polynucleobacter sp. MWH-UH35A	0	4	23	1611582	1611563
77	23	23	46.1	100.000	23	0.022	0	0	100	100	PREDICTED: Monopterus albus alanyl-tRNA synthetase (aars), mRNA	Monopterus albus	0	1	23	352	374
77	23	23	46.1	100.000	23	0.022	0	0	100	100	MAG: Alphaproteobacteria bacterium isolate HK-STAS-PROT-4 chromosome, complete genome	Alphaproteobacteria bacterium	0	1	23	24010	24032
77	23	23	46.1	100.000	23	0.022	0	0	100	100	Patella vulgata genome assembly, chromosome: 3	Patella vulgata	0	1	23	30273306	30273328
77	23	23	46.1	100.000	23	0.022	0	0	100	100	Legionella sp. PC1000 chromosome, complete genome	Legionella sp. PC1000	0	1	23	1650440	1650462
77	23	23	46.1	100.000	23	0.022	0	0	100	100	Patella pellucida genome assembly, chromosome: 4	Patella pellucida	0	1	23	57625667	57625645
77	21	21	42.1	100.000	21	0.34	0	0	91	91	Gymnoscelis rufifasciata genome assembly, chromosome: 25	Gymnoscelis rufifasciata	0	3	23	2632445	2632425
77	20	20	40.1	100.000	20	1.3	0	0	87	87	Tupanvirus soda lake	Tupanvirus soda lake	0	4	23	243901	243920
77	20	20	40.1	100.000	20	1.3	0	0	87	87	PREDICTED: Cottoperca gobio alanyl-tRNA synthetase (aars), transcript variant X3, mRNA	Cottoperca gobio	0	1	20	380	399
77	20	20	40.1	100.000	20	1.3	0	0	87	87	PREDICTED: Cottoperca gobio alanyl-tRNA synthetase (aars), transcript variant X2, mRNA	Cottoperca gobio	0	1	20	451	470
77	20	20	40.1	100.000	20	1.3	0	0	87	87	PREDICTED: Cottoperca gobio alanyl-tRNA synthetase (aars), transcript variant X1, mRNA	Cottoperca gobio	0	1	20	761	780
78	23	23	46.1	100.000	23	0.022	0	0	100	100	Novosphingobium ginsenosidimutans strain FW-6 chromosome, complete genome	Novosphingobium ginsenosidimutans	0	1	23	52385	52363
78	23	23	46.1	100.000	23	0.022	0	0	100	100	Leishmania donovani strain LdCL chromosome LdCL_22, complete sequence	Leishmania donovani	0	1	23	653823	653845
78	23	23	46.1	100.000	23	0.022	0	0	100	100	PREDICTED: Selaginella moellendorffii alanine--tRNA ligase (LOC9629493), mRNA	Selaginella moellendorffii	0	1	23	307	329
78	23	23	46.1	100.000	23	0.022	0	0	100	100	Leishmania infantum strain TR01 isolate Lin_TR01 chromosome 22, complete sequence	Leishmania infantum	0	1	23	580318	580340
78	23	23	46.1	100.000	23	0.022	0	0	100	100	Zymoseptoria tritici ST99CH_3D1 genome assembly, chromosome: ZT3D1_chr_5	Zymoseptoria tritici ST99CH_3D1	0	1	23	1473680	1473702
78	23	23	46.1	100.000	23	0.022	0	0	100	100	Zymoseptoria tritici ST99CH_1E4 genome assembly, chromosome: ZT1E4_chr_5	Zymoseptoria tritici ST99CH_1E4	0	1	23	1218083	1218105
78	23	23	46.1	100.000	23	0.022	0	0	100	100	Leishmania donovani strain pasteur chromosome 22, complete sequence	Leishmania donovani	0	1	23	682091	682113
78	23	23	46.1	100.000	23	0.022	0	0	100	100	Antarctobacter heliothermus strain SMS3 chromosome, complete genome	Antarctobacter heliothermus	0	1	23	3692254	3692232
78	23	23	46.1	100.000	23	0.022	0	0	100	100	Zymoseptoria tritici ST99CH_1A5 genome assembly, chromosome: 5	Zymoseptoria tritici ST99CH_1A5	0	1	23	1271563	1271585
78	23	23	46.1	100.000	23	0.022	0	0	100	100	Zymoseptoria tritici ST99CH_3D7 genome assembly, chromosome: 5	Zymoseptoria tritici ST99CH_3D7	0	1	23	1247383	1247405
79	23	23	46.1	100.000	23	0.022	0	0	100	100	Mytilinidion resinicola uncharacterized protein (BDZ99DRAFT_446119), mRNA	Mytilinidion resinicola	0	1	23	352	374
79	23	23	46.1	100.000	23	0.022	0	0	100	100	PREDICTED: Drosophila ficusphila alanine--tRNA ligase, cytoplasmic (LOC108100966), mRNA	Drosophila ficusphila	0	1	23	351	373
79	23	23	46.1	100.000	23	0.022	0	0	100	100	Thalassospira xiamenensis M-5 = DSM 17429, complete genome	Thalassospira xiamenensis M-5 = DSM 17429	0	1	23	893257	893279
79	23	23	46.1	100.000	23	0.022	0	0	100	100	Shewanella sp. FJAT-52076 chromosome, complete genome	Shewanella sp. FJAT-52076	0	1	23	1216610	1216632
79	23	23	46.1	100.000	23	0.022	0	0	100	100	Shewanella sp. FJAT-52072 chromosome, complete genome	Shewanella sp. FJAT-52072	0	1	23	1309179	1309201
