0	23	23	46.1	100.000	23	0.022	0	0	100	100	PREDICTED: Pseudonaja textilis alanine--tRNA ligase, cytoplasmic-like (LOC113448383), transcript variant X2, mRNA	Pseudonaja textilis	0	1	23	261	283
0	23	23	46.1	100.000	23	0.022	0	0	100	100	PREDICTED: Pseudonaja textilis alanine--tRNA ligase, cytoplasmic-like (LOC113448383), transcript variant X1, mRNA	Pseudonaja textilis	0	1	23	442	464
0	23	23	46.1	100.000	23	0.022	0	0	100	100	PREDICTED: Pseudonaja textilis alanine--tRNA ligase, cytoplasmic (LOC113448312), transcript variant X2, mRNA	Pseudonaja textilis	0	1	23	384	406
0	23	23	46.1	100.000	23	0.022	0	0	100	100	PREDICTED: Pseudonaja textilis alanine--tRNA ligase, cytoplasmic (LOC113448312), transcript variant X1, mRNA	Pseudonaja textilis	0	1	23	400	422
0	23	23	46.1	100.000	23	0.022	0	0	100	100	PREDICTED: Notechis scutatus alanine--tRNA ligase, cytoplasmic-like (LOC113432262), partial mRNA	Notechis scutatus	0	1	23	248	270
0	23	23	46.1	100.000	23	0.022	0	0	100	100	Fusarium venenatum uncharacterized protein (FVRRES_01135), partial mRNA	Fusarium venenatum	0	1	23	502	524
0	23	23	46.1	100.000	23	0.022	0	0	100	100	PREDICTED: Python bivittatus alanyl-tRNA synthetase (AARS), mRNA	Python bivittatus	0	1	23	423	445
0	23	23	46.1	100.000	23	0.022	0	0	100	100	Fusarium venenatum strain A3/5 genome assembly, chromosome: I	Fusarium venenatum	0	1	23	3154139	3154117
0	23	23	46.1	100.000	23	0.022	0	0	100	100	PREDICTED: Protobothrops mucrosquamatus alanyl-tRNA synthetase (AARS), mRNA	Protobothrops mucrosquamatus	0	1	23	349	371
0	23	23	46.1	100.000	23	0.022	0	0	100	100	Meroplius fasciculata alanyl-tRNA synthetase (AATS) gene, partial cds	Meroplius fasciculatus	0	1	23	47	69
1	23	23	46.1	100.000	23	0.022	0	0	100	100	Desulfoglaeba alkanexedens ALDC chromosome, complete genome	Desulfoglaeba alkanexedens ALDC	0	1	23	1310918	1310896
1	23	23	46.1	100.000	23	0.022	0	0	100	100	Luteibacter sp. EIF3 chromosome, complete genome	Luteibacter sp. EIF3	0	1	23	1263348	1263370
1	23	23	46.1	100.000	23	0.022	0	0	100	100	Oscheius tipulae isolate CEW1 chromosome I	Oscheius tipulae	0	1	23	1612607	1612585
1	22	22	44.1	100.000	22	0.086	0	0	96	96	Dissulfurimicrobium hydrothermale strain Sh68 chromosome, complete genome	Dissulfurimicrobium hydrothermale	0	2	23	685347	685368
1	20	20	40.1	100.000	20	1.3	0	0	87	87	Trematosphaeria pertusa alanyl-tRNA synthetase-like protein (BU26DRAFT_420571), partial mRNA	Trematosphaeria pertusa	0	4	23	247	266
1	20	20	40.1	100.000	20	1.3	0	0	87	87	Paracoccus sanguinis strain OM2164 chromosome, complete genome	Paracoccus sanguinis	0	4	23	2619023	2619042
1	20	20	40.1	100.000	20	1.3	0	0	87	87	Parastagonospora nodorum strain Sn79 chromosome 5	Parastagonospora nodorum	0	4	23	1708141	1708160
1	20	20	40.1	100.000	20	1.3	0	0	87	87	PREDICTED: Scaptodrosophila lebanonensis alanine--tRNA ligase, cytoplasmic (LOC115625650), mRNA	Scaptodrosophila lebanonensis	0	4	23	315	334
1	20	20	40.1	100.000	20	1.3	0	0	87	87	Pseudomonas kribbensis strain 46-2 chromosome, complete genome	Pseudomonas kribbensis	0	4	23	4715940	4715921
1	20	20	40.1	100.000	20	1.3	0	0	87	87	Ceraceosorus guamensis hypothetical protein (IE81DRAFT_326108), mRNA	Ceraceosorus guamensis	0	4	23	517	536
2	23	23	46.1	100.000	23	0.022	0	0	100	100	Malassezia restricta strain KCTC 27527 chromosome I, complete sequence	Malassezia restricta	0	1	23	1409751	1409729
2	23	23	46.1	100.000	23	0.022	0	0	100	100	Malassezia restricta CBS 7877 chromosome I, complete sequence	Malassezia restricta CBS 7877	0	1	23	11731	11753
2	23	23	46.1	100.000	23	0.022	0	0	100	100	Malassezia restricta alanyl-tRNA synthetase (MRET_0830), partial mRNA	Malassezia restricta	0	1	23	349	371
2	23	23	46.1	100.000	23	0.022	0	0	100	100	Gluma nitida voucher su3 alanyl-tRNA synthetase (AATS) gene, partial cds	Gluma nitida	0	1	23	75	97
2	23	23	46.1	100.000	23	0.022	0	0	100	100	Ommatius tibialis voucher Asil-305 alanyl-tRNA synthetase (AATS) gene, partial cds	Ommatius tibialis	0	1	23	74	96
2	23	23	46.1	100.000	23	0.022	0	0	100	100	Emphysomera pallidapex voucher Asil-202 alanyl-tRNA synthetase (AATS) gene, partial cds	Emphysomera pallidapex	0	1	23	74	96
2	20	20	40.1	100.000	20	1.3	0	0	87	87	Mythimna albipuncta genome assembly, chromosome: 7	Mythimna albipuncta	0	4	23	11962804	11962823
2	20	20	40.1	100.000	20	1.3	0	0	87	87	Mythimna ferrago genome assembly, chromosome: 10	Mythimna ferrago	0	4	23	13535638	13535657
2	20	20	40.1	100.000	20	1.3	0	0	87	87	Campylobacter concisus strain P10CDO-S2 chromosome, complete genome	Campylobacter concisus	0	4	23	1248665	1248684
2	20	20	40.1	100.000	20	1.3	0	0	87	87	Philodicus tenuipes voucher Asil-83 alanyl-tRNA synthetase (AATS) gene, partial cds	Philodicus tenuipes	0	1	20	74	93
3	19	19	38.2	100.000	19	5.3	0	0	83	83	PREDICTED: Microcebus murinus UFM1 specific peptidase 1 (inactive) (UFSP1), mRNA	Microcebus murinus	0	3	21	898	916
3	23	19	38.2	95.652	22	5.3	0	0	100	100	Haematospirillum jordaniae strain H5569, complete genome	Haematospirillum jordaniae	1	1	23	877446	877468
3	23	19	38.2	95.652	22	5.3	0	0	100	100	PREDICTED: Mesitornis unicolor alanine--tRNA ligase, mitochondrial-like (LOC104539591), partial mRNA	Mesitornis unicolor	1	1	23	130	152
3	23	19	38.2	95.652	22	5.3	0	0	100	100	PREDICTED: Acanthisitta chloris alanyl-tRNA synthetase 2, mitochondrial (AARS2), partial mRNA	Acanthisitta chloris	1	1	23	85	107
3	19	19	38.2	100.000	19	5.3	0	0	83	83	Caprimulgus europaeus genome assembly, chromosome: 6	Caprimulgus europaeus	0	3	21	57292045	57292063
3	23	19	38.2	95.652	22	5.3	0	0	100	100	Citrobacter sp. MGH 55 strain Colony470 chromosome	Citrobacter sp. MGH 55	1	1	23	2425763	2425785
3	19	19	38.2	100.000	19	5.3	0	0	83	83	Sphaeramia orbicularis genome assembly, chromosome: 1	Sphaeramia orbicularis	0	3	21	40464855	40464837
3	19	19	38.2	100.000	19	5.3	0	0	83	83	Melitaea cinxia genome assembly, chromosome: 14	Melitaea cinxia	0	5	23	12733554	12733536
3	23	19	38.2	95.652	22	5.3	0	0	100	100	Candidatus Competibacteraceae bacterium isolate Lyne_18-Q3-R50-59_BATAC.383_cln chromosome, complete genome	Candidatus Competibacteraceae bacterium	1	1	23	3443016	3442994
3	18	18	36.2	100.000	18	21	0	0	78	78	Mariprofundus ferrinatatus strain CP-8 chromosome, complete genome	Mariprofundus ferrinatatus	0	1	18	1569292	1569309
4	20	20	40.1	100.000	20	1.3	0	0	87	87	PREDICTED: Pseudochaenichthys georgianus cyclic nucleotide-gated cation channel beta-1-like (LOC117442099), mRNA	Pseudochaenichthys georgianus	0	4	23	249	268
4	20	20	40.1	100.000	20	1.3	0	0	87	87	MAG: Terrestrivirus sp. isolate TEV1 clone Terrestrivirus_7	Terrestrivirus sp.	0	4	23	15446	15465
4	20	20	40.1	100.000	20	1.3	0	0	87	87	PREDICTED: Aphis gossypii alanine--tRNA ligase, cytoplasmic-like (LOC114123751), transcript variant X2, mRNA	Aphis gossypii	0	1	20	468	487
4	20	20	40.1	100.000	20	1.3	0	0	87	87	PREDICTED: Aphis gossypii alanine--tRNA ligase, cytoplasmic-like (LOC114123751), transcript variant X1, mRNA	Aphis gossypii	0	1	20	464	483
4	20	20	40.1	100.000	20	1.3	0	0	87	87	PREDICTED: Hippocampus comes alanyl-tRNA synthetase (aars), transcript variant X2, mRNA	Hippocampus comes	0	4	23	371	390
4	20	20	40.1	100.000	20	1.3	0	0	87	87	PREDICTED: Hippocampus comes alanyl-tRNA synthetase (aars), transcript variant X1, mRNA	Hippocampus comes	0	4	23	364	383
4	20	20	40.1	100.000	20	1.3	0	0	87	87	PREDICTED: Cyprinodon variegatus alanine--tRNA ligase, cytoplasmic-like (LOC107081242), mRNA	Cyprinodon variegatus	0	4	23	350	369
4	20	20	40.1	100.000	20	1.3	0	0	87	87	PREDICTED: Cyprinodon variegatus alanine--tRNA ligase, cytoplasmic-like (LOC107081241), mRNA	Cyprinodon variegatus	0	4	23	350	369
4	20	20	40.1	100.000	20	1.3	0	0	87	87	Aphis gossypii genome assembly, chromosome: 1	Aphis gossypii	0	1	20	78169059	78169078
4	20	20	40.1	100.000	20	1.3	0	0	87	87	Camelina hispida cultivar hispida voucher DAO 902780 chromosome 2	Camelina hispida	0	3	22	25260374	25260355
5	23	23	46.1	100.000	23	0.022	0	0	100	100	Stonemyia rasa voucher PEET1036 alanyl-tRNA synthetase-like protein (aats1) gene, partial cds	Stonemyia rasa	0	1	23	17	39
5	23	23	46.1	100.000	23	0.022	0	0	100	100	MAG: Vermiphilus pyriformis isolate TW-EDP1-1 chromosome, complete genome	Vermiphilus pyriformis	0	1	23	483075	483097
5	23	23	46.1	100.000	23	0.022	0	0	100	100	Pseudomassariella vexata tRNA synthetases class II (A)-domain-containing protein (BCR38DRAFT_135368), mRNA	Pseudomassariella vexata	0	1	23	299	321
5	23	23	46.1	100.000	23	0.022	0	0	100	100	Neoitamus cyanurus voucher Asil-91 alanyl-tRNA synthetase (AATS) gene, partial cds	Neoitamus cyanurus	0	1	23	74	96
5	20	20	40.1	100.000	20	1.3	0	0	87	87	Wolbachia endosymbiont of Cruorifilaria tuberocauda strain 55YT chromosome, complete genome	Wolbachia endosymbiont of Cruorifilaria tuberocauda	0	4	23	75979	75998
5	20	20	40.1	100.000	20	1.3	0	0	87	87	Pasteurellaceae bacterium RH1A chromosome, complete genome	Pasteurellaceae bacterium RH1A	0	4	23	1270830	1270849
5	20	20	40.1	100.000	20	1.3	0	0	87	87	PREDICTED: Odontomachus brunneus alanine--tRNA ligase, cytoplasmic (LOC116853170), transcript variant X3, mRNA	Odontomachus brunneus	0	4	23	421	440
5	20	20	40.1	100.000	20	1.3	0	0	87	87	PREDICTED: Odontomachus brunneus alanine--tRNA ligase, cytoplasmic (LOC116853170), transcript variant X2, mRNA	Odontomachus brunneus	0	4	23	421	440
5	20	20	40.1	100.000	20	1.3	0	0	87	87	PREDICTED: Odontomachus brunneus alanine--tRNA ligase, cytoplasmic (LOC116853170), transcript variant X1, mRNA	Odontomachus brunneus	0	4	23	416	435
5	20	20	40.1	100.000	20	1.3	0	0	87	87	Pantoea sp. CCBC3-3-1 chromosome, complete genome	Pantoea sp. CCBC3-3-1	0	1	20	3843556	3843537
6	23	23	46.1	100.000	23	0.022	0	0	100	100	Ignatzschineria sp. HR5S32 chromosome, complete genome	Ignatzschineria sp. HR5S32	0	1	23	1175207	1175229
6	21	21	42.1	100.000	21	0.34	0	0	91	91	Pusillimonas thiosulfatoxidans strain YE3 chromosome, complete genome	Pusillimonas thiosulfatoxidans	0	3	23	323813	323793
6	20	20	40.1	100.000	20	1.3	0	0	87	87	PREDICTED: Lucilia cuprina alanine--tRNA ligase, cytoplasmic (LOC111686679), mRNA	Lucilia cuprina	0	4	23	382	401
6	20	20	40.1	100.000	20	1.3	0	0	87	87	Evocoa chilensis alanyl-tRNA synthetase-like protein (aats1) gene, partial cds	Evocoa chilensis	0	4	23	17	36
6	20	20	40.1	100.000	20	1.3	0	0	87	87	Gallibacterium anatis UMN179, complete genome	Gallibacterium anatis UMN179	0	4	23	1706055	1706074
6	16	16	32.2	100.000	16	326	0	0	87	70	Gallibacterium anatis UMN179, complete genome	Gallibacterium anatis UMN179	0	7	22	2439496	2439481
6	20	20	40.1	100.000	20	1.3	0	0	87	87	Aggregatibacter aphrophilus strain W10433, complete genome	Aggregatibacter aphrophilus	0	4	23	340860	340841
6	20	20	40.1	100.000	20	1.3	0	0	87	87	Aggregatibacter aphrophilus NJ8700, complete genome	Aggregatibacter aphrophilus NJ8700	0	4	23	1776507	1776488
6	20	20	40.1	100.000	20	1.3	0	0	87	87	Aggregatibacter aphrophilus NJ8700, complete genome	Aggregatibacter aphrophilus NJ8700	0	4	23	1776402	1776383
6	23	19	38.2	95.652	22	5.3	0	0	100	100	PREDICTED: Archocentrus centrarchus alanyl-tRNA synthetase 2, mitochondrial (aars2), transcript variant X2, mRNA	Archocentrus centrarchus	1	1	23	365	387
6	23	19	38.2	95.652	22	5.3	0	0	100	100	PREDICTED: Archocentrus centrarchus alanyl-tRNA synthetase 2, mitochondrial (aars2), transcript variant X1, mRNA	Archocentrus centrarchus	1	1	23	365	387
7	20	20	40.1	100.000	20	1.3	0	0	87	87	Caenorhabditis elegans strain CB4856 chromosome I	Caenorhabditis elegans	0	4	23	4149728	4149747
7	20	20	40.1	100.000	20	1.3	0	0	87	87	Caenorhabditis elegans genome assembly C_elegans_Bristol_N2_v1_5_4 ,scaffold CELN2_contig0000392	Caenorhabditis elegans	0	4	23	6636	6617
7	20	20	40.1	100.000	20	1.3	0	0	87	87	Caenorhabditis elegans strain CB4856 chromosome I	Caenorhabditis elegans	0	4	23	4136286	4136305
7	20	20	40.1	100.000	20	1.3	0	0	87	87	Caenorhabditis elegans Alanine--tRNA ligase, cytoplasmic (aars-2), mRNA	Caenorhabditis elegans	0	4	23	254	273
7	20	20	40.1	100.000	20	1.3	0	0	87	87	Caenorhabditis elegans Cosmid F28H1, complete sequence	Caenorhabditis elegans	0	4	23	10532	10551
7	20	20	40.1	100.000	20	1.3	0	0	87	87	Caenorhabditis elegans alanyl-tRNA synthetase-like protein AlaRS A mRNA, complete cds	Caenorhabditis elegans	0	4	23	261	280
7	23	19	38.2	95.652	22	5.3	0	0	100	100	Syntrophotalea acetylenivorans strain SFB93 chromosome, complete genome	Syntrophotalea acetylenivorans	1	1	23	3049997	3049975
7	19	19	38.2	100.000	19	5.3	0	0	83	83	Mimumesa dahlbomi genome assembly, chromosome: 14	Mimumesa dahlbomi	0	4	22	2765407	2765389
7	23	19	38.2	95.652	22	5.3	0	0	100	100	Polynucleobacter sp. es-MAR-2 chromosome	Polynucleobacter ibericus	1	1	23	1560175	1560153
7	23	19	38.2	95.652	22	5.3	0	0	100	100	Trichlorobacter lovleyi strain IAE chromosome, complete genome	Trichlorobacter lovleyi	1	1	23	3161607	3161585
8	23	23	46.1	100.000	23	0.022	0	0	100	100	Zygosaccharomyces parabailii strain ATCC 60483 chromosome 6, complete sequence	Zygosaccharomyces parabailii	0	1	23	36384	36406
8	23	23	46.1	100.000	23	0.022	0	0	100	100	Zygosaccharomyces parabailii strain ATCC 60483 chromosome 1, complete sequence	Zygosaccharomyces parabailii	0	1	23	183574	183596
8	23	23	46.1	100.000	23	0.022	0	0	100	100	Zygosaccharomyces bailii CLIB 213 genomic, scaffold07	Zygosaccharomyces bailii CLIB 213	0	1	23	452225	452203
8	20	20	40.1	100.000	20	1.3	0	0	87	87	Haemonchus contortus strain NZ_Hco_NP chromosome 1	Haemonchus contortus	0	4	23	76098058	76098077
8	20	16	32.2	95.000	19	326	0	0	87	87	Haemonchus contortus strain NZ_Hco_NP chromosome 1	Haemonchus contortus	1	4	23	76094997	76095016
8	20	20	40.1	100.000	20	1.3	0	0	87	87	PREDICTED: Camelina sativa uncharacterized LOC104722898 (LOC104722898), transcript variant X2, ncRNA	Camelina sativa	0	4	23	660	679
8	20	20	40.1	100.000	20	1.3	0	0	87	87	PREDICTED: Camelina sativa uncharacterized LOC104722898 (LOC104722898), transcript variant X1, ncRNA	Camelina sativa	0	4	23	648	667
8	20	20	40.1	100.000	20	1.3	0	0	87	87	secondary endosymbiont of Trabutina mannipara isolate TRABTM genome assembly, chromosome: I	secondary endosymbiont of Trabutina mannipara	0	4	23	216911	216930
8	20	20	40.1	100.000	20	1.3	0	0	87	87	Dicrocoelium dendriticum genome assembly D_dendriticum_Leon_v1_0_4, scaffold DDEL_contig0049341	Dicrocoelium dendriticum	0	4	23	315	334
8	20	20	40.1	100.000	20	1.3	0	0	87	87	Bacterium isolate Bjer_18-Q3-R1-45_BAT3C.298 chromosome, complete genome	bacterium	0	4	23	332580	332599
8	20	20	40.1	100.000	20	1.3	0	0	87	87	Bacterium isolate Aved_18-Q3-R54-62_BAT3C.210 chromosome, complete genome	bacterium	0	4	23	788543	788562
9	23	23	46.1	100.000	23	0.022	0	0	100	100	Pasteurella multocida subsp. gallicida strain NCTC10204 genome assembly, chromosome: 1	Pasteurella multocida subsp. gallicida	0	1	23	716636	716658
9	20	20	40.1	100.000	20	1.3	0	0	87	87	PREDICTED: Danaus plexippus plexippus alanine--tRNA ligase, cytoplasmic (LOC116779479), transcript variant X2, mRNA	Danaus plexippus plexippus	0	4	23	328	347
9	20	20	40.1	100.000	20	1.3	0	0	87	87	PREDICTED: Danaus plexippus plexippus alanine--tRNA ligase, cytoplasmic (LOC116779479), transcript variant X1, mRNA	Danaus plexippus plexippus	0	4	23	422	441
9	20	20	40.1	100.000	20	1.3	0	0	87	87	Scleropages formosus genome assembly, chromosome: 16	Scleropages formosus	0	4	23	17060902	17060921
9	20	16	32.2	95.000	19	326	0	0	87	87	Scleropages formosus genome assembly, chromosome: 16	Scleropages formosus	1	4	23	10969567	10969586
9	20	20	40.1	100.000	20	1.3	0	0	87	87	Aspergillus mulundensis Alanine--tRNA ligase (DSM5745_05371), partial mRNA	Aspergillus mulundensis	0	4	23	250	269
9	20	20	40.1	100.000	20	1.3	0	0	87	87	PREDICTED: Loxodonta africana serine incorporator 5 (SERINC5), mRNA	Loxodonta africana	0	4	23	3601	3582
9	20	20	40.1	100.000	20	1.3	0	0	87	87	Kwoniella pini CBS 10737 alanine-tRNA ligase partial mRNA	Kwoniella pini CBS 10737	0	1	20	295	314
9	20	20	40.1	100.000	20	1.3	0	0	87	87	Candidatus Evansia muelleri genome assembly CEM1.1, chromosome : I	Candidatus Evansia muelleri	0	4	23	204115	204096
9	20	20	40.1	100.000	20	1.3	0	0	87	87	MAG: Deltaproteobacteria bacterium isolate bin73 chromosome	Deltaproteobacteria bacterium	0	4	23	1293143	1293162
9	20	20	40.1	100.000	20	1.3	0	0	87	87	Melampsora larici-populina 98AG31 uncharacterized protein (MELLADRAFT_48072), partial mRNA	Melampsora larici-populina 98AG31	0	4	23	268	287
10	20	20	40.1	100.000	20	1.3	0	0	87	87	PREDICTED: Aedes aegypti alanine--tRNA ligase, cytoplasmic (LOC5569067), mRNA	Aedes aegypti	0	1	20	495	514
10	20	20	40.1	100.000	20	1.3	0	0	87	87	PREDICTED: Neodiprion lecontei alanine--tRNA ligase, cytoplasmic (LOC107224250), mRNA	Neodiprion lecontei	0	4	23	390	409
10	20	20	40.1	100.000	20	1.3	0	0	87	87	PREDICTED: Neodiprion virginiana alanine--tRNA ligase, cytoplasmic (LOC124298367), mRNA	N/A	0	4	23	390	409
10	20	20	40.1	100.000	20	1.3	0	0	87	87	PREDICTED: Neodiprion pinetum alanine--tRNA ligase, cytoplasmic (LOC124212786), mRNA	Neodiprion pinetum	0	4	23	390	409
10	20	20	40.1	100.000	20	1.3	0	0	87	87	PREDICTED: Neodiprion fabricii alanine--tRNA ligase, cytoplasmic (LOC124176208), mRNA	Neodiprion fabricii	0	4	23	390	409
10	20	20	40.1	100.000	20	1.3	0	0	87	87	Caenorhabditis remanei CRE-AARS-2 protein (Cre-aars-2) mRNA, complete cds	Caenorhabditis remanei	0	1	20	229	248
10	20	20	40.1	100.000	20	1.3	0	0	87	87	Uncultured bacterium clone CAP_aai00d03 16S ribosomal RNA gene, partial sequence	uncultured bacterium	0	2	21	819	838
10	23	19	38.2	95.652	22	5.3	0	0	100	100	Xylella fastidiosa subsp. multiplex strain LM10 chromosome, complete genome	Xylella fastidiosa subsp. multiplex	1	1	23	119021	119043
10	23	19	38.2	95.652	22	5.3	0	0	100	100	Xylella fastidiosa subsp. multiplex strain RH1 chromosome, complete genome	Xylella fastidiosa subsp. multiplex	1	1	23	119003	119025
10	23	19	38.2	95.652	22	5.3	0	0	100	100	Xylella fastidiosa subsp. multiplex strain Fillmore chromosome, complete genome	Xylella fastidiosa subsp. multiplex	1	1	23	119017	119039
11	23	23	46.1	100.000	23	0.022	0	0	100	100	Phycomyces blakesleeanus NRRL 1555(-) hypothetical protein partial mRNA	Phycomyces blakesleeanus NRRL 1555(-)	0	1	23	190	212
11	23	23	46.1	100.000	23	0.022	0	0	100	100	PREDICTED: Haliotis rufescens alanine--tRNA ligase, cytoplasmic-like (LOC124138246), transcript variant X2, mRNA	Haliotis rufescens	0	1	23	327	349
11	23	23	46.1	100.000	23	0.022	0	0	100	100	PREDICTED: Haliotis rufescens alanine--tRNA ligase, cytoplasmic-like (LOC124138246), transcript variant X1, mRNA	Haliotis rufescens	0	1	23	374	396
11	23	23	46.1	100.000	23	0.022	0	0	100	100	Scathophaga stercoraria alanyl tRNA synthase (AATS) gene, partial cds	Scathophaga stercoraria	0	1	23	79	101
11	23	23	46.1	100.000	23	0.022	0	0	100	100	Scathophaga stercoraria alanyl-tRNA synthetase-like protein (aats1) gene, partial cds	Scathophaga stercoraria	0	1	23	79	101
11	20	20	40.1	100.000	20	1.3	0	0	87	87	Blastomyces gilchristii SLH14081 alanyl-tRNA synthetase (BDBG_00156), partial mRNA	Blastomyces gilchristii SLH14081	0	1	20	577	596
11	20	20	40.1	100.000	20	1.3	0	0	87	87	Desulfosarcina ovata subsp. ovata oXyS1 DNA, complete genome	Desulfosarcina ovata subsp. ovata	0	4	23	137743	137762
11	20	20	40.1	100.000	20	1.3	0	0	87	87	Desulfosarcina ovata subsp. sediminis 28bB2T DNA, complete genome	Desulfosarcina ovata subsp. sediminis	0	4	23	113618	113637
11	20	20	40.1	100.000	20	1.3	0	0	87	87	Cladophialophora immunda alanine-tRNA ligase mRNA	Cladophialophora immunda	0	1	20	747	766
11	20	20	40.1	100.000	20	1.3	0	0	87	87	Bipolaris sorokiniana ND90Pr uncharacterized protein (COCSADRAFT_83417), partial mRNA	Bipolaris sorokiniana ND90Pr	0	4	23	247	266
12	23	23	46.1	100.000	23	0.022	0	0	100	100	Uncultured Desulfobacterium sp. genomic DNA, clone selsg002P03.q1c	uncultured Desulfobacterium sp.	0	1	23	546651	546673
12	21	21	42.1	100.000	21	0.34	0	0	91	91	Blautia wexlerae strain NB2B-9-FAA chromosome	Blautia wexlerae	0	3	23	38538	38518
12	20	20	40.1	100.000	20	1.3	0	0	87	87	Drosophila melanogaster strain rover (forR) chromosome X	Drosophila melanogaster	0	2	21	21389255	21389236
12	20	20	40.1	100.000	20	1.3	0	0	87	87	Drosophila melanogaster strain sitter (fors) chromosome X	Drosophila melanogaster	0	2	21	21389256	21389237
12	20	20	40.1	100.000	20	1.3	0	0	87	87	Drosophila melanogaster chromosome X	Drosophila melanogaster	0	2	21	21518232	21518213
12	20	20	40.1	100.000	20	1.3	0	0	87	87	Drosophila melanogaster clone BACR22O16, complete sequence	Drosophila melanogaster	0	2	21	33063	33044
12	20	20	40.1	100.000	20	1.3	0	0	87	87	Synthetic construct Drosophila melanogaster clone BS12001 encodes Cyp6t1-RA	synthetic construct	0	2	21	923	942
12	20	20	40.1	100.000	20	1.3	0	0	87	87	Synthetic construct Drosophila melanogaster clone BO12401 encodes Cyp6t1-RA	synthetic construct	0	2	21	923	942
12	20	20	40.1	100.000	20	1.3	0	0	87	87	Mitosporidium daphniae uncharacterized protein (DI09_20p220), partial mRNA	Mitosporidium daphniae	0	4	23	322	341
12	20	20	40.1	100.000	20	1.3	0	0	87	87	Drosophila melanogaster Cyp6t1 (Cyp6t1), mRNA	Drosophila melanogaster	0	2	21	987	1006
13	23	23	46.1	100.000	23	0.022	0	0	100	100	Penicilliopsis zonata CBS 506.65 hypothetical protein (ASPZODRAFT_2103593), mRNA	Penicilliopsis zonata CBS 506.65	0	1	23	592	614
13	23	23	46.1	100.000	23	0.022	0	0	100	100	Agrobacterium tumefaciens strain 6N2 chromosome 6N2CC, complete sequence	Agrobacterium tumefaciens	0	1	23	224116	224138
13	23	23	46.1	100.000	23	0.022	0	0	100	100	Brenneria izadpanahii strain Iran 50 chromosome, complete genome	Brenneria izadpanahii	0	1	23	1168537	1168559
13	22	22	44.1	100.000	22	0.086	0	0	100	96	Halomonas sulfidaeris ATCC BAA-803 DNA, complete genome	Halomonas sulfidaeris	0	2	23	1059139	1059118
13	23	19	38.2	95.652	22	5.3	0	0	100	100	Halomonas sulfidaeris ATCC BAA-803 DNA, complete genome	Halomonas sulfidaeris	1	1	23	667954	667976
13	20	20	40.1	100.000	20	1.3	0	0	87	87	Glaesserella parasuis strain HPS412 chromosome, complete genome	Glaesserella parasuis	0	4	23	1303727	1303746
13	20	20	40.1	100.000	20	1.3	0	0	87	87	Acinetobacter sp. 10FS3-1 chromosome, complete genome	Acinetobacter sp. 10FS3-1	0	4	23	1018959	1018940
13	20	20	40.1	100.000	20	1.3	0	0	87	87	Glaesserella parasuis strain YHP170504 chromosome, complete genome	Glaesserella parasuis	0	4	23	1289827	1289808
13	20	20	40.1	100.000	20	1.3	0	0	87	87	Glaesserella parasuis strain aHPS7 chromosome, complete genome	Glaesserella parasuis	0	4	23	1038500	1038519
13	20	20	40.1	100.000	20	1.3	0	0	87	87	Glaesserella parasuis strain sHPS7 chromosome, complete genome	Glaesserella parasuis	0	4	23	465940	465959
13	20	20	40.1	100.000	20	1.3	0	0	87	87	Glaesserella parasuis strain vHPS7 chromosome, complete genome	Glaesserella parasuis	0	4	23	1020580	1020599
14	23	23	46.1	100.000	23	0.022	0	0	100	100	PREDICTED: Scleropages formosus alanyl-tRNA synthetase 2, mitochondrial (aars2), mRNA	Scleropages formosus	0	1	23	340	362
14	23	23	46.1	100.000	23	0.022	0	0	100	100	Scleropages formosus genome assembly, chromosome: 16	Scleropages formosus	0	1	23	17158670	17158692
14	23	23	46.1	100.000	23	0.022	0	0	100	100	PREDICTED: Gouania willdenowi alanyl-tRNA synthetase (aars), mRNA	Gouania willdenowi	0	1	23	394	416
14	23	23	46.1	100.000	23	0.022	0	0	100	100	Anabas testudineus genome assembly, chromosome: 6	Anabas testudineus	0	1	23	5795257	5795235
14	23	23	46.1	100.000	23	0.022	0	0	100	100	Gouania willdenowi genome assembly, chromosome: 6	Gouania willdenowi	0	1	23	57321569	57321547
14	23	23	46.1	100.000	23	0.022	0	0	100	100	PREDICTED: Anabas testudineus alanyl-tRNA synthetase 1 (aars1), mRNA	Anabas testudineus	0	1	23	349	371
14	23	23	46.1	100.000	23	0.022	0	0	100	100	PREDICTED: Oryzias melastigma alanyl-tRNA synthetase 1 (aars1), transcript variant X4, mRNA	Oryzias melastigma	0	1	23	393	415
14	23	23	46.1	100.000	23	0.022	0	0	100	100	PREDICTED: Oryzias melastigma alanyl-tRNA synthetase 1 (aars1), transcript variant X3, mRNA	Oryzias melastigma	0	1	23	393	415
14	23	23	46.1	100.000	23	0.022	0	0	100	100	PREDICTED: Oryzias melastigma alanyl-tRNA synthetase 1 (aars1), transcript variant X2, mRNA	Oryzias melastigma	0	1	23	393	415
14	23	23	46.1	100.000	23	0.022	0	0	100	100	PREDICTED: Oryzias melastigma alanyl-tRNA synthetase 1 (aars1), transcript variant X1, mRNA	Oryzias melastigma	0	1	23	393	415
15	23	23	46.1	100.000	23	0.022	0	0	100	100	Stonemyia rasa voucher PEET1036 alanyl-tRNA synthetase-like protein (aats1) gene, partial cds	Stonemyia rasa	0	1	23	17	39
15	23	23	46.1	100.000	23	0.022	0	0	100	100	MAG: Vermiphilus pyriformis isolate TW-EDP1-1 chromosome, complete genome	Vermiphilus pyriformis	0	1	23	483075	483097
15	23	23	46.1	100.000	23	0.022	0	0	100	100	Pseudomassariella vexata tRNA synthetases class II (A)-domain-containing protein (BCR38DRAFT_135368), mRNA	Pseudomassariella vexata	0	1	23	299	321
15	23	23	46.1	100.000	23	0.022	0	0	100	100	Neoitamus cyanurus voucher Asil-91 alanyl-tRNA synthetase (AATS) gene, partial cds	Neoitamus cyanurus	0	1	23	74	96
15	20	20	40.1	100.000	20	1.3	0	0	87	87	Wolbachia endosymbiont of Cruorifilaria tuberocauda strain 55YT chromosome, complete genome	Wolbachia endosymbiont of Cruorifilaria tuberocauda	0	4	23	75979	75998
15	20	20	40.1	100.000	20	1.3	0	0	87	87	Pasteurellaceae bacterium RH1A chromosome, complete genome	Pasteurellaceae bacterium RH1A	0	4	23	1270830	1270849
15	20	20	40.1	100.000	20	1.3	0	0	87	87	PREDICTED: Odontomachus brunneus alanine--tRNA ligase, cytoplasmic (LOC116853170), transcript variant X3, mRNA	Odontomachus brunneus	0	4	23	421	440
15	20	20	40.1	100.000	20	1.3	0	0	87	87	PREDICTED: Odontomachus brunneus alanine--tRNA ligase, cytoplasmic (LOC116853170), transcript variant X2, mRNA	Odontomachus brunneus	0	4	23	421	440
15	20	20	40.1	100.000	20	1.3	0	0	87	87	PREDICTED: Odontomachus brunneus alanine--tRNA ligase, cytoplasmic (LOC116853170), transcript variant X1, mRNA	Odontomachus brunneus	0	4	23	416	435
15	20	20	40.1	100.000	20	1.3	0	0	87	87	Pantoea sp. CCBC3-3-1 chromosome, complete genome	Pantoea sp. CCBC3-3-1	0	1	20	3843556	3843537
16	23	23	46.1	100.000	23	0.022	0	0	100	100	Nitratiruptor sp. YY09-18 DNA, complete genome	Nitratiruptor sp. YY09-18	0	1	23	1451268	1451246
