110	20	20	40.1	100.000	20	1.3	0	0	87	87	Rhizobium sp. Q54 genome assembly, chromosome: 1	Rhizobium sp. Q54	0	4	23	1302539	1302558
110	17	17	34.2	100.000	17	82	0	0	87	74	Rhizobium sp. Q54 genome assembly, chromosome: 1	Rhizobium sp. Q54	0	4	20	3316932	3316948
110	20	20	40.1	100.000	20	1.3	0	0	87	87	Syntrophotalea acetylenica strain DSM 3246 chromosome, complete genome	Syntrophotalea acetylenica	0	4	23	712197	712178
110	20	20	40.1	100.000	20	1.3	0	0	87	87	Pelobacter acetylenicus strain DSM 3247 genome	Syntrophotalea acetylenica	0	4	23	2014666	2014647
110	20	20	40.1	100.000	20	1.3	0	0	87	87	Labrenzia sp. CP4, complete genome	Labrenzia sp. CP4	0	4	23	2332154	2332173
111	23	23	46.1	100.000	23	0.022	0	0	100	100	Danio aesculapii genome assembly, chromosome: 22	Danio aesculapii	0	1	23	26767779	26767757
111	23	23	46.1	100.000	23	0.022	0	0	100	100	Barbus barbus genome assembly, chromosome: 9	Barbus barbus	0	1	23	11725806	11725784
111	23	23	46.1	100.000	23	0.022	0	0	100	100	Lestomyia fraudiger voucher Asil-125 alanyl-tRNA synthetase (AATS) gene, partial cds	Lestomyia fraudiger	0	1	23	74	96
111	20	20	40.1	100.000	20	1.3	0	0	87	87	Danio rerio genome assembly, chromosome: 22	Danio rerio	0	4	23	25157190	25157209
111	20	20	40.1	100.000	20	1.3	0	0	87	87	PREDICTED: Myripristis murdjan alanyl-tRNA synthetase 1 (aars1), mRNA	Myripristis murdjan	0	1	20	378	397
111	20	20	40.1	100.000	20	1.3	0	0	87	87	Myripristis murdjan genome assembly, chromosome: 6	Myripristis murdjan	0	1	20	31675100	31675081
111	20	20	40.1	100.000	20	1.3	0	0	87	87	PREDICTED: Diabrotica virgifera virgifera alanine--tRNA ligase, cytoplasmic (LOC114340801), transcript variant X2, mRNA	Diabrotica virgifera virgifera	0	4	23	453	472
111	20	20	40.1	100.000	20	1.3	0	0	87	87	PREDICTED: Diabrotica virgifera virgifera alanine--tRNA ligase, cytoplasmic (LOC114340801), transcript variant X1, mRNA	Diabrotica virgifera virgifera	0	4	23	458	477
111	20	20	40.1	100.000	20	1.3	0	0	87	87	PREDICTED: Danio rerio alanyl-tRNA synthetase 2, mitochondrial (putative) (aars2), transcript variant X1, mRNA	Danio rerio	0	4	23	358	377
111	20	20	40.1	100.000	20	1.3	0	0	87	87	PREDICTED: Danio rerio alanyl-tRNA synthetase 2, mitochondrial (putative) (aars2), transcript variant X2, mRNA	Danio rerio	0	4	23	355	374
112	23	23	46.1	100.000	23	0.022	0	0	100	100	Kosakonia cowanii strain Esp_Z genome	Kosakonia cowanii	0	1	23	4030963	4030941
112	23	23	46.1	100.000	23	0.022	0	0	100	100	Kosakonia cowanii strain Pa82 chromosome, complete genome	Kosakonia cowanii	0	1	23	1041457	1041479
112	23	23	46.1	100.000	23	0.022	0	0	100	100	PREDICTED: Sander lucioperca alanine--tRNA ligase, cytoplasmic (LOC116053005), mRNA	Sander lucioperca	0	1	23	374	396
112	20	20	40.1	100.000	20	1.3	0	0	87	87	Moraxella cuniculi strain NCTC10297 genome assembly, chromosome: 1	Moraxella cuniculi	0	1	20	1190431	1190412
112	20	20	40.1	100.000	20	1.3	0	0	87	87	Aspergillus heteromorphus CBS 117.55 uncharacterized protein (BO70DRAFT_366943), mRNA	Aspergillus heteromorphus CBS 117.55	0	1	20	119	138
112	20	20	40.1	100.000	20	1.3	0	0	87	87	Phaeobacter gallaeciensis strain P63 chromosome, complete genome	Phaeobacter gallaeciensis	0	4	23	1893634	1893615
112	20	20	40.1	100.000	20	1.3	0	0	87	87	Phaeobacter gallaeciensis strain P128 chromosome, complete genome	Phaeobacter gallaeciensis	0	4	23	1841372	1841353
112	20	20	40.1	100.000	20	1.3	0	0	87	87	Phaeobacter gallaeciensis strain P129 chromosome, complete genome	Phaeobacter gallaeciensis	0	4	23	1841372	1841353
112	20	20	40.1	100.000	20	1.3	0	0	87	87	Phaeobacter gallaeciensis strain P75 chromosome, complete genome	Phaeobacter gallaeciensis	0	4	23	1929052	1929033
112	20	20	40.1	100.000	20	1.3	0	0	87	87	Phaeobacter gallaeciensis strain P73 chromosome, complete genome	Phaeobacter gallaeciensis	0	4	23	2010948	2010967
113	23	23	46.1	100.000	23	0.022	0	0	100	100	Cronobacter sp. JZ38, complete genome	Cronobacter sp. JZ38	0	1	23	1184937	1184959
113	23	23	46.1	100.000	23	0.022	0	0	100	100	Neisseria mucosa strain ATCC 19696 chromosome, complete genome	Neisseria mucosa	0	1	23	1168935	1168957
113	23	23	46.1	100.000	23	0.022	0	0	100	100	Cronobacter muytjensii ATCC 51329, complete genome	Cronobacter muytjensii ATCC 51329	0	1	23	610902	610924
113	23	23	46.1	100.000	23	0.022	0	0	100	100	Eikenella corrodens strain FDAARGOS_1474 chromosome, complete genome	Eikenella corrodens	0	1	23	1377054	1377076
113	23	23	46.1	100.000	23	0.022	0	0	100	100	Oppiella nova	Oppiella nova	0	1	23	40832	40854
113	23	23	46.1	100.000	23	0.022	0	0	100	100	Oppiella nova	Oppiella nova	0	1	23	50742	50764
113	23	23	46.1	100.000	23	0.022	0	0	100	100	Neisseria sicca strain DSM 17713 chromosome, complete genome	Neisseria sicca	0	1	23	685362	685384
113	23	23	46.1	100.000	23	0.022	0	0	100	100	Sulfitobacter sp. JL08 chromosome, complete genome	Sulfitobacter sp. JL08	0	1	23	2130789	2130767
113	23	23	46.1	100.000	23	0.022	0	0	100	100	Eikenella corrodens strain NCTC10596 genome assembly, chromosome: 1	Eikenella corrodens	0	1	23	1876536	1876514
113	23	23	46.1	100.000	23	0.022	0	0	100	100	Verrucomicrobia bacterium IMCC26134, complete genome	Verrucomicrobia bacterium IMCC26134	0	1	23	829246	829224
113	23	23	46.1	100.000	23	0.022	0	0	100	100	Trachurus trachurus genome assembly, chromosome: 1	Trachurus trachurus	0	1	23	40317357	40317335
114	23	23	46.1	100.000	23	0.022	0	0	100	100	PREDICTED: Cottoperca gobio alanyl-tRNA synthetase (aars), transcript variant X3, mRNA	Cottoperca gobio	0	1	23	380	402
114	23	23	46.1	100.000	23	0.022	0	0	100	100	PREDICTED: Cottoperca gobio alanyl-tRNA synthetase (aars), transcript variant X2, mRNA	Cottoperca gobio	0	1	23	451	473
114	23	23	46.1	100.000	23	0.022	0	0	100	100	PREDICTED: Cottoperca gobio alanyl-tRNA synthetase (aars), transcript variant X1, mRNA	Cottoperca gobio	0	1	23	761	783
114	23	23	46.1	100.000	23	0.022	0	0	100	100	Cottoperca gobio genome assembly, chromosome: 6	Cottoperca gobio	0	1	23	6040172	6040194
114	23	23	46.1	100.000	23	0.022	0	0	100	100	PREDICTED: Thunnus albacares alanyl-tRNA synthetase 1 (aars1), mRNA	Thunnus albacares	0	1	23	349	371
114	23	23	46.1	100.000	23	0.022	0	0	100	100	Thunnus albacares genome assembly, chromosome: 7	Thunnus albacares	0	1	23	3247796	3247818
114	23	23	46.1	100.000	23	0.022	0	0	100	100	PREDICTED: Thunnus maccoyii alanyl-tRNA synthetase 1 (aars1), mRNA	Thunnus maccoyii	0	1	23	349	371
114	23	23	46.1	100.000	23	0.022	0	0	100	100	Thunnus maccoyii genome assembly, chromosome: 5	Thunnus maccoyii	0	1	23	32278297	32278275
114	20	20	40.1	100.000	20	1.3	0	0	87	87	PREDICTED: Gymnodraco acuticeps alanyl-tRNA synthetase 1 (aars1), transcript variant X2, mRNA	Gymnodraco acuticeps	0	4	23	312	331
114	20	20	40.1	100.000	20	1.3	0	0	87	87	PREDICTED: Gymnodraco acuticeps alanyl-tRNA synthetase 1 (aars1), transcript variant X1, mRNA	Gymnodraco acuticeps	0	4	23	366	385
115	22	22	44.1	100.000	22	0.086	0	0	96	96	[Candida] auris strain B11245 chromosome 3	[Candida] auris	0	2	23	845536	845557
115	22	22	44.1	100.000	22	0.086	0	0	96	96	PREDICTED: Formica exsecta alanine--tRNA ligase, cytoplasmic (LOC115234825), transcript variant X2, mRNA	Formica exsecta	0	2	23	693	714
115	22	22	44.1	100.000	22	0.086	0	0	96	96	PREDICTED: Formica exsecta alanine--tRNA ligase, cytoplasmic (LOC115234825), transcript variant X1, mRNA	Formica exsecta	0	2	23	416	437
115	22	22	44.1	100.000	22	0.086	0	0	96	96	PREDICTED: Nylanderia fulva alanine--tRNA ligase, cytoplasmic (LOC114945308), mRNA	Nylanderia fulva	0	2	23	400	421
115	22	22	44.1	100.000	22	0.086	0	0	96	96	Campylobacter sp. RM8964 chromosome, complete genome	Campylobacter sp. RM8964	0	2	23	1170108	1170129
115	22	22	44.1	100.000	22	0.086	0	0	96	96	PREDICTED: Hyalella azteca alanine--tRNA ligase, cytoplasmic (LOC108668177), mRNA	Hyalella azteca	0	2	23	353	374
115	22	22	44.1	100.000	22	0.086	0	0	96	96	Calamotropha paludella genome assembly, chromosome: 4	Calamotropha paludella	0	2	23	16649391	16649370
115	22	22	44.1	100.000	22	0.086	0	0	96	96	[Candida] auris strain B12342 chromosome 3	[Candida] auris	0	2	23	897386	897365
115	21	21	42.1	100.000	21	0.34	0	0	91	91	PREDICTED: Mesocricetus auratus dentin sialophosphoprotein-like (LOC110340767), mRNA	Mesocricetus auratus	0	3	23	3371	3351
115	20	20	40.1	100.000	20	1.3	0	0	87	87	Wolbachia endosymbiont of Dipetalonema caudispina strain 362YU chromosome, complete genome	Wolbachia endosymbiont of Dipetalonema caudispina	0	4	23	804907	804926
116	23	23	46.1	100.000	23	0.022	0	0	100	100	Pasteurellaceae bacterium RH1A chromosome, complete genome	Pasteurellaceae bacterium RH1A	0	1	23	1270827	1270849
116	23	23	46.1	100.000	23	0.022	0	0	100	100	PREDICTED: Dendronephthya gigantea alanine--tRNA ligase, cytoplasmic-like (LOC114516481), mRNA	Dendronephthya gigantea	0	1	23	378	400
116	23	23	46.1	100.000	23	0.022	0	0	100	100	Candidatus Erwinia sp. (ex Cinara spp.) strain ErCicuneomaculata genome assembly, chromosome: 1	Candidatus Erwinia haradaeae	0	1	23	864424	864446
116	23	23	46.1	100.000	23	0.022	0	0	100	100	Agarilytica rhodophyticola strain 017 chromosome, complete genome	Agarilytica rhodophyticola	0	1	23	1274714	1274736
116	23	23	46.1	100.000	23	0.022	0	0	100	100	PREDICTED: Protopterus annectens alanyl-tRNA synthetase 2, mitochondrial (AARS2), transcript variant X2, mRNA	Protopterus annectens	0	1	23	1	23
116	23	23	46.1	100.000	23	0.022	0	0	100	100	PREDICTED: Protopterus annectens alanyl-tRNA synthetase 2, mitochondrial (AARS2), transcript variant X1, mRNA	Protopterus annectens	0	1	23	571	593
116	23	23	46.1	100.000	23	0.022	0	0	100	100	Paramyia nitens alanyl tRNA synthase (AATS) gene, partial cds	Paramyia nitens	0	1	23	63	85
116	23	23	46.1	100.000	23	0.022	0	0	100	100	Paramyia nitens alanyl-tRNA synthetase-like protein (aats1) gene, partial cds	Paramyia nitens	0	1	23	63	85
116	22	22	44.1	100.000	22	0.086	0	0	96	96	Wolbachia endosymbiont of Cruorifilaria tuberocauda strain 55YT chromosome, complete genome	Wolbachia endosymbiont of Cruorifilaria tuberocauda	0	2	23	75977	75998
116	22	22	44.1	100.000	22	0.086	0	0	96	96	PREDICTED: Odontomachus brunneus alanine--tRNA ligase, cytoplasmic (LOC116853170), transcript variant X3, mRNA	Odontomachus brunneus	0	2	23	419	440
117	20	20	40.1	100.000	20	1.3	0	0	87	87	Polynucleobacter asymbioticus strain UK-Long2-W17 chromosome	Polynucleobacter asymbioticus	0	4	23	1756149	1756130
117	20	20	40.1	100.000	20	1.3	0	0	87	87	Idiomarina abyssalis strain MSP-CT chromosome, complete genome	Idiomarina abyssalis	0	4	23	1703358	1703339
117	23	19	38.2	95.652	22	5.3	0	0	100	100	Saccharobesus litoralis strain CCB-QB4 chromosome, complete genome	Saccharobesus litoralis	1	1	23	4579733	4579711
117	23	19	38.2	95.652	22	5.3	0	0	100	100	MAG: Verrucomicrobia bacterium isolate LL51 chromosome, complete genome	Verrucomicrobia bacterium	1	1	23	151631	151609
117	19	19	38.2	100.000	19	5.3	0	0	83	83	Zygotorulaspora mrakii uncharacterized protein (HG535_0E02630), partial mRNA	Zygotorulaspora mrakii	0	2	20	242	260
117	19	19	38.2	100.000	19	5.3	0	0	83	83	Zygotorulaspora mrakii strain NRRL Y-6702 chromosome 5	Zygotorulaspora mrakii	0	2	20	559062	559080
117	23	19	38.2	95.652	22	5.3	0	0	100	100	Colwellia psychrerythraea 34H chromosome, complete genome	Colwellia psychrerythraea 34H	1	1	23	1068990	1069012
117	18	18	36.2	100.000	18	21	0	0	78	78	Pontibacter russatus strain BT326 chromosome, complete genome	Pontibacter russatus	0	1	18	4096325	4096308
117	16	16	32.2	100.000	16	326	0	0	78	70	Pontibacter russatus strain BT326 chromosome, complete genome	Pontibacter russatus	0	2	17	847196	847211
117	18	18	36.2	100.000	18	21	0	0	78	78	Nannochloropsis oceanica strain BR2 chromosome 28	Nannochloropsis oceanica	0	2	19	326576	326559
117	18	18	36.2	100.000	18	21	0	0	78	78	Nannochloropsis oceanica strain KB1 chromosome 28	Nannochloropsis oceanica	0	2	19	314612	314595
118	20	20	40.1	100.000	20	1.3	0	0	87	87	Erithacus rubecula genome assembly, chromosome: 4	Erithacus rubecula	0	2	21	18874918	18874937
118	20	16	32.2	95.000	19	326	0	0	87	87	Erithacus rubecula genome assembly, chromosome: 4	Erithacus rubecula	1	2	21	41781145	41781164
118	20	20	40.1	100.000	20	1.3	0	0	87	87	PREDICTED: Pecten maximus alanine--tRNA ligase, cytoplasmic-like (LOC117338364), mRNA	Pecten maximus	0	4	23	309	328
118	20	20	40.1	100.000	20	1.3	0	0	87	87	PREDICTED: Megalopta genalis alanine--tRNA ligase, cytoplasmic (LOC117224440), mRNA	Megalopta genalis	0	4	23	457	476
118	20	20	40.1	100.000	20	1.3	0	0	87	87	Pecten maximus genome assembly, chromosome: 11	Pecten maximus	0	4	23	31733029	31733010
118	20	20	40.1	100.000	20	1.3	0	0	87	87	PREDICTED: Chanos chanos alanyl-tRNA synthetase 1 (aars1), mRNA	Chanos chanos	0	4	23	307	326
118	20	20	40.1	100.000	20	1.3	0	0	87	87	Chanos chanos genome assembly, chromosome: 2	Chanos chanos	0	4	23	35794138	35794157
118	20	20	40.1	100.000	20	1.3	0	0	87	87	Exophiala lecanii-corni strain CBS 102400 chromosome 1, complete sequence	Exophiala lecanii-corni	0	4	23	1213318	1213299
118	20	20	40.1	100.000	20	1.3	0	0	87	87	PREDICTED: Cynoglossus semilaevis alanyl-tRNA synthetase 2, mitochondrial (aars2), mRNA	Cynoglossus semilaevis	0	4	23	465	484
118	20	20	40.1	100.000	20	1.3	0	0	87	87	Chlamydia sp. H15-1957-10C genome assembly, chromosome: I	Chlamydia serpentis	0	4	23	993664	993645
118	20	20	40.1	100.000	20	1.3	0	0	87	87	Silvius variegatus voucher PEET1095 alanyl-tRNA synthetase-like protein (aats1) gene, partial cds	Silvius variegatus	0	4	23	55	74
119	20	20	40.1	100.000	20	1.3	0	0	87	87	PREDICTED: Hyposmocoma kahamanoa alanine--tRNA ligase, cytoplasmic (LOC113234747), mRNA	Hyposmocoma kahamanoa	0	4	23	372	391
119	20	20	40.1	100.000	20	1.3	0	0	87	87	Agriotes lineatus genome assembly, chromosome: 10	Agriotes lineatus	0	4	23	52499441	52499460
119	20	20	40.1	100.000	20	1.3	0	0	87	87	Mimas tiliae genome assembly, chromosome: 25	Mimas tiliae	0	4	23	5305654	5305673
119	23	19	38.2	95.652	22	5.3	0	0	100	100	Polynucleobacter asymbioticus strain UK-Long2-W17 chromosome	Polynucleobacter asymbioticus	1	1	23	1756152	1756130
119	23	19	38.2	95.652	22	5.3	0	0	100	100	Chlamydia psittaci strain AMK chromosome, complete genome	Chlamydia psittaci	1	1	23	450009	450031
119	23	19	38.2	95.652	22	5.3	0	0	100	100	Chlamydia psittaci strain Rostinovo-70 chromosome, complete genome	Chlamydia psittaci	1	1	23	450029	450051
119	23	19	38.2	95.652	22	5.3	0	0	100	100	Chlamydia psittaci strain Ful127 chromosome, complete genome	Chlamydia psittaci	1	1	23	1000528	1000550
119	23	19	38.2	95.652	22	5.3	0	0	100	100	[Pasteurella] aerogenes strain NCTC13378 genome assembly, chromosome: 1	[Pasteurella] aerogenes	1	1	23	1809996	1809974
119	23	19	38.2	95.652	22	5.3	0	0	100	100	Halomonas sp. 'Soap Lake #6' chromosome, complete genome	Halomonas sp. 'Soap Lake #6'	1	1	23	2818956	2818934
119	23	19	38.2	95.652	22	5.3	0	0	100	100	Chlamydia psittaci strain Horse_pl chromosome	Chlamydia psittaci	1	1	23	998784	998806
120	23	23	46.1	100.000	23	0.022	0	0	100	100	Chlamydiaceae bacterium 14-2711_R47 genome assembly, chromosome: 14-2711_R47_omosome	Chlamydiifrater phoenicopteri	0	1	23	1171730	1171708
120	23	23	46.1	100.000	23	0.022	0	0	100	100	Gilliamella sp. ESL0443 chromosome, complete genome	Gilliamella sp. ESL0443	0	1	23	1713569	1713591
120	22	22	44.1	100.000	22	0.086	0	0	96	96	Chironomus tepperi alanyl tRNA synthase (AATS) gene, partial cds	Chironomus tepperi	0	2	23	77	98
120	22	22	44.1	100.000	22	0.086	0	0	96	96	Chironomus tepperi alanyl-tRNA synthetase-like protein (aats1) gene, partial cds	Chironomus tepperi	0	2	23	80	101
120	20	20	40.1	100.000	20	1.3	0	0	87	87	Pasteurella multocida strain NCTC8282 genome assembly, chromosome: 1	Pasteurella multocida	0	4	23	1815704	1815685
120	20	20	40.1	100.000	20	1.3	0	0	87	87	Pasteurella dagmatis strain NCTC11617 genome assembly, chromosome: 1	Pasteurella dagmatis	0	4	23	1716760	1716741
120	20	20	40.1	100.000	20	1.3	0	0	87	87	Rickettsia bellii isolate An04, complete genome	Rickettsia bellii	0	4	23	534789	534770
120	20	20	40.1	100.000	20	1.3	0	0	87	87	PREDICTED: Austrofundulus limnaeus dedicator of cytokinesis protein 7-like (LOC106528971), transcript variant X3, mRNA	Austrofundulus limnaeus	0	4	23	2663	2644
120	20	20	40.1	100.000	20	1.3	0	0	87	87	PREDICTED: Austrofundulus limnaeus dedicator of cytokinesis protein 7-like (LOC106528971), transcript variant X2, mRNA	Austrofundulus limnaeus	0	4	23	2648	2629
120	20	20	40.1	100.000	20	1.3	0	0	87	87	PREDICTED: Austrofundulus limnaeus dedicator of cytokinesis protein 7-like (LOC106528971), transcript variant X1, mRNA	Austrofundulus limnaeus	0	4	23	2663	2644
121	23	23	46.1	100.000	23	0.022	0	0	100	100	Gilliamella apicola strain wkB11 alanyl-tRNA synthetase (alaS) gene, complete cds	Gilliamella apicola	0	1	23	205	227
121	23	23	46.1	100.000	23	0.022	0	0	100	100	Rickettsiella endosymbiont of Dermanyssus gallinae isolate DGE chromosome, complete genome	Rickettsiella endosymbiont of Dermanyssus gallinae	0	1	23	1452965	1452943
121	20	20	40.1	100.000	20	1.3	0	0	87	87	Neptunomonas concharum strain JCM17730 chromosome, complete genome	Neptunomonas concharum	0	4	23	616315	616334
121	20	20	40.1	100.000	20	1.3	0	0	87	87	Candidatus Rickettsiella viridis DNA, complete genome, strain: Ap-RA04	Candidatus Rickettsiella viridis	0	4	23	347862	347881
121	20	20	40.1	100.000	20	1.3	0	0	87	87	Vavraia culicis subsp. floridensis alanine-tRNA ligase partial mRNA	Vavraia culicis subsp. floridensis	0	1	20	220	239
121	20	20	40.1	100.000	20	1.3	0	0	87	87	Halomonas sp. FeN2 chromosome, complete genome	Halomonas sp. FeN2	0	4	23	3322663	3322682
121	20	20	40.1	100.000	20	1.3	0	0	87	87	Suillus clintonianus tRNA synthetases class II (A)-domain-containing protein (DEU56DRAFT_847778), mRNA	Suillus clintonianus	0	4	23	336	355
121	20	20	40.1	100.000	20	1.3	0	0	87	87	PREDICTED: Jatropha curcas alanine--tRNA ligase (LOC105628923), mRNA	Jatropha curcas	0	4	23	482	501
121	20	20	40.1	100.000	20	1.3	0	0	87	87	Halomonas sp. KO116, complete genome	Halomonas sp. KO116	0	4	23	3887253	3887234
121	20	20	40.1	100.000	20	1.3	0	0	87	87	Helicobacter cetorum MIT 99-5656, complete genome	Helicobacter cetorum MIT 99-5656	0	4	23	698989	698970
122	23	23	46.1	100.000	23	0.022	0	0	100	100	Enterobacter sp. EA-1 chromosome, complete genome	Enterobacter sp. EA-1	0	1	23	1136149	1136171
122	23	23	46.1	100.000	23	0.022	0	0	100	100	Candidatus Enterovibrio luxaltus isolate CC26 chromosome 1	Candidatus Enterovibrio luxaltus	0	1	23	1228407	1228385
122	23	23	46.1	100.000	23	0.022	0	0	100	100	Enterobacter sp. FY-07, complete genome	Enterobacter sp. FY-07	0	1	23	1118919	1118941
122	23	23	46.1	100.000	23	0.022	0	0	100	100	Gibbula magus genome assembly, chromosome: 11	Gibbula magus	0	1	23	38979194	38979172
122	23	23	46.1	100.000	23	0.022	0	0	100	100	Neisseriaceae bacterium isolate HaMa chromosome, complete genome	Neisseriaceae bacterium	0	1	23	785234	785212
122	23	23	46.1	100.000	23	0.022	0	0	100	100	Sulfurimonas autotrophica DSM 16294, complete genome	Sulfurimonas autotrophica DSM 16294	0	1	23	1882056	1882034
122	20	20	40.1	100.000	20	1.3	0	0	87	87	Acinetobacter nosocomialis strain AC1530 chromosome, complete genome	Acinetobacter nosocomialis	0	1	20	1294478	1294459
122	20	20	40.1	100.000	20	1.3	0	0	87	87	Acinetobacter nosocomialis strain J1A chromosome, complete genome	Acinetobacter nosocomialis	0	1	20	2588207	2588226
122	20	20	40.1	100.000	20	1.3	0	0	87	87	Wolbachia endosymbiont of Drosophila ananassae strain W2.1 chromosome, complete genome	Wolbachia endosymbiont of Drosophila ananassae	0	4	23	863374	863355
122	20	20	40.1	100.000	20	1.3	0	0	87	87	Wolbachia pipientis strain wMel_ZH26 chromosome, complete genome	Wolbachia pipientis	0	4	23	835610	835591
123	23	23	46.1	100.000	23	0.022	0	0	100	100	Tremella mesenterica DSM 1558 uncharacterized protein (TREMEDRAFT_34057), partial mRNA	Tremella mesenterica DSM 1558	0	1	23	292	314
123	23	23	46.1	100.000	23	0.022	0	0	100	100	Polygonum aviculare genome assembly, chromosome: 7	Polygonum aviculare	0	1	23	2158895	2158873
123	22	22	44.1	100.000	22	0.086	0	0	96	96	Candidatus Campylobacter infans strain 19S00001 chromosome, complete genome	Candidatus Campylobacter infans	0	2	23	793265	793244
123	20	20	40.1	100.000	20	1.3	0	0	87	87	TPA_exp: Gynuella sunshinyii YC6258 gynuellalide biosynthetic and tartrolon biosynthetic gene clusters, complete sequence	Gynuella sunshinyii YC6258	0	4	23	2272200	2272219
123	20	20	40.1	100.000	20	1.3	0	0	87	87	Cutaneotrichosporon oleaginosum putative alanine-tRNA ligase (CC85DRAFT_326488), mRNA	Cutaneotrichosporon oleaginosum	0	4	23	534	553
123	20	20	40.1	100.000	20	1.3	0	0	87	87	Gynuella sunshinyii YC6258, complete genome	Gynuella sunshinyii YC6258	0	4	23	2579200	2579219
123	20	20	40.1	100.000	20	1.3	0	0	87	87	Suillus subaureus tRNA synthetases class II (A)-domain-containing protein (BJ212DRAFT_1453215), partial mRNA	Suillus subaureus	0	4	23	244	263
123	20	20	40.1	100.000	20	1.3	0	0	87	87	Suillus subalutaceus tRNA synthetases class II (A)-domain-containing protein (DFJ58DRAFT_812772), mRNA	Suillus subalutaceus	0	4	23	356	375
123	20	20	40.1	100.000	20	1.3	0	0	87	87	Suillus bovinus tRNA synthetases class II (A)-domain-containing protein (EDB93DRAFT_1196012), mRNA	Suillus bovinus	0	4	23	336	355
123	20	20	40.1	100.000	20	1.3	0	0	87	87	Shewanella piezotolerans WP3, complete genome	Shewanella piezotolerans WP3	0	4	23	1389413	1389432
124	22	22	44.1	100.000	22	0.086	0	0	96	96	Eupithecia abbreviata genome assembly, chromosome: 2	Eupithecia abbreviata	0	2	23	8083499	8083478
124	22	22	44.1	100.000	22	0.086	0	0	100	96	Tinea semifulvella genome assembly, chromosome: 29	Tinea semifulvella	0	2	23	4482783	4482804
124	20	16	32.2	95.000	19	326	0	0	100	87	Tinea semifulvella genome assembly, chromosome: 29	Tinea semifulvella	1	1	20	1188086	1188067
124	22	22	44.1	100.000	22	0.086	0	0	96	96	Lycaena phlaeas genome assembly, chromosome: 1	Lycaena phlaeas	0	2	23	18718240	18718219
124	22	22	44.1	100.000	22	0.086	0	0	96	96	Sulfurovum indicum strain ST-419 chromosome, complete genome	Sulfurovum indicum	0	2	23	1881515	1881494
124	21	21	42.1	100.000	21	0.34	0	0	91	91	Pan troglodytes BAC CH251-321B1 from chromosome, complete sequence	Pan troglodytes	0	2	22	48758	48738
124	21	21	42.1	100.000	21	0.34	0	0	91	91	Macaca mulatta BAC CH250-157F17 (Children's Hospital Oakland Research Institute Rhesus macaque Adult Male BAC Library) complete sequence	Macaca mulatta	0	2	22	123060	123080
124	21	21	42.1	100.000	21	0.34	0	0	91	91	Human DNA sequence from clone GS1-273L24 on chromosome X, complete sequence	Homo sapiens	0	2	22	68883	68863
124	21	21	42.1	100.000	21	0.34	0	0	91	91	Pan troglodytes BAC clone CH251-347C9 from chromosome unknown, complete sequence	Pan troglodytes	0	2	22	40277	40297
124	21	21	42.1	100.000	21	0.34	0	0	91	91	Pan troglodytes chromosome X clone PTB-014B08 map Xq28, complete sequence	Pan troglodytes	0	2	22	11550	11570
124	20	20	40.1	100.000	20	1.3	0	0	87	87	Helicobacter pylori DNA, complete genome, strain: PMSS1	Helicobacter pylori	0	1	20	268570	268589
125	23	23	46.1	100.000	23	0.022	0	0	100	100	PREDICTED: Penaeus vannamei alanine--tRNA ligase, cytoplasmic-like (LOC113801275), transcript variant X2, mRNA	Penaeus vannamei	0	1	23	248	270
125	23	23	46.1	100.000	23	0.022	0	0	100	100	PREDICTED: Penaeus vannamei alanine--tRNA ligase, cytoplasmic-like (LOC113801275), transcript variant X1, mRNA	Penaeus vannamei	0	1	23	315	337
125	23	23	46.1	100.000	23	0.022	0	0	100	100	Alternaria alternata hypothetical protein partial mRNA	Alternaria alternata	0	1	23	244	266
125	23	23	46.1	100.000	23	0.022	0	0	100	100	Aureobasidium subglaciale EXF-2481 hypothetical protein partial mRNA	Aureobasidium subglaciale EXF-2481	0	1	23	247	269
125	23	23	46.1	100.000	23	0.022	0	0	100	100	Alternaria atra uncharacterized protein (ALTATR162_LOCUS7612), partial mRNA	Alternaria atra	0	1	23	244	266
125	23	23	46.1	100.000	23	0.022	0	0	100	100	Conops chinensis isolate 1768 alanyl tRNA transferase (AATS) gene, partial cds	Conops chinensis	0	1	23	1	23
125	23	23	46.1	100.000	23	0.022	0	0	100	100	Alternaria burnsii alanyl-trna synthetase (GT037_006736), partial mRNA	Alternaria burnsii	0	1	23	244	266
125	23	23	46.1	100.000	23	0.022	0	0	100	100	PREDICTED: Rhipicephalus microplus alanine--tRNA ligase, cytoplasmic-like (LOC119177103), mRNA	Rhipicephalus microplus	0	1	23	374	396
125	22	22	44.1	100.000	22	0.086	0	0	96	96	Aureobasidium melanogenum strain TN3-1 chromosome 12	Aureobasidium melanogenum	0	1	22	1876287	1876308
125	22	22	44.1	100.000	22	0.086	0	0	96	96	Aureobasidium melanogenum strain TN3-1 chromosome 11	Aureobasidium melanogenum	0	1	22	1820951	1820972
126	20	20	40.1	100.000	20	1.3	0	0	87	87	Thermosulfidibacter takaii ABI70S6 DNA, complete genome	Thermosulfidibacter takaii ABI70S6	0	4	23	1566623	1566604
126	20	20	40.1	100.000	20	1.3	0	0	87	87	Campylobacter concisus strain ATCC 33237 chromosome, complete genome	Campylobacter concisus	0	4	23	1225473	1225492
126	20	20	40.1	100.000	20	1.3	0	0	87	87	Cyberlindnera sargentensis strain SHA 17.2 chromosome IV	Cyberlindnera sargentensis	0	4	23	423722	423741
126	20	20	40.1	100.000	20	1.3	0	0	87	87	Campylobacter concisus strain P11CDO-S1 chromosome, complete genome	Campylobacter concisus	0	4	23	1160428	1160447
126	20	20	40.1	100.000	20	1.3	0	0	87	87	Philodicus tenuipes voucher Asil-83 alanyl-tRNA synthetase (AATS) gene, partial cds	Philodicus tenuipes	0	4	23	77	96
126	23	19	38.2	95.652	22	5.3	0	0	100	100	Vibrio mimicus strain 07-2442 chromosome 1, complete sequence	Vibrio mimicus	1	1	23	537981	537959
126	23	19	38.2	95.652	22	5.3	0	0	100	100	Vibrio mimicus strain 2011V-1073 chromosome 1, complete sequence	Vibrio mimicus	1	1	23	658130	658108
126	23	19	38.2	95.652	22	5.3	0	0	100	100	Cronobacter sakazakii strain CFSAN068773 chromosome, complete genome	Cronobacter sakazakii	1	1	23	1454349	1454327
126	23	19	38.2	95.652	22	5.3	0	0	100	100	Vibrio cholerae strain RFB05 chromosome 1, complete sequence	Vibrio cholerae	1	1	23	529305	529283
126	23	19	38.2	95.652	22	5.3	0	0	100	100	Formicincola oecophyllae strain F3b2 chromosome, complete genome	Formicincola oecophyllae	1	1	23	1449108	1449086
