32	23	23	46.1	100.000	23	0.022	0	0	100	100	Haematopota singularis voucher PEET1077 alanyl-tRNA synthetase-like protein (aats1) gene, partial cds	Haematopota singularis	0	1	23	52	74
32	20	20	40.1	100.000	20	1.3	0	0	87	87	MAG: Desulfobacterales bacterium isolate bin233 chromosome	Desulfobacterales bacterium	0	1	20	1886846	1886827
32	20	20	40.1	100.000	20	1.3	0	0	87	87	Blastobasis lacticolella genome assembly, chromosome: 7	Blastobasis lacticolella	0	2	21	17568339	17568320
32	20	20	40.1	100.000	20	1.3	0	0	87	87	Homo sapiens chromosome 8, clone RP11-770E5, complete sequence	Homo sapiens	0	4	23	176899	176880
32	20	20	40.1	100.000	20	1.3	0	0	87	87	Shewanella sp. Arc9-LZ chromosome, complete genome	Shewanella sp. Arc9-LZ	0	4	23	1318151	1318170
32	20	20	40.1	100.000	20	1.3	0	0	87	87	MAG: Desulfobacterales bacterium isolate bin747 chromosome	Desulfobacterales bacterium	0	1	20	2210492	2210511
32	20	20	40.1	100.000	20	1.3	0	0	87	87	Blastobasis adustella genome assembly, chromosome: 6	Blastobasis adustella	0	2	21	4033840	4033859
32	20	20	40.1	100.000	20	1.3	0	0	87	87	Homo sapiens chromosome 8, clone CTC-789J18, complete sequence	Homo sapiens	0	4	23	130213	130232
32	23	19	38.2	95.652	22	5.3	0	0	100	100	Thalassobius gelatinovorus strain NEB572 chromosome, complete genome	Thalassobius gelatinovorus	1	1	23	50202	50224
32	19	19	38.2	100.000	19	5.3	0	0	83	83	Acytostelium subglobosum LB1 hypothetical protein partial mRNA	Acytostelium subglobosum LB1	0	2	20	332	350
33	23	23	46.1	100.000	23	0.022	0	0	100	100	Alcaligenes faecalis strain Mc250 chromosome	Alcaligenes faecalis	0	1	23	2543344	2543322
33	23	23	46.1	100.000	23	0.022	0	0	100	100	Rugosibacter aromaticivorans strain Ca6 chromosome, complete genome	Rugosibacter aromaticivorans	0	1	23	2759866	2759888
33	23	23	46.1	100.000	23	0.022	0	0	100	100	Vitreoscilla massiliensis strain SN4 chromosome, complete genome	Vitreoscilla massiliensis	0	1	23	813627	813605
33	23	23	46.1	100.000	23	0.022	0	0	100	100	Polynucleobacter sp. JS-Mosq-20-D10 chromosome	Polynucleobacter sp. JS-Mosq-20-D10	0	1	23	1697786	1697764
33	23	23	46.1	100.000	23	0.022	0	0	100	100	Danio rerio strain T5D chromosome 18	Danio rerio	0	1	23	18642992	18642970
33	23	23	46.1	100.000	23	0.022	0	0	100	100	PREDICTED: Carcharodon carcharias alanyl-tRNA synthetase 2, mitochondrial (putative) (aars2), mRNA	Carcharodon carcharias	0	1	23	328	350
33	23	23	46.1	100.000	23	0.022	0	0	100	100	Spelobia bifrons alanyl tRNA synthase (AATS) gene, partial cds	Spelobia bifrons	0	1	23	43	65
33	23	23	46.1	100.000	23	0.022	0	0	100	100	Telostylinus sp. BMW-2012 alanyl-tRNA synthetase-like protein (aats1) gene, partial cds	Telostylinus sp. BMW-2012	0	1	23	76	98
33	23	23	46.1	100.000	23	0.022	0	0	100	100	Spelobia bifrons alanyl-tRNA synthetase-like protein (aats1) gene, partial cds	Spelobia bifrons	0	1	23	43	65
33	23	23	46.1	100.000	23	0.022	0	0	100	100	Mannheimia varigena strain F222 chromosome, complete genome	Mannheimia varigena	0	1	23	792904	792926
34	23	23	46.1	100.000	23	0.022	0	0	100	100	Candidatus Evansia muelleri genome assembly CEM1.1, chromosome : I	Candidatus Evansia muelleri	0	1	23	204118	204096
34	22	22	44.1	100.000	22	0.086	0	0	96	96	MAG: Deltaproteobacteria bacterium isolate bin73 chromosome	Deltaproteobacteria bacterium	0	2	23	1293141	1293162
34	20	20	40.1	100.000	20	1.3	0	0	87	87	PREDICTED: Loxodonta africana serine incorporator 5 (SERINC5), mRNA	Loxodonta africana	0	4	23	3601	3582
34	20	20	40.1	100.000	20	1.3	0	0	87	87	Pammene fasciana genome assembly, chromosome: 5	Pammene fasciana	0	4	23	12691058	12691039
34	20	20	40.1	100.000	20	1.3	0	0	87	87	Cydia splendana genome assembly, chromosome: 5	Cydia splendana	0	4	23	13826940	13826921
34	20	20	40.1	100.000	20	1.3	0	0	87	87	Deilephila porcellus genome assembly, chromosome: 4	Deilephila porcellus	0	4	23	9029018	9028999
34	20	20	40.1	100.000	20	1.3	0	0	87	87	Encephalitozoon intestinalis ATCC 50506 chromosome II, complete sequence	Encephalitozoon intestinalis ATCC 50506	0	4	23	169788	169769
34	20	20	40.1	100.000	20	1.3	0	0	87	87	PREDICTED: Zootoca vivipara zinc finger DHHC-type palmitoyltransferase 3 (ZDHHC3), transcript variant X2, mRNA	Zootoca vivipara	0	2	21	1569	1588
34	20	20	40.1	100.000	20	1.3	0	0	87	87	PREDICTED: Danaus plexippus plexippus alanine--tRNA ligase, cytoplasmic (LOC116779479), transcript variant X2, mRNA	Danaus plexippus plexippus	0	4	23	328	347
34	20	20	40.1	100.000	20	1.3	0	0	87	87	PREDICTED: Danaus plexippus plexippus alanine--tRNA ligase, cytoplasmic (LOC116779479), transcript variant X1, mRNA	Danaus plexippus plexippus	0	4	23	422	441
35	22	22	44.1	100.000	22	0.086	0	0	96	96	Flexistipes sinusarabici DSM 4947, complete genome	Flexistipes sinusarabici DSM 4947	0	2	23	1662013	1662034
35	21	21	42.1	100.000	21	0.34	0	0	91	91	PREDICTED: Capra hircus prune homolog 2 (PRUNE2), transcript variant X6, mRNA	Capra hircus	0	3	23	8936	8916
35	21	21	42.1	100.000	21	0.34	0	0	91	91	PREDICTED: Capra hircus prune homolog 2 (PRUNE2), transcript variant X5, mRNA	Capra hircus	0	3	23	8936	8916
35	21	21	42.1	100.000	21	0.34	0	0	91	91	PREDICTED: Capra hircus prune homolog 2 (PRUNE2), transcript variant X4, mRNA	Capra hircus	0	3	23	8927	8907
35	21	21	42.1	100.000	21	0.34	0	0	91	91	PREDICTED: Capra hircus prune homolog 2 (PRUNE2), transcript variant X3, mRNA	Capra hircus	0	3	23	8927	8907
35	21	21	42.1	100.000	21	0.34	0	0	91	91	PREDICTED: Capra hircus prune homolog 2 (PRUNE2), transcript variant X2, mRNA	Capra hircus	0	3	23	8936	8916
35	21	21	42.1	100.000	21	0.34	0	0	91	91	PREDICTED: Capra hircus prune homolog 2 (PRUNE2), transcript variant X1, mRNA	Capra hircus	0	3	23	8936	8916
35	21	21	42.1	100.000	21	0.34	0	0	91	91	PREDICTED: Miniopterus natalensis prune homolog 2 (Drosophila) (PRUNE2), transcript variant X2, mRNA	Miniopterus natalensis	0	3	23	621	601
35	21	21	42.1	100.000	21	0.34	0	0	91	91	PREDICTED: Miniopterus natalensis prune homolog 2 (Drosophila) (PRUNE2), transcript variant X1, mRNA	Miniopterus natalensis	0	3	23	8927	8907
35	21	21	42.1	100.000	21	0.34	0	0	91	91	PREDICTED: Condylura cristata prune homolog 2 (Drosophila) (PRUNE2), transcript variant X3, mRNA	Condylura cristata	0	3	23	8981	8961
36	23	23	46.1	100.000	23	0.022	0	0	100	100	Trematosphaeria pertusa alanyl-tRNA synthetase-like protein (BU26DRAFT_420571), partial mRNA	Trematosphaeria pertusa	0	1	23	244	266
36	23	23	46.1	100.000	23	0.022	0	0	100	100	Paracoccus sanguinis strain OM2164 chromosome, complete genome	Paracoccus sanguinis	0	1	23	2619020	2619042
36	23	23	46.1	100.000	23	0.022	0	0	100	100	Parastagonospora nodorum strain Sn79 chromosome 5	Parastagonospora nodorum	0	1	23	1708138	1708160
36	23	23	46.1	100.000	23	0.022	0	0	100	100	PREDICTED: Scaptodrosophila lebanonensis alanine--tRNA ligase, cytoplasmic (LOC115625650), mRNA	Scaptodrosophila lebanonensis	0	1	23	312	334
36	23	23	46.1	100.000	23	0.022	0	0	100	100	Pseudomonas kribbensis strain 46-2 chromosome, complete genome	Pseudomonas kribbensis	0	1	23	4715943	4715921
36	23	23	46.1	100.000	23	0.022	0	0	100	100	Parastagonospora nodorum isolate Sn79-1087 chromosome 5, complete sequence	Parastagonospora nodorum	0	1	23	1727682	1727704
36	23	23	46.1	100.000	23	0.022	0	0	100	100	Parastagonospora nodorum isolate Sn2000 chromosome 5 sequence	Parastagonospora nodorum	0	1	23	180281	180259
36	23	23	46.1	100.000	23	0.022	0	0	100	100	Parastagonospora nodorum isolate LDN03-Sn4 chromosome 5, complete sequence	Parastagonospora nodorum	0	1	23	1826611	1826633
36	23	23	46.1	100.000	23	0.022	0	0	100	100	Immundisolibacter cernigliae strain TR3.2 chromosome, complete genome	Immundisolibacter cernigliae	0	1	23	2100864	2100886
36	23	23	46.1	100.000	23	0.022	0	0	100	100	Bipolaris victoriae FI3 hypothetical protein partial mRNA	Bipolaris victoriae FI3	0	1	23	244	266
37	20	20	40.1	100.000	20	1.3	0	0	87	87	PREDICTED: Diaphorina citri alanine--tRNA ligase-like (LOC113471080), mRNA	Diaphorina citri	0	1	20	233	252
37	20	20	40.1	100.000	20	1.3	0	0	87	87	Idiomarina piscisalsi strain 10PY1A chromosome, complete genome	Idiomarina piscisalsi	0	1	20	894299	894318
37	20	20	40.1	100.000	20	1.3	0	0	87	87	Candidatus Profftella armatura strain YCPA, complete genome	Candidatus Profftella armatura	0	1	20	392211	392230
37	20	20	40.1	100.000	20	1.3	0	0	87	87	Candidatus Blochmannia pennsylvanicus isolate B_Penn7 chromosome, complete genome	Candidatus Blochmannia pennsylvanicus	0	1	20	328014	328033
37	20	20	40.1	100.000	20	1.3	0	0	87	87	Alistipes finegoldii CE91-St15 DNA, complete genome	Alistipes finegoldii	0	3	22	521246	521227
37	20	20	40.1	100.000	20	1.3	0	0	87	87	Bathycoccus prasinos alanyl-tRNA synthetase (Bathy08g04370), partial mRNA	Bathycoccus prasinos	0	4	23	961	980
37	20	20	40.1	100.000	20	1.3	0	0	87	87	PREDICTED: Clupea harengus alanine--tRNA ligase, mitochondrial-like (LOC116219243), transcript variant X3, mRNA	Clupea harengus	0	4	23	709	728
37	20	20	40.1	100.000	20	1.3	0	0	87	87	PREDICTED: Clupea harengus alanine--tRNA ligase, mitochondrial-like (LOC116219243), transcript variant X2, mRNA	Clupea harengus	0	4	23	713	732
37	20	20	40.1	100.000	20	1.3	0	0	87	87	PREDICTED: Clupea harengus alanine--tRNA ligase, mitochondrial-like (LOC116219243), transcript variant X1, mRNA	Clupea harengus	0	4	23	713	732
37	20	20	40.1	100.000	20	1.3	0	0	87	87	Candidatus Profftella armatura, complete genome	Candidatus Profftella armatura	0	1	20	394043	394062
38	23	23	46.1	100.000	23	0.022	0	0	100	100	Mycoavidus sp. B2-EB DNA, complete genome	Mycoavidus sp. B2-EB	0	1	23	181455	181477
38	22	22	44.1	100.000	22	0.086	0	0	96	96	Ananas comosus var. bracteatus genome assembly, chromosome: 3	Ananas comosus var. bracteatus	0	2	23	11155421	11155442
38	22	22	44.1	100.000	22	0.086	0	0	96	96	Ananas comosus var. bracteatus genome assembly, chromosome: 3	Ananas comosus var. bracteatus	0	2	23	11541248	11541227
38	22	22	44.1	100.000	22	0.086	0	0	96	96	Ananas comosus genome assembly, chromosome: 23	Ananas comosus	0	2	23	2727800	2727779
38	22	22	44.1	100.000	22	0.086	0	0	96	96	Ananas comosus genome assembly, chromosome: 21	Ananas comosus	0	2	23	7392454	7392433
38	20	20	40.1	100.000	20	1.3	0	0	87	87	Deefgea sp. D17 chromosome, complete genome	Deefgea piscis	0	1	20	83719	83738
38	20	20	40.1	100.000	20	1.3	0	0	87	87	PREDICTED: Drosophila busckii ATP-dependent DNA/RNA helicase DHX36 (LOC108607396), mRNA	Drosophila busckii	0	2	21	685	704
38	20	20	40.1	100.000	20	1.3	0	0	87	87	Gluconobacter thailandicus strain HD924 chromosome, complete genome	Gluconobacter thailandicus	0	1	20	1946195	1946176
38	20	20	40.1	100.000	20	1.3	0	0	87	87	Serratia sp. FDAARGOS_506 chromosome, complete genome	Serratia sp. FDAARGOS_506	0	1	20	2302633	2302652
38	20	20	40.1	100.000	20	1.3	0	0	87	87	Drosophila busckii chromosome 2L sequence	Drosophila busckii	0	2	21	32094761	32094742
38	20	20	40.1	100.000	20	1.3	0	0	87	87	Methylophaga pinxianii strain TMB1265 chromosome, complete genome	Methylophaga pinxianii	0	4	23	2058058	2058077
39	23	23	46.1	100.000	23	0.022	0	0	100	100	PREDICTED: Metaseiulus occidentalis alanine--tRNA ligase, cytoplasmic (LOC100906515), mRNA	Galendromus occidentalis	0	1	23	223	245
39	23	23	46.1	100.000	23	0.022	0	0	100	100	Telmatherina bonti genome assembly, chromosome: 2	Telmatherina bonti	0	1	23	9061849	9061827
39	16	16	32.2	100.000	16	326	0	0	100	70	Telmatherina bonti genome assembly, chromosome: 2	Telmatherina bonti	0	7	22	35135812	35135797
39	23	23	46.1	100.000	23	0.022	0	0	100	100	Brachyptera putata genome assembly, chromosome: 4	Brachyptera putata	0	1	23	13907115	13907137
39	22	22	44.1	100.000	22	0.086	0	0	96	96	Neostethus bicornis genome assembly, chromosome: 6	Neostethus bicornis	0	2	23	6581487	6581466
39	22	22	44.1	100.000	22	0.086	0	0	96	96	PREDICTED: Labrus bergylta alanyl-tRNA synthetase (aars), transcript variant X4, mRNA	Labrus bergylta	0	2	23	278	299
39	22	22	44.1	100.000	22	0.086	0	0	96	96	PREDICTED: Labrus bergylta alanyl-tRNA synthetase (aars), transcript variant X3, mRNA	Labrus bergylta	0	2	23	390	411
39	22	22	44.1	100.000	22	0.086	0	0	96	96	PREDICTED: Labrus bergylta alanyl-tRNA synthetase (aars), transcript variant X2, mRNA	Labrus bergylta	0	2	23	451	472
39	22	22	44.1	100.000	22	0.086	0	0	96	96	PREDICTED: Labrus bergylta alanyl-tRNA synthetase (aars), transcript variant X1, mRNA	Labrus bergylta	0	2	23	332	353
39	21	21	42.1	100.000	21	0.34	0	0	91	91	Pholis gunnellus genome assembly, chromosome: 16	Pholis gunnellus	0	2	22	6332279	6332299
39	17	17	34.2	100.000	17	82	0	0	91	74	Pholis gunnellus genome assembly, chromosome: 16	Pholis gunnellus	0	3	19	13294038	13294054
39	20	20	40.1	100.000	20	1.3	0	0	87	87	PREDICTED: Etheostoma cragini alanine--tRNA ligase, cytoplasmic-like (LOC117948433), mRNA	Etheostoma cragini	0	4	23	377	396
40	23	23	46.1	100.000	23	0.022	0	0	100	100	Coxiella burnetii strain RSA439 chromosome, complete genome	Coxiella burnetii	0	1	23	970800	970778
40	23	23	46.1	100.000	23	0.022	0	0	100	100	Coxiella burnetii strain nine mile phase II chromosome, complete genome	Coxiella burnetii	0	1	23	1255605	1255583
40	23	23	46.1	100.000	23	0.022	0	0	100	100	Coxiella burnetii strain 2014-PE-15890 chromosome, complete genome	Coxiella burnetii	0	1	23	1642395	1642373
40	23	23	46.1	100.000	23	0.022	0	0	100	100	Coxiella burnetii str. Schperling chromosome	Coxiella burnetii str. Schperling	0	1	23	741718	741740
40	23	23	46.1	100.000	23	0.022	0	0	100	100	Coxiella burnetii strain Heizberg chromosome	Coxiella burnetii	0	1	23	765422	765444
40	23	23	46.1	100.000	23	0.022	0	0	100	100	Coxiella burnetii strain Henzerling chromosome	Coxiella burnetii	0	1	23	765319	765341
40	23	23	46.1	100.000	23	0.022	0	0	100	100	Coxiella burnetii strain 18430 chromosome	Coxiella burnetii	0	1	23	983417	983395
40	23	23	46.1	100.000	23	0.022	0	0	100	100	Coxiella burnetii strain 2574 chromosome	Coxiella burnetii	0	1	23	983046	983024
40	23	23	46.1	100.000	23	0.022	0	0	100	100	Coxiella burnetii strain 701CbB1 chromosome	Coxiella burnetii	0	1	23	983511	983489
40	23	23	46.1	100.000	23	0.022	0	0	100	100	Coxiella burnetii strain 14160-001 chromosome	Coxiella burnetii	0	1	23	983354	983332
41	23	23	46.1	100.000	23	0.022	0	0	100	100	Aspergillus alliaceus tRNA synthetases class II (A)-domain-containing protein (BDW43DRAFT_302583), partial mRNA	Aspergillus alliaceus	0	1	23	403	425
41	23	23	46.1	100.000	23	0.022	0	0	100	100	Oceanisphaera avium strain AMac2203 chromosome, complete genome	Oceanisphaera avium	0	1	23	2773431	2773453
41	23	23	46.1	100.000	23	0.022	0	0	100	100	Edwardsiella hoshinae strain ATCC 35051, complete genome	Edwardsiella hoshinae	0	1	23	683955	683977
41	23	23	46.1	100.000	23	0.022	0	0	100	100	Pasteurella canis strain HL_NV12211 chromosome, complete genome	Pasteurella canis	0	1	23	2005231	2005253
41	23	23	46.1	100.000	23	0.022	0	0	100	100	Pasteurella canis strain HL_D3081 chromosome, complete genome	Pasteurella canis	0	1	23	2059917	2059939
41	23	23	46.1	100.000	23	0.022	0	0	100	100	Pasteurella canis strain HL_D1250 chromosome, complete genome	Pasteurella canis	0	1	23	2085753	2085775
41	23	23	46.1	100.000	23	0.022	0	0	100	100	Pasteurella canis strain HL1500 chromosome, complete genome	Pasteurella canis	0	1	23	1974620	1974642
41	23	23	46.1	100.000	23	0.022	0	0	100	100	Pasteurella canis strain HL268 chromosome, complete genome	Pasteurella canis	0	1	23	2087798	2087820
41	23	23	46.1	100.000	23	0.022	0	0	100	100	Pectobacterium atrosepticum strain Green1 chromosome, complete genome	Pectobacterium atrosepticum	0	1	23	1181143	1181165
41	23	23	46.1	100.000	23	0.022	0	0	100	100	Aspergillus flavus NRRL3357 uncharacterized protein (G4B84_011672), partial mRNA	Aspergillus flavus NRRL3357	0	1	23	559	581
42	23	23	46.1	100.000	23	0.022	0	0	100	100	PREDICTED: Callorhinchus milii alanyl-tRNA synthetase 1 (aars1), mRNA	Callorhinchus milii	0	1	23	248	270
42	20	20	40.1	100.000	20	1.3	0	0	87	87	Neorickettsia findlayensis strain Fin17 chromosome, complete genome	Neorickettsia findlayensis	0	4	23	126343	126324
42	20	20	40.1	100.000	20	1.3	0	0	87	87	PREDICTED: Trichogramma pretiosum alanine--tRNA ligase, cytoplasmic (LOC106657638), transcript variant X2, mRNA	Trichogramma pretiosum	0	4	23	320	339
42	20	20	40.1	100.000	20	1.3	0	0	87	87	PREDICTED: Trichogramma pretiosum alanine--tRNA ligase, cytoplasmic (LOC106657638), transcript variant X1, mRNA	Trichogramma pretiosum	0	4	23	332	351
42	20	20	40.1	100.000	20	1.3	0	0	87	87	PREDICTED: Helicoverpa armigera alanine--tRNA ligase, cytoplasmic (LOC110375446), mRNA	Helicoverpa armigera	0	4	23	396	415
42	20	20	40.1	100.000	20	1.3	0	0	87	87	PREDICTED: Latimeria chalumnae alanyl-tRNA synthetase (AARS), mRNA	Latimeria chalumnae	0	4	23	405	424
42	20	20	40.1	100.000	20	1.3	0	0	87	87	PREDICTED: Trichogramma pretiosum alanine--tRNA ligase, cytoplasmic (LOC106657638), transcript variant X3, mRNA	Trichogramma pretiosum	0	4	23	282	301
42	20	20	40.1	100.000	20	1.3	0	0	87	87	Tholera decimalis genome assembly, chromosome: 5	Tholera decimalis	0	4	23	26290315	26290296
42	20	20	40.1	100.000	20	1.3	0	0	87	87	Brachylomia viminalis genome assembly, chromosome: 8	Brachylomia viminalis	0	4	23	14790533	14790514
42	20	20	40.1	100.000	20	1.3	0	0	87	87	Xylocampa areola genome assembly, chromosome: 4	Xylocampa areola	0	4	23	10137696	10137715
43	23	23	46.1	100.000	23	0.022	0	0	100	100	Aspergillus alliaceus tRNA synthetases class II (A)-domain-containing protein (BDW43DRAFT_302583), partial mRNA	Aspergillus alliaceus	0	1	23	403	425
43	23	23	46.1	100.000	23	0.022	0	0	100	100	Oceanisphaera avium strain AMac2203 chromosome, complete genome	Oceanisphaera avium	0	1	23	2773431	2773453
43	23	23	46.1	100.000	23	0.022	0	0	100	100	Edwardsiella hoshinae strain ATCC 35051, complete genome	Edwardsiella hoshinae	0	1	23	683955	683977
43	23	23	46.1	100.000	23	0.022	0	0	100	100	Pasteurella canis strain HL_NV12211 chromosome, complete genome	Pasteurella canis	0	1	23	2005231	2005253
43	23	23	46.1	100.000	23	0.022	0	0	100	100	Pasteurella canis strain HL_D3081 chromosome, complete genome	Pasteurella canis	0	1	23	2059917	2059939
43	23	23	46.1	100.000	23	0.022	0	0	100	100	Pasteurella canis strain HL_D1250 chromosome, complete genome	Pasteurella canis	0	1	23	2085753	2085775
43	23	23	46.1	100.000	23	0.022	0	0	100	100	Pasteurella canis strain HL1500 chromosome, complete genome	Pasteurella canis	0	1	23	1974620	1974642
43	23	23	46.1	100.000	23	0.022	0	0	100	100	Pasteurella canis strain HL268 chromosome, complete genome	Pasteurella canis	0	1	23	2087798	2087820
43	23	23	46.1	100.000	23	0.022	0	0	100	100	Pectobacterium atrosepticum strain Green1 chromosome, complete genome	Pectobacterium atrosepticum	0	1	23	1181143	1181165
43	23	23	46.1	100.000	23	0.022	0	0	100	100	Aspergillus flavus NRRL3357 uncharacterized protein (G4B84_011672), partial mRNA	Aspergillus flavus NRRL3357	0	1	23	559	581
44	23	23	46.1	100.000	23	0.022	0	0	100	100	PREDICTED: Pantherophis guttatus alanyl-tRNA synthetase 1 (AARS1), transcript variant X2, mRNA	Pantherophis guttatus	0	1	23	412	434
44	23	23	46.1	100.000	23	0.022	0	0	100	100	PREDICTED: Pantherophis guttatus alanyl-tRNA synthetase 1 (AARS1), transcript variant X1, mRNA	Pantherophis guttatus	0	1	23	431	453
44	23	23	46.1	100.000	23	0.022	0	0	100	100	PREDICTED: Thamnophis elegans alanyl-tRNA synthetase 1 (AARS1), mRNA	Thamnophis elegans	0	1	23	401	423
44	23	23	46.1	100.000	23	0.022	0	0	100	100	PREDICTED: Thamnophis sirtalis alanine--tRNA ligase, cytoplasmic-like (LOC106552878), partial mRNA	Thamnophis sirtalis	0	1	23	277	299
44	20	20	40.1	100.000	20	1.3	0	0	87	87	PREDICTED: Lontra canadensis alanyl-tRNA synthetase 1 (AARS1), mRNA	Lontra canadensis	0	4	23	247	266
44	20	20	40.1	100.000	20	1.3	0	0	87	87	PREDICTED: Scleropages formosus alanyl-tRNA synthetase (aars), mRNA	Scleropages formosus	0	4	23	807	826
44	20	20	40.1	100.000	20	1.3	0	0	87	87	Lasiopogon anaphlecter voucher UMMZ:TAM-871-1 alanyl-tRNA synthetase (AATS) gene, partial cds	Lasiopogon anaphlecter	0	4	23	77	96
44	20	20	40.1	100.000	20	1.3	0	0	87	87	Lasiopogon sierra voucher UMMZ:TAM-437-1 alanyl-tRNA synthetase (AATS) gene, partial cds	Lasiopogon sierra	0	4	23	77	96
44	20	20	40.1	100.000	20	1.3	0	0	87	87	Lasiopogon actius voucher UMMZ:TAM-331-2 alanyl-tRNA synthetase (AATS) gene, partial cds	Lasiopogon actius	0	4	23	77	96
44	20	20	40.1	100.000	20	1.3	0	0	87	87	Lasiopogon sierra voucher UMMZ:TAM-322-3 alanyl-tRNA synthetase (AATS) gene, partial cds	Lasiopogon sierra	0	4	23	77	96
45	23	23	46.1	100.000	23	0.022	0	0	100	100	Erythrobacter mangrovi strain EB310 chromosome, complete genome	Erythrobacter mangrovi	0	1	23	2181520	2181498
45	23	23	46.1	100.000	23	0.022	0	0	100	100	PREDICTED: Drosophila sechellia alanine--tRNA ligase, cytoplasmic (LOC6611673), transcript variant X2, mRNA	Drosophila sechellia	0	1	23	254	276
45	23	23	46.1	100.000	23	0.022	0	0	100	100	PREDICTED: Drosophila sechellia alanine--tRNA ligase, cytoplasmic (LOC6611673), transcript variant X1, mRNA	Drosophila sechellia	0	1	23	333	355
45	23	23	46.1	100.000	23	0.022	0	0	100	100	Ralstonia mannitolilytica strain Guangzhou-RMAB10 chromosome 1	Ralstonia mannitolilytica	0	1	23	741162	741184
45	23	23	46.1	100.000	23	0.022	0	0	100	100	Syntrophotalea acetylenica strain DSM 3246 chromosome, complete genome	Syntrophotalea acetylenica	0	1	23	712200	712178
45	23	23	46.1	100.000	23	0.022	0	0	100	100	Pelobacter acetylenicus strain DSM 3247 genome	Syntrophotalea acetylenica	0	1	23	2014669	2014647
45	23	23	46.1	100.000	23	0.022	0	0	100	100	Labrenzia sp. CP4, complete genome	Labrenzia sp. CP4	0	1	23	2332151	2332173
45	23	23	46.1	100.000	23	0.022	0	0	100	100	Ralstonia mannitolilytica strain SN82F48 chromosome 1, complete sequence	Ralstonia mannitolilytica	0	1	23	1808765	1808787
45	23	23	46.1	100.000	23	0.022	0	0	100	100	Bradyrhizobium sp. C-145 chromosome, complete genome	Bradyrhizobium sp. C-145	0	1	23	5596372	5596350
45	23	23	46.1	100.000	23	0.022	0	0	100	100	Roseivivax marinus strain TCYB24 chromosome, complete genome	Roseivivax marinus	0	1	23	2183200	2183222
46	23	23	46.1	100.000	23	0.022	0	0	100	100	Helicobacter winghamensis strain 2015D-0170 chromosome, complete genome	Helicobacter winghamensis	0	1	23	743292	743314
46	20	20	40.1	100.000	20	1.3	0	0	87	87	Bartonella bacilliformis strain KC584 chromosome, complete genome	Bartonella bacilliformis	0	4	23	697434	697453
46	20	20	40.1	100.000	20	1.3	0	0	87	87	Candidatus Cytomitobacter indipagum isolate 1605 chromosome	Candidatus Cytomitobacter indipagum	0	4	23	176255	176274
46	20	20	40.1	100.000	20	1.3	0	0	87	87	Bartonella bacilliformis strain ATCC 35685D-5, complete genome	Bartonella bacilliformis	0	4	23	772401	772420
46	20	20	40.1	100.000	20	1.3	0	0	87	87	Methylophilales bacterium MBRSF5 genome	Methylophilales bacterium MBRSF5	0	4	23	968787	968806
46	20	20	40.1	100.000	20	1.3	0	0	87	87	Campylobacter sp. RM12651 chromosome, complete genome	Campylobacter sp. RM12651	0	4	23	706904	706923
46	20	20	40.1	100.000	20	1.3	0	0	87	87	Aspergillus chevalieri alanine--tRNA ligase (ALA1), partial mRNA	Aspergillus chevalieri	0	4	23	247	266
46	20	20	40.1	100.000	20	1.3	0	0	87	87	Aspergillus puulaauensis alanine--tRNA ligase (ALA1), partial mRNA	Aspergillus puulaauensis	0	4	23	250	269
46	20	20	40.1	100.000	20	1.3	0	0	87	87	Brettanomyces bruxellensis Alanine--tRNA ligase (ALA1), partial mRNA	Brettanomyces bruxellensis	0	4	23	280	299
46	20	20	40.1	100.000	20	1.3	0	0	87	87	Aspergillus versicolor CBS 583.65 uncharacterized protein (ASPVEDRAFT_49674), partial mRNA	Aspergillus versicolor CBS 583.65	0	4	23	250	269
47	23	23	46.1	100.000	23	0.022	0	0	100	100	Uncultured Gammaproteobacteria bacterium clone uvDeep-PR2-KM13-C171 genomic sequence	uncultured Gammaproteobacteria bacterium	0	1	23	32868	32890
47	22	22	44.1	100.000	22	0.086	0	0	96	96	Telmatherina bonti genome assembly, chromosome: 6	Telmatherina bonti	0	2	23	15664307	15664328
47	22	22	44.1	100.000	22	0.086	0	0	96	96	Eulithis prunata genome assembly, chromosome: 1	Eulithis prunata	0	2	23	5063847	5063868
47	22	22	44.1	100.000	22	0.086	0	0	96	96	Mimas tiliae genome assembly, chromosome: 3	Mimas tiliae	0	2	23	11758104	11758083
47	22	22	44.1	100.000	22	0.086	0	0	96	96	Lymantria monacha genome assembly, chromosome: 3	Lymantria monacha	0	2	23	21043769	21043748
47	20	20	40.1	100.000	20	1.3	0	0	87	87	Phallusia mammillata mRNA for alanine--tRNA ligase, mitochondrial-like (Fars2-001 gene)	Phallusia mammillata	0	4	23	409	428
47	20	20	40.1	100.000	20	1.3	0	0	87	87	Canis lupus familiaris breed Labrador retriever chromosome 12a	Canis lupus familiaris	0	4	23	22367590	22367571
47	20	20	40.1	100.000	20	1.3	0	0	87	87	Canis lupus familiaris breed Labrador retriever chromosome 12b	Canis lupus familiaris	0	4	23	22377635	22377616
47	20	20	40.1	100.000	20	1.3	0	0	87	87	Aquila chrysaetos chrysaetos genome assembly, chromosome: 9	Aquila chrysaetos chrysaetos	0	3	22	44624296	44624315
47	20	20	40.1	100.000	20	1.3	0	0	87	87	Shewanella polaris strain SM1901 chromosome, complete genome	Shewanella polaris	0	4	23	99237	99256
48	23	23	46.1	100.000	23	0.022	0	0	100	100	Vavraia culicis subsp. floridensis alanine-tRNA ligase partial mRNA	Vavraia culicis subsp. floridensis	0	1	23	220	242
48	20	20	40.1	100.000	20	1.3	0	0	87	87	Serratia liquefaciens strain S1 chromosome, complete genome	Serratia liquefaciens	0	4	23	812877	812896
48	20	20	40.1	100.000	20	1.3	0	0	87	87	Helicobacter pylori strain GCT 27 chromosome, complete genome	Helicobacter pylori	0	4	23	790226	790245
48	20	20	40.1	100.000	20	1.3	0	0	87	87	Serratia liquefaciens strain JL02 chromosome, complete genome	Serratia liquefaciens	0	4	23	794815	794834
48	20	20	40.1	100.000	20	1.3	0	0	87	87	Helicobacter pylori strain G-Mx-2006-583 chromosome	Helicobacter pylori	0	4	23	589650	589669
48	20	20	40.1	100.000	20	1.3	0	0	87	87	Helicobacter pylori strain C-Mx-2010-97 chromosome	Helicobacter pylori	0	4	23	386219	386200
48	20	20	40.1	100.000	20	1.3	0	0	87	87	Serratia liquefaciens strain FG3 chromosome, complete genome	Serratia liquefaciens	0	4	23	3870538	3870519
48	20	20	40.1	100.000	20	1.3	0	0	87	87	Citrobacter rodentium strain DBS100 chromosome, complete genome	Citrobacter rodentium	0	4	23	2493849	2493868
