0	21	21	42.1	100.000	21	0.34	0	0	100	100	Phenacogaster calverti voucher MCP 30683, caixa VI-40 recombination activating protein 2 (RAG2) gene, partial cds	Phenacogaster calverti	0	1	21	14	34
0	21	21	42.1	100.000	21	0.34	0	0	100	100	Rachoviscus crassiceps voucher UFRGS 9356, Tec 102 recombination activating protein 2 (RAG2) gene, partial cds	Rachoviscus crassiceps	0	1	21	2	22
0	21	21	42.1	100.000	21	0.34	0	0	100	100	Prochilodus lineatus recombination activating gene 2 (RAG2) gene, partial cds	Prochilodus lineatus	0	1	21	17	37
0	21	21	42.1	100.000	21	0.34	0	0	100	100	Mimagoniates lateralis voucher AMNH233402 recombination activating gene 2 (RAG2) gene, partial cds	Mimagoniates lateralis	0	1	21	17	37
0	21	21	42.1	100.000	21	0.34	0	0	100	100	Hemigrammus rodwayi voucher AMNH233397 recombination activating gene 2 (RAG2) gene, partial cds	Hemigrammus rodwayi	0	1	21	3	23
0	21	21	42.1	100.000	21	0.34	0	0	100	100	Hyphessobrycon eques voucher AMNH233428 recombination activating gene 2 (RAG2) gene, partial cds	Hyphessobrycon eques	0	1	21	11	31
0	21	21	42.1	100.000	21	0.34	0	0	100	100	Astyanacinus sp. DC-2004 voucher AMNH233243 recombination activating gene 2 (RAG2) gene, partial cds	Astyanacinus sp. DC-2004	0	1	21	11	31
0	21	21	42.1	100.000	21	0.34	0	0	100	100	Bryconops sp. DC-2004 recombination activating gene 2 (RAG2) gene, partial cds	Bryconops sp. DC-2004	0	1	21	14	34
0	21	21	42.1	100.000	21	0.34	0	0	100	100	Brycon hilarii recombination activating gene 2 (RAG2) gene, partial cds	Brycon hilarii	0	1	21	14	34
0	21	21	42.1	100.000	21	0.34	0	0	100	100	Astyanax bimaculatus RAG2 gene, partial sequence	Astyanax bimaculatus	0	1	21	17	37
1	21	21	42.1	100.000	21	0.34	0	0	100	100	PREDICTED: Pangasianodon hypophthalmus recombination activating gene 2 (rag2), transcript variant X3, mRNA	Pangasianodon hypophthalmus	0	1	21	257	277
1	21	21	42.1	100.000	21	0.34	0	0	100	100	PREDICTED: Pangasianodon hypophthalmus recombination activating gene 2 (rag2), transcript variant X2, mRNA	Pangasianodon hypophthalmus	0	1	21	268	288
1	21	21	42.1	100.000	21	0.34	0	0	100	100	PREDICTED: Pangasianodon hypophthalmus recombination activating gene 2 (rag2), transcript variant X1, mRNA	Pangasianodon hypophthalmus	0	1	21	355	375
1	21	21	42.1	100.000	21	0.34	0	0	100	100	PREDICTED: Astyanax mexicanus recombination activating 2 (rag2), mRNA	Astyanax mexicanus	0	1	21	682	702
1	21	21	42.1	100.000	21	0.34	0	0	100	100	PREDICTED: Ictalurus punctatus recombination activating gene 2 (rag2), mRNA	Ictalurus punctatus	0	1	21	330	350
1	21	21	42.1	100.000	21	0.34	0	0	100	100	PREDICTED: Silurus meridionalis recombination activating gene 2 (rag2), mRNA	Silurus meridionalis	0	1	21	532	552
1	21	21	42.1	100.000	21	0.34	0	0	100	100	Hoplias malabaricus isolate EE67RAG2 recombination activating protein 2 (RAG2) gene, partial cds	Hoplias malabaricus	0	1	21	28	48
1	21	21	42.1	100.000	21	0.34	0	0	100	100	Hoplias malabaricus isolate OH03 recombination activating protein 2 (RAG2) gene, partial cds	Hoplias malabaricus	0	1	21	28	48
1	21	21	42.1	100.000	21	0.34	0	0	100	100	Hoplias malabaricus isolate JD546 recombination activating protein 2 (RAG2) gene, partial cds	Hoplias malabaricus	0	1	21	28	48
1	21	21	42.1	100.000	21	0.34	0	0	100	100	Hoplias malabaricus isolate SA35RAG2 recombination activating protein 2 (RAG2) gene, partial cds	Hoplias malabaricus	0	1	21	34	54
