15	19	19	38.2	100.000	19	5.3	0	0	90	90	Hafnia sp. CBA7124 DNA, complete genome	Hafnia sp. CBA7124	0	2	20	2941622	2941604
15	19	19	38.2	100.000	19	5.3	0	0	90	90	Hafnia sp. CBA7124 DNA, complete genome	Hafnia sp. CBA7124	0	2	20	2941718	2941700
15	19	19	38.2	100.000	19	5.3	0	0	90	90	Hafnia alvei strain HUMV-5920, complete genome	Hafnia alvei	0	2	20	2308276	2308294
15	19	19	38.2	100.000	19	5.3	0	0	90	90	Hedya salicella genome assembly, chromosome: 14	Hedya salicella	0	3	21	4809965	4809983
15	18	18	36.2	100.000	18	21	0	0	86	86	Acinetobacter indicus strain TQ04 chromosome, complete genome	Acinetobacter indicus	0	1	18	801529	801512
15	18	18	36.2	100.000	18	21	0	0	86	86	PREDICTED: Myripristis murdjan protein canopy homolog 2-like (LOC115358858), transcript variant X2, mRNA	Myripristis murdjan	0	1	18	2479	2462
15	18	18	36.2	100.000	18	21	0	0	86	86	PREDICTED: Myripristis murdjan protein canopy homolog 2-like (LOC115358858), transcript variant X1, mRNA	Myripristis murdjan	0	1	18	2453	2436
15	18	18	36.2	100.000	18	21	0	0	86	86	Myripristis murdjan genome assembly, chromosome: 5	Myripristis murdjan	0	1	18	21514831	21514814
16	21	21	42.1	100.000	21	0.34	0	0	100	100	Wolbachia endosymbiont of Oedothorax gibbosus strain wOegibbosus-W744x776B genome assembly, chromosome: 1	Wolbachia endosymbiont of Oedothorax gibbosus	0	1	21	455233	455213
16	21	21	42.1	100.000	21	0.34	0	0	100	100	PREDICTED: Vollenhovia emeryi glutamyl-tRNA(Gln) amidotransferase subunit B, mitochondrial-like (LOC105558472), mRNA	Vollenhovia emeryi	0	1	21	421	441
16	20	20	40.1	100.000	20	1.3	0	0	95	95	Pedobacter sp. SW-16 chromosome, complete genome	Pedobacter riviphilus	0	1	20	2341657	2341638
16	19	19	38.2	100.000	19	5.3	0	0	90	90	PREDICTED: Choloepus didactylus HECT, C2 and WW domain containing E3 ubiquitin protein ligase 2 (HECW2), transcript variant X5, mRNA	Choloepus didactylus	0	1	19	7806	7824
16	19	19	38.2	100.000	19	5.3	0	0	90	90	PREDICTED: Choloepus didactylus HECT, C2 and WW domain containing E3 ubiquitin protein ligase 2 (HECW2), transcript variant X4, mRNA	Choloepus didactylus	0	1	19	7944	7962
16	19	19	38.2	100.000	19	5.3	0	0	90	90	PREDICTED: Choloepus didactylus HECT, C2 and WW domain containing E3 ubiquitin protein ligase 2 (HECW2), transcript variant X3, mRNA	Choloepus didactylus	0	1	19	7980	7998
16	19	19	38.2	100.000	19	5.3	0	0	90	90	PREDICTED: Choloepus didactylus HECT, C2 and WW domain containing E3 ubiquitin protein ligase 2 (HECW2), transcript variant X2, mRNA	Choloepus didactylus	0	1	19	7840	7858
16	19	19	38.2	100.000	19	5.3	0	0	90	90	PREDICTED: Choloepus didactylus HECT, C2 and WW domain containing E3 ubiquitin protein ligase 2 (HECW2), transcript variant X1, mRNA	Choloepus didactylus	0	1	19	8046	8064
16	18	18	36.2	100.000	18	21	0	0	86	86	Capnocytophaga endodontalis strain ChDC OS43 chromosome, complete genome	Capnocytophaga endodontalis	0	3	20	2928328	2928311
16	18	18	36.2	100.000	18	21	0	0	86	86	Vigna angularis var. angularis DNA, chromosome 5, almost complete sequence, cultivar: Shumari	Vigna angularis var. angularis	0	4	21	1908577	1908560
17	21	21	42.1	100.000	21	0.34	0	0	100	100	Wolbachia endosymbiont of Yamatotettix flavovittatus clone SKM1 aspartyl/glutamyl-tRNA amidotransferase subunit B (gatB) gene, partial cds	Wolbachia endosymbiont of Yamatotettix flavovittatus	0	1	21	1	21
17	20	20	40.1	100.000	20	1.3	0	0	95	95	Sphingobacteriaceae bacterium GW460-11-11-14-LB5, complete genome	Sphingobacteriaceae bacterium GW460-11-11-14-LB5	0	1	20	2285878	2285897
17	19	19	38.2	100.000	19	5.3	0	0	90	90	[Eubacterium] rectale strain VPI 0990 chromosome, complete genome	[Eubacterium] rectale	0	3	21	677459	677477
17	19	19	38.2	100.000	19	5.3	0	0	90	90	Eubacterium rectale DSM 17629 draft genome	[Eubacterium] rectale DSM 17629	0	3	21	371928	371946
17	19	19	38.2	100.000	19	5.3	0	0	90	90	Lachnospiraceae bacterium isolate MGYG-HGUT-02492 genome assembly, chromosome: 1	[Eubacterium] rectale ATCC 33656;Lachnospiraceae bacterium	0	3	21	677460	677478
17	19	19	38.2	100.000	19	5.3	0	0	90	90	Solea senegalensis genome assembly, chromosome: L	Solea senegalensis	0	2	20	25555915	25555897
17	19	19	38.2	100.000	19	5.3	0	0	90	90	Acleris emargana genome assembly, chromosome: 1	Acleris emargana	0	3	21	3447619	3447601
17	19	19	38.2	100.000	19	5.3	0	0	90	90	Eubacterium rectale M104/1 draft genome	[Eubacterium] rectale M104/1	0	3	21	2306175	2306157
17	18	18	36.2	100.000	18	21	0	0	86	86	Sciurus vulgaris genome assembly, chromosome: 14	Sciurus vulgaris	0	3	20	91909950	91909967
17	18	18	36.2	100.000	18	21	0	0	86	86	Chanos chanos genome assembly, chromosome: 14	Chanos chanos	0	1	18	15741845	15741862
18	20	20	40.1	100.000	20	1.3	0	0	95	95	Proteobacteria bacterium isolate PRO20 chromosome	Pseudomonadota bacterium	0	2	21	359053	359034
18	19	19	38.2	100.000	19	5.3	0	0	90	90	Endotricha flammealis genome assembly, chromosome: 4	Endotricha flammealis	0	3	21	4188610	4188592
18	19	19	38.2	100.000	19	5.3	0	0	90	90	PREDICTED: Petromyzon marinus sacsin molecular chaperone (SACS), mRNA	Petromyzon marinus	0	2	20	2216	2234
18	19	19	38.2	100.000	19	5.3	0	0	95	90	Agriotes lineatus genome assembly, chromosome: 10	Agriotes lineatus	0	2	20	43720422	43720440
18	18	18	36.2	100.000	18	21	0	0	95	86	Agriotes lineatus genome assembly, chromosome: 10	Agriotes lineatus	0	2	19	46879402	46879385
18	16	16	32.2	100.000	16	326	0	0	95	76	Agriotes lineatus genome assembly, chromosome: 10	Agriotes lineatus	0	1	16	28735034	28735019
18	16	16	32.2	100.000	16	326	0	0	95	76	Agriotes lineatus genome assembly, chromosome: 10	Agriotes lineatus	0	2	17	18063930	18063945
18	16	16	32.2	100.000	16	326	0	0	95	76	Agriotes lineatus genome assembly, chromosome: 10	Agriotes lineatus	0	1	16	28975457	28975472
18	16	16	32.2	100.000	16	326	0	0	95	76	Agriotes lineatus genome assembly, chromosome: 10	Agriotes lineatus	0	5	20	47993855	47993870
18	18	18	36.2	100.000	18	21	0	0	86	86	Bibersteinia trehalosi USDA-ARS-USMARC-189, complete genome	Bibersteinia trehalosi USDA-ARS-USMARC-189	0	4	21	1058425	1058408
18	18	18	36.2	100.000	18	21	0	0	86	86	Bibersteinia trehalosi USDA-ARS-USMARC-188, complete genome	Bibersteinia trehalosi USDA-ARS-USMARC-188	0	4	21	977883	977866
18	18	18	36.2	100.000	18	21	0	0	86	86	Polynucleobacter sp. JS-JIR-5-A7 chromosome	Polynucleobacter sp. JS-JIR-5-A7	0	1	18	2089333	2089316
18	18	18	36.2	100.000	18	21	0	0	86	86	Hecatera dysodea genome assembly, chromosome: 25	Hecatera dysodea	0	2	19	5569884	5569867
18	18	18	36.2	100.000	18	21	0	0	86	86	Lepeophtheirus salmonis strain IoA-00 genome assembly, chromosome: 2	Lepeophtheirus salmonis	0	4	21	25150305	25150288
18	18	18	36.2	100.000	18	21	0	0	86	86	Lepeophtheirus salmonis strain IoA-00 genome assembly, chromosome: 2	Lepeophtheirus salmonis	0	4	21	25150305	25150288
19	21	21	42.1	100.000	21	0.34	0	0	100	100	Wolbachia endosymbiont of Yamatotettix flavovittatus clone KKM4 aspartyl/glutamyl-tRNA amidotransferase subunit B (gatB) gene, partial cds	Wolbachia endosymbiont of Yamatotettix flavovittatus	0	1	21	1	21
19	18	18	36.2	100.000	18	21	0	0	86	86	Uncultured Wolbachia sp. clone Cameroon glutamyl-tRNA(Gln) amidotransferase subunit B (gatB) gene, partial cds	uncultured Wolbachia sp.	0	4	21	468	451
19	18	18	36.2	100.000	18	21	0	0	86	86	Aspergillus aculeatus ATCC 16872 uncharacterized protein (ASPACDRAFT_39208), partial mRNA	Aspergillus aculeatus ATCC 16872	0	2	19	213	196
19	18	18	36.2	100.000	18	21	0	0	86	86	Limnephilus lunatus genome assembly, chromosome: 10	Limnephilus lunatus	0	3	20	34106200	34106183
19	18	18	36.2	100.000	18	21	0	0	86	86	Wolbachia endosymbiont of Yamatotettix flavovittatus clone KKM1 aspartyl/glutamyl-tRNA amidotransferase subunit B (gatB) gene, partial cds	Wolbachia endosymbiont of Yamatotettix flavovittatus	0	4	21	4	21
19	18	18	36.2	100.000	18	21	0	0	86	86	Wolbachia endosymbiont of Yamatotettix flavovittatus clone KKF1 aspartyl/glutamyl-tRNA amidotransferase subunit B (gatB) gene, partial cds	Wolbachia endosymbiont of Yamatotettix flavovittatus	0	4	21	4	21
19	21	17	34.2	95.238	20	83	0	0	100	100	Wolbachia endosymbiont of Ctenocephalides felis wCfeJ chromosome, complete genome	Wolbachia endosymbiont of Ctenocephalides felis wCfeJ	1	1	21	25880	25860
19	21	17	34.2	95.238	20	83	0	0	100	100	Wolbachia endosymbiont of Brugia pahangi isolate FR3 chromosome, complete genome	Wolbachia endosymbiont of Brugia pahangi	1	1	21	830434	830414
19	17	17	34.2	100.000	17	83	0	0	81	81	Kingella kingae strain ATCC 23331 chromosome, complete genome	Kingella kingae	0	1	17	1580991	1580975
19	17	17	34.2	100.000	17	83	0	0	81	81	Sulfurimonas xiamenensis strain 1-1N chromosome, complete genome	Sulfurimonas xiamenensis	0	1	17	1235189	1235173
20	21	21	42.1	100.000	21	0.34	0	0	100	100	Wolbachia endosymbiont of Yamatotettix flavovittatus clone KKM2 aspartyl/glutamyl-tRNA amidotransferase subunit B (gatB) gene, partial cds	Wolbachia endosymbiont of Yamatotettix flavovittatus	0	1	21	1	21
20	20	20	40.1	100.000	20	1.3	0	0	95	95	Proteus vulgaris strain HH17 chromosome, complete genome	Proteus vulgaris	0	2	21	3423627	3423608
20	19	19	38.2	100.000	19	5.3	0	0	90	90	Proteus vulgaris strain Ld01 chromosome, complete genome	Proteus vulgaris	0	3	21	322106	322088
20	19	19	38.2	100.000	19	5.3	0	0	90	90	Proteus sp. NMG38-2 chromosome, complete genome	Proteus sp. NMG38-2	0	3	21	327976	327958
20	19	19	38.2	100.000	19	5.3	0	0	90	90	Proteus vulgaris strain CCU063 chromosome, complete genome	Proteus vulgaris	0	3	21	321664	321646
20	19	19	38.2	100.000	19	5.3	0	0	90	90	Proteus sp. GOKU chromosome, complete genome	Proteus sp. GOKU	0	3	21	321664	321646
20	18	18	36.2	100.000	18	21	0	0	86	86	Cronobacter sakazakii strain CFSAN068773 chromosome, complete genome	Cronobacter sakazakii	0	2	19	4168658	4168675
20	18	18	36.2	100.000	18	21	0	0	86	86	Cronobacter sakazakii strain CS-09 chromosome, complete genome	Cronobacter sakazakii	0	2	19	1412445	1412462
20	18	18	36.2	100.000	18	21	0	0	86	86	Cupriavidus malaysiensis strain USMAA1020 isolate pure chromosome 2, complete sequence	Cupriavidus malaysiensis	0	1	18	2109871	2109888
20	18	18	36.2	100.000	18	21	0	0	86	86	Cupriavidus sp. USMAA2-4 isolate pure chromosome 2, complete sequence	Cupriavidus sp. USMAA2-4	0	1	18	3398811	3398828
21	21	21	42.1	100.000	21	0.34	0	0	100	100	Wolbachia endosymbiont of Drosophila mauritiana strain wMau chromosome, complete genome	Wolbachia endosymbiont of Drosophila mauritiana	0	1	21	750994	751014
21	21	21	42.1	100.000	21	0.34	0	0	100	100	Wolbachia endosymbiont of Drosophila mauritiana strain wMau chromosome, complete genome	Wolbachia endosymbiont of Drosophila mauritiana	0	1	21	750993	751013
21	21	21	42.1	100.000	21	0.34	0	0	100	100	Wolbachia endosymbiont of Yamatotettix flavovittatus clone KKF3 aspartyl/glutamyl-tRNA amidotransferase subunit B (gatB) gene, partial cds	Wolbachia endosymbiont of Yamatotettix flavovittatus	0	1	21	1	21
21	21	21	42.1	100.000	21	0.34	0	0	100	100	Wolbachia endosymbiont of Yamatotettix flavovittatus clone UDF3 aspartyl/glutamyl-tRNA amidotransferase subunit B (gatB) gene, partial cds	Wolbachia endosymbiont of Yamatotettix flavovittatus	0	1	21	1	21
21	21	21	42.1	100.000	21	0.34	0	0	100	100	Wolbachia pipientis strain wAnM chromosome, complete genome	Wolbachia pipientis	0	1	21	206896	206876
21	21	21	42.1	100.000	21	0.34	0	0	100	100	Wolbachia endosymbiont of Drosophila simulans strain wMa isolate KB154 chromosome	Wolbachia endosymbiont of Drosophila simulans	0	1	21	36311	36291
21	21	21	42.1	100.000	21	0.34	0	0	100	100	Wolbachia endosymbiont of Drosophila simulans wNo, complete genome	Wolbachia endosymbiont of Drosophila simulans wNo	0	1	21	36297	36277
21	20	20	40.1	100.000	20	1.3	0	0	95	95	Mythimna impura genome assembly, chromosome: 15	Mythimna impura	0	2	21	17314750	17314769
21	20	16	32.2	95.000	19	326	0	0	95	95	Mythimna impura genome assembly, chromosome: 15	Mythimna impura	1	2	21	4181772	4181791
21	20	20	40.1	100.000	20	1.3	0	0	95	95	Mythimna impura genome assembly, chromosome: 14	Mythimna impura	0	2	21	14548335	14548354
21	20	20	40.1	100.000	20	1.3	0	0	95	95	Mythimna impura genome assembly, chromosome: 4	Mythimna impura	0	2	21	24005360	24005379
21	20	20	40.1	100.000	20	1.3	0	0	95	95	Mythimna impura genome assembly, chromosome: 4	Mythimna impura	0	2	21	23933354	23933335
22	21	21	42.1	100.000	21	0.34	0	0	100	100	Wolbachia endosymbiont of Ctenocephalides felis wCfeJ chromosome, complete genome	Wolbachia endosymbiont of Ctenocephalides felis wCfeJ	0	1	21	25880	25860
22	21	21	42.1	100.000	21	0.34	0	0	100	100	Wolbachia endosymbiont of Brugia pahangi isolate FR3 chromosome, complete genome	Wolbachia endosymbiont of Brugia pahangi	0	1	21	830434	830414
22	21	21	42.1	100.000	21	0.34	0	0	100	100	Wolbachia pipientis strain wIrr chromosome, complete genome	Wolbachia pipientis	0	1	21	491122	491142
22	21	21	42.1	100.000	21	0.34	0	0	100	100	Wolbachia endosymbiont of Aedes albopictus isolate 14 aspartate/glutamate tRNA aminotransferase B (gatB) gene, partial cds	Wolbachia endosymbiont of Aedes albopictus	0	1	21	35	55
22	21	21	42.1	100.000	21	0.34	0	0	100	100	Wolbachia endosymbiont of Aedes albopictus isolate 11 aspartate/glutamate tRNA aminotransferase B (gatB) gene, partial cds	Wolbachia endosymbiont of Aedes albopictus	0	1	21	27	47
22	21	21	42.1	100.000	21	0.34	0	0	100	100	Wolbachia endosymbiont of Aedes albopictus isolate 10 aspartate/glutamate tRNA aminotransferase B (gatB) gene, partial cds	Wolbachia endosymbiont of Aedes albopictus	0	1	21	30	50
22	21	21	42.1	100.000	21	0.34	0	0	100	100	Wolbachia endosymbiont of Chrysomya megacephala isolate wMeg chromosome, complete genome	Wolbachia endosymbiont of Chrysomya megacephala	0	1	21	955887	955907
22	21	21	42.1	100.000	21	0.34	0	0	100	100	Wolbachia endosymbiont of Drosophila ananassae strain W2.1 chromosome, complete genome	Wolbachia endosymbiont of Drosophila ananassae	0	1	21	106846	106826
22	21	21	42.1	100.000	21	0.34	0	0	100	100	Wolbachia pipientis strain wMel_ZH26 chromosome, complete genome	Wolbachia pipientis	0	1	21	131974	131994
22	21	21	42.1	100.000	21	0.34	0	0	100	100	Wolbachia pipientis strain wMel_I23 chromosome, complete genome	Wolbachia pipientis	0	1	21	131912	131932
23	21	21	42.1	100.000	21	0.34	0	0	100	100	Wolbachia endosymbiont of Bemisia tabaci strain China 1 genome	Wolbachia endosymbiont of Bemisia tabaci	0	1	21	35142	35122
23	21	21	42.1	100.000	21	0.34	0	0	100	100	Wolbachia endosymbiont of Ostrinia scapulalis strain wSca chromosome, complete genome	Wolbachia endosymbiont of Ostrinia scapulalis	0	1	21	650155	650135
23	21	21	42.1	100.000	21	0.34	0	0	100	100	Wolbachia endosymbiont of Anopheles demeilloni isolate wAnD chromosome, complete genome	Wolbachia endosymbiont of Anopheles demeilloni	0	1	21	36999	36979
23	21	21	42.1	100.000	21	0.34	0	0	100	100	Wolbachia endosymbiont of Corcyra cephalonica isolate SYLI2103 chromosome, complete genome	Wolbachia endosymbiont of Corcyra cephalonica	0	1	21	42274	42254
23	21	21	42.1	100.000	21	0.34	0	0	100	100	Wolbachia endosymbiont of Spodoptera picta strain Spic_B chromosome, complete genome	Wolbachia endosymbiont of Spodoptera picta	0	1	21	171509	171489
23	21	21	42.1	100.000	21	0.34	0	0	100	100	Wolbachia endosymbiont of Diaphorina citri isolate dawsonii chromosome, complete genome	Wolbachia endosymbiont of Diaphorina citri	0	1	21	1492828	1492808
23	21	21	42.1	100.000	21	0.34	0	0	100	100	Wolbachia endosymbiont of Diaphorina citri isolate KPSwDI05P26 chromosome	Wolbachia endosymbiont of Diaphorina citri	0	1	21	1040749	1040729
23	21	21	42.1	100.000	21	0.34	0	0	100	100	Uncultured bacterium ARCTIC04_F_10 genomic sequence	uncultured bacterium ARCTIC04_F_10	0	1	21	16383	16363
23	21	21	42.1	100.000	21	0.34	0	0	100	100	Wolbachia endosymbiont of Aedes albopictus isolate 37c aspartate/glutamate tRNA aminotransferase B (gatB) gene, partial cds	Wolbachia endosymbiont of Aedes albopictus	0	1	21	61	81
23	21	21	42.1	100.000	21	0.34	0	0	100	100	Wolbachia endosymbiont of Aedes albopictus isolate 36b aspartate/glutamate tRNA aminotransferase B (gatB) gene, partial cds	Wolbachia endosymbiont of Aedes albopictus	0	1	21	61	81
