0	19	19	38.2	100.000	19	5.3	0	0	100	100	Hydropotes inermis mitochondrion, complete genome	Hydropotes inermis	0	1	19	4123	4105
0	19	19	38.2	100.000	19	5.3	0	0	100	100	Homo sapiens lncAB3.1 lncRNA gene, complete sequence	Homo sapiens	0	1	19	461	443
0	19	19	38.2	100.000	19	5.3	0	0	100	100	Sundamys muelleri voucher MZF1960 mitochondrion, complete genome	Sundamys muelleri	0	1	19	13348	13330
0	19	19	38.2	100.000	19	5.3	0	0	100	100	Canis lupus familiaris breed Labrador retriever chromosome 16a	Canis lupus familiaris	0	1	19	6176701	6176683
0	19	19	38.2	100.000	19	5.3	0	0	100	100	Canis lupus familiaris breed Labrador retriever chromosome 16b	Canis lupus familiaris	0	1	19	6205905	6205887
0	19	19	38.2	100.000	19	5.3	0	0	100	100	PREDICTED: Camelus ferus uncharacterized LOC116661360 (LOC116661360), ncRNA	Camelus ferus	0	1	19	3198	3180
0	19	19	38.2	100.000	19	5.3	0	0	100	100	Sarcophilus harrisii genome assembly, chromosome: X	Sarcophilus harrisii	0	1	19	79453993	79453975
0	19	19	38.2	100.000	19	5.3	0	0	100	100	Sarcophilus harrisii genome assembly, chromosome: X	Sarcophilus harrisii	0	1	19	83032200	83032218
0	18	18	36.2	100.000	18	21	0	0	100	95	Sarcophilus harrisii genome assembly, chromosome: X	Sarcophilus harrisii	0	1	18	43746360	43746343
0	19	19	38.2	100.000	19	5.3	0	0	100	100	PREDICTED: Physeter catodon uncharacterized LOC114487475 (LOC114487475), ncRNA	Physeter catodon	0	1	19	81	63
0	19	19	38.2	100.000	19	5.3	0	0	100	100	Hydrodamalis gigas mitochondrion, complete genome	Hydrodamalis gigas	0	1	19	5953	5935
0	19	19	38.2	100.000	19	5.3	0	0	100	100	Chelonoidis duncanensis isolate G176 mitochondrion, partial genome	Chelonoidis duncanensis	0	1	19	12416	12398
1	19	19	38.2	100.000	19	5.3	0	0	100	100	Bubalus bubalis isolate XL0D mitochondrion, complete genome	Bubalus bubalis	0	1	19	4233	4251
1	19	19	38.2	100.000	19	5.3	0	0	100	100	Bubalus bubalis isolate XL01 mitochondrion, complete genome	Bubalus bubalis	0	1	19	4234	4252
1	19	19	38.2	100.000	19	5.3	0	0	100	100	Bubalus bubalis isolate FZ01 mitochondrion, complete genome	Bubalus bubalis	0	1	19	4233	4251
1	19	19	38.2	100.000	19	5.3	0	0	100	100	Bubalus bubalis isolate FZ09 mitochondrion, complete genome	Bubalus bubalis	0	1	19	4234	4252
1	19	19	38.2	100.000	19	5.3	0	0	100	100	Bubalus bubalis isolate XL08 mitochondrion, complete genome	Bubalus bubalis	0	1	19	4237	4255
1	19	19	38.2	100.000	19	5.3	0	0	100	100	Bubalus bubalis isolate XL09 mitochondrion, complete genome	Bubalus bubalis	0	1	19	4236	4254
1	19	19	38.2	100.000	19	5.3	0	0	100	100	Bubalus bubalis isolate FZ15 mitochondrion, complete genome	Bubalus bubalis	0	1	19	4233	4251
1	19	19	38.2	100.000	19	5.3	0	0	100	100	Bubalus bubalis isolate XL11 mitochondrion, complete genome	Bubalus bubalis	0	1	19	4233	4251
1	19	19	38.2	100.000	19	5.3	0	0	100	100	Bubalus bubalis isolate XL12 mitochondrion, complete genome	Bubalus bubalis	0	1	19	4234	4252
1	19	19	38.2	100.000	19	5.3	0	0	100	100	Bubalus bubalis isolate FZ03 mitochondrion, complete genome	Bubalus bubalis	0	1	19	4234	4252
