0	22	22	44.1	100.000	22	0.086	0	0	100	100	Bemisia tabaci clone MEAM1 mitochondrion, complete genome	Bemisia tabaci	0	1	22	582	603
0	22	22	44.1	100.000	22	0.086	0	0	100	100	Bemisia tabaci mitochondrial COI gene for cytochrome oxidase subunit 1, isolate MEAM1	Bemisia tabaci	0	1	22	582	603
0	22	22	44.1	100.000	22	0.086	0	0	100	100	Bemisia tabaci isolate ws7 cytochrome oxidase subunit I (COI) gene, partial cds; mitochondrial	Bemisia tabaci	0	1	22	496	517
0	22	22	44.1	100.000	22	0.086	0	0	100	100	Bemisia tabaci isolate 153_1 mitochondrion, complete genome	Bemisia tabaci	0	1	22	582	603
0	22	22	44.1	100.000	22	0.086	0	0	100	100	Bemisia tabaci mitochondrion, complete genome	Bemisia tabaci	0	1	22	582	603
0	22	22	44.1	100.000	22	0.086	0	0	100	100	Bemisia tabaci mitochondrion, complete genome	Bemisia tabaci	0	1	22	582	603
0	22	22	44.1	100.000	22	0.086	0	0	100	100	Bemisia tabaci mitochondrion, complete genome	Bemisia tabaci	0	1	22	582	603
0	22	22	44.1	100.000	22	0.086	0	0	100	100	Bemisia tabaci voucher WF21CtMON2 cytochrome c oxidase subunit 1 (COX1) gene, partial cds; mitochondrial	Bemisia tabaci	0	1	22	541	562
0	22	22	44.1	100.000	22	0.086	0	0	100	100	Bemisia tabaci mitochondrion, complete genome	Bemisia tabaci	0	1	22	792	813
0	22	22	44.1	100.000	22	0.086	0	0	100	100	Bemisia tabaci voucher WF36A-A46 cytochrome oxidase subunit 1 (COI) gene, partial cds; mitochondrial	Bemisia tabaci	0	1	22	541	562
1	22	22	44.1	100.000	22	0.086	0	0	100	100	Bemisia tabaci clone SUDS mitochondrion, complete genome	Bemisia tabaci	0	1	22	582	603
1	22	22	44.1	100.000	22	0.086	0	0	100	100	Bemisia tabaci isolate VN12-DAKNONG cytochrome oxidase subunit 1 (CO1) gene, partial cds; mitochondrial	Bemisia tabaci	0	1	22	541	562
1	22	22	44.1	100.000	22	0.086	0	0	100	100	Bemisia tabaci isolate VN09-BAVI cytochrome oxidase subunit 1 (CO1) gene, partial cds; mitochondrial	Bemisia tabaci	0	1	22	541	562
1	22	22	44.1	100.000	22	0.086	0	0	100	100	Bemisia tabaci isolate VN06-HUNGYEN cytochrome oxidase subunit 1 (CO1) gene, partial cds; mitochondrial	Bemisia tabaci	0	1	22	541	562
1	22	22	44.1	100.000	22	0.086	0	0	100	100	Bemisia tabaci strain MED Q1 mitochondrion, complete genome	Bemisia tabaci	0	1	22	582	603
1	22	22	44.1	100.000	22	0.086	0	0	100	100	PREDICTED: Takifugu rubripes thyroid hormone receptor interactor 11 (trip11), mRNA	Takifugu rubripes	0	1	22	1568	1547
1	22	22	44.1	100.000	22	0.086	0	0	100	100	Bemisia tabaci isolate JQC107-11 cytochrome oxidase subunit I (COI) gene, partial cds; mitochondrial	Bemisia tabaci	0	1	22	507	528
1	22	22	44.1	100.000	22	0.086	0	0	100	100	Bemisia tabaci isolate JQC107-10 cytochrome oxidase subunit I (COI) gene, partial cds; mitochondrial	Bemisia tabaci	0	1	22	507	528
1	22	22	44.1	100.000	22	0.086	0	0	100	100	Bemisia tabaci isolate JQC107-9 cytochrome oxidase subunit I (COI) gene, partial cds; mitochondrial	Bemisia tabaci	0	1	22	507	528
1	22	22	44.1	100.000	22	0.086	0	0	100	100	Bemisia tabaci isolate JQC107-8 cytochrome oxidase subunit I (COI) gene, partial cds; mitochondrial	Bemisia tabaci	0	1	22	507	528
