0	26	26	52.0	100.000	26	8.78e-04	0	0	100	100	Pnoepyga pusilla voucher SR-2013-177 cytochrome oxidase subunit 1 (COI) gene, partial cds; mitochondrial	Pnoepyga pusilla	0	1	26	483	458
0	26	26	52.0	100.000	26	8.78e-04	0	0	100	100	Pnoepyga pusilla voucher MAR716 cytochrome oxidase subunit 1 (COI) gene, partial cds; mitochondrial	Pnoepyga pusilla	0	1	26	483	458
0	26	26	52.0	100.000	26	8.78e-04	0	0	100	100	Pnoepyga immaculata voucher MAR90124 cytochrome oxidase subunit 1 (COI) gene, partial cds; mitochondrial	Pnoepyga immaculata	0	1	26	483	458
0	26	26	52.0	100.000	26	8.78e-04	0	0	100	100	Pnoepyga immaculata voucher MAR90181 cytochrome oxidase subunit 1 (COI) gene, partial cds; mitochondrial	Pnoepyga immaculata	0	1	26	483	458
0	26	26	52.0	100.000	26	8.78e-04	0	0	100	100	Pnoepyga immaculata voucher MAR90110 cytochrome oxidase subunit 1 (COI) gene, partial cds; mitochondrial	Pnoepyga immaculata	0	1	26	483	458
0	26	26	52.0	100.000	26	8.78e-04	0	0	100	100	Harpyionycteris whiteheadi voucher FMNH 147007 cytochrome oxidase subunit 1 (COI) gene, partial cds; mitochondrial	Harpyionycteris whiteheadi	0	1	26	395	370
0	26	26	52.0	100.000	26	8.78e-04	0	0	100	100	Harpyionycteris whiteheadi voucher FMNH 146645 cytochrome oxidase subunit 1 (COI) gene, partial cds; mitochondrial	Harpyionycteris whiteheadi	0	1	26	443	418
0	26	26	52.0	100.000	26	8.78e-04	0	0	100	100	Harpyionycteris whiteheadi voucher FMNH 147011 cytochrome oxidase subunit 1 (COI) gene, partial cds; mitochondrial	Harpyionycteris whiteheadi	0	1	26	429	404
0	26	26	52.0	100.000	26	8.78e-04	0	0	100	100	Accipiter badius voucher KU295 cytochrome oxidase subunit 1 (COI) gene, partial cds; mitochondrial	Accipiter badius	0	1	26	483	458
0	26	26	52.0	100.000	26	8.78e-04	0	0	100	100	Pnoepyga pusilla pusilla voucher NRM 20086724 cytochrome oxidase subunit 1 gene, partial cds; mitochondrial	Pnoepyga pusilla pusilla	0	1	26	461	436
1	26	26	52.0	100.000	26	8.78e-04	0	0	100	100	Acanthochromis polyacanthus mitochondrion, complete genome	Acanthochromis polyacanthus	0	1	26	5098	5073
1	26	26	52.0	100.000	26	8.78e-04	0	0	100	100	Rousettus obliviosus voucher FMNH-220042 mitochondrion, complete genome	Rousettus obliviosus	0	1	26	5879	5854
1	26	26	52.0	100.000	26	8.78e-04	0	0	100	100	Rousettus obliviosus voucher FMNH-220017 mitochondrion, complete genome	Rousettus obliviosus	0	1	26	5879	5854
1	26	26	52.0	100.000	26	8.78e-04	0	0	100	100	Rousettus madagascariensis voucher UADBA-43762 mitochondrion, complete genome	Rousettus madagascariensis	0	1	26	5881	5856
1	26	26	52.0	100.000	26	8.78e-04	0	0	100	100	Rousettus madagascariensis voucher UADBA-43761 mitochondrion, complete genome	Rousettus madagascariensis	0	1	26	5881	5856
1	26	26	52.0	100.000	26	8.78e-04	0	0	100	100	Myonycteris torquata isolate 1732 mitochondrion, complete genome	Myonycteris torquata	0	1	26	5873	5848
1	26	26	52.0	100.000	26	8.78e-04	0	0	100	100	Myonycteris leptodon isolate G0944 mitochondrion, complete genome	Myonycteris leptodon	0	1	26	5873	5848
1	26	26	52.0	100.000	26	8.78e-04	0	0	100	100	Myonycteris brachycephala mitochondrion, partial genome	Myonycteris brachycephala	0	1	26	5873	5848
1	26	26	52.0	100.000	26	8.78e-04	0	0	100	100	Myonycteris angolensis voucher MNHN-ZM-2011-806 mitochondrion, complete genome	Lissonycteris angolensis	0	1	26	5871	5846
1	26	26	52.0	100.000	26	8.78e-04	0	0	100	100	Myonycteris angolensis isolate G0935 mitochondrion, complete genome	Lissonycteris angolensis	0	1	26	5871	5846
