0	23	23	46.1	100.000	23	0.022	0	0	100	100	Hyla eximia isolate E_PM-14 rhodopsin (rho) gene, partial cds	Dryophytes eximius	0	1	23	284	262
0	23	23	46.1	100.000	23	0.022	0	0	100	100	Polypedates impresus voucher BN2018130 rhodopsin gene, partial cds	Polypedates impresus	0	1	23	360	338
0	23	23	46.1	100.000	23	0.022	0	0	100	100	Polypedates impresus voucher BN2018016 rhodopsin gene, partial cds	Polypedates impresus	0	1	23	357	335
0	23	23	46.1	100.000	23	0.022	0	0	100	100	Polypedates megacephalus voucher HK20181012 rhodopsin gene, partial cds	Polypedates megacephalus	0	1	23	358	336
0	23	23	46.1	100.000	23	0.022	0	0	100	100	Polypedates braueri voucher LABYN2018026 rhodopsin gene, partial cds	Polypedates braueri	0	1	23	358	336
0	23	23	46.1	100.000	23	0.022	0	0	100	100	Polypedates leucomystax voucher M20190701 rhodopsin gene, partial cds	Polypedates leucomystax	0	1	23	364	342
0	23	23	46.1	100.000	23	0.022	0	0	100	100	Polypedates megacephalus voucher VN2018026 rhodopsin gene, partial cds	Polypedates megacephalus	0	1	23	358	336
0	23	23	46.1	100.000	23	0.022	0	0	100	100	Polypedates mutus voucher VN2018037 rhodopsin gene, partial cds	Polypedates mutus	0	1	23	363	341
0	23	23	46.1	100.000	23	0.022	0	0	100	100	Polypedates megacephalus voucher VN2018059 rhodopsin gene, partial cds	Polypedates megacephalus	0	1	23	365	343
0	23	23	46.1	100.000	23	0.022	0	0	100	100	Polypedates braueri voucher YN2018051 rhodopsin gene, partial cds	Polypedates braueri	0	1	23	375	353
0	20	16	32.2	95.000	19	326	0	0	100	87	Polypedates braueri voucher YN2018051 rhodopsin gene, partial cds	Polypedates braueri	1	4	23	1	20
1	23	23	46.1	100.000	23	0.022	0	0	100	100	Hyla eximia isolate E_PM-01 rhodopsin (rho) gene, partial cds	Dryophytes eximius	0	1	23	284	262
1	22	22	44.1	100.000	22	0.086	0	0	96	96	Hyla eximia isolate E_VJ-03 rhodopsin (rho) gene, partial cds	Dryophytes eximius	0	1	22	284	263
1	22	22	44.1	100.000	22	0.086	0	0	96	96	Hyla eximia isolate E_SR-18 rhodopsin (rho) gene, partial cds	Dryophytes eximius	0	1	22	284	263
1	22	22	44.1	100.000	22	0.086	0	0	96	96	Hyla eximia isolate E_SE-18 rhodopsin (rho) gene, partial cds	Dryophytes eximius	0	1	22	284	263
1	22	22	44.1	100.000	22	0.086	0	0	96	96	Hyla eximia isolate E_SE-05 rhodopsin (rho) gene, partial cds	Dryophytes eximius	0	1	22	284	263
1	22	22	44.1	100.000	22	0.086	0	0	96	96	Hyla eximia isolate E_L-20 rhodopsin (rho) gene, partial cds	Dryophytes eximius	0	1	22	284	263
1	21	21	42.1	100.000	21	0.34	0	0	91	91	Kaistella carnis strain G0081 chromosome, complete genome	Kaistella carnis	0	3	23	1704604	1704624
1	19	19	38.2	100.000	19	5.3	0	0	83	83	Elacatinus puncticulatus voucher UMSNH/ADN 50706B rhodopsin (RHO) gene, partial cds	Elacatinus puncticulatus	0	4	22	225	207
1	19	19	38.2	100.000	19	5.3	0	0	83	83	Elacatinus puncticulatus voucher UMSNH/ADN 50706 rhodopsin (RHO) gene, partial cds	Elacatinus puncticulatus	0	4	22	225	207
1	19	19	38.2	100.000	19	5.3	0	0	83	83	Elacatinus puncticulatus voucher UMSNH/ADN 50705B rhodopsin (RHO) gene, partial cds	Elacatinus puncticulatus	0	4	22	225	207
2	23	23	46.1	100.000	23	0.022	0	0	100	100	PREDICTED: Nanorana parkeri rhodopsin (RHO), mRNA	Nanorana parkeri	0	1	23	526	504
2	23	23	46.1	100.000	23	0.022	0	0	100	100	Ghatixalus variabilis isolate GVRH03 rhodopsin gene, partial cds	Ghatixalus variabilis	0	1	23	355	333
2	23	23	46.1	100.000	23	0.022	0	0	100	100	Ghatixalus asterops isolate GARH03 rhodopsin gene, partial cds	Ghatixalus asterops	0	1	23	355	333
2	23	23	46.1	100.000	23	0.022	0	0	100	100	Ghatixalus magnus isolate GMRH05 rhodopsin gene, partial cds	Ghatixalus magnus	0	1	23	355	333
2	23	23	46.1	100.000	23	0.022	0	0	100	100	Lithobates sphenocephalus rhodopsin (RH1) mRNA, partial cds	Lithobates sphenocephalus	0	1	23	121	99
2	23	23	46.1	100.000	23	0.022	0	0	100	100	Lithobates palustris rhodopsin (RH1) mRNA, partial cds	Lithobates palustris	0	1	23	311	289
2	23	23	46.1	100.000	23	0.022	0	0	100	100	Lithobates clamitans rhodopsin (RH1) mRNA, partial cds	Lithobates clamitans	0	1	23	317	295
2	23	23	46.1	100.000	23	0.022	0	0	100	100	Indirana leithii voucher AGCZRL-Amphibia-113 rhodopsin (rho) gene, partial cds	Indirana leithii	0	1	23	299	277
2	23	23	46.1	100.000	23	0.022	0	0	100	100	Craugastor augusti voucher TJD 877 rhodopsin (Rhod) gene, partial cds	Craugastor augusti	0	1	23	350	328
2	23	23	46.1	100.000	23	0.022	0	0	100	100	Craugastor augusti voucher TJD 847 rhodopsin (Rhod) gene, partial cds	Craugastor augusti	0	1	23	350	328
3	23	23	46.1	100.000	23	0.022	0	0	100	100	PREDICTED: Eurypyga helias rhodopsin (RHO), partial mRNA	Eurypyga helias	0	1	23	533	511
3	23	23	46.1	100.000	23	0.022	0	0	100	100	Indirana chiravasi voucher BNHS 5890 rhodopsin (Rho) gene, partial cds	Indirana chiravasi	0	1	23	307	285
3	23	23	46.1	100.000	23	0.022	0	0	100	100	Indirana chiravasi voucher WILD-14-AMP-489 rhodopsin (Rho) gene, partial cds	Indirana chiravasi	0	1	23	307	285
3	23	23	46.1	100.000	23	0.022	0	0	100	100	Incilius nebulifer rhodopsin (RH1) mRNA, partial cds	Incilius nebulifer	0	1	23	312	290
3	23	23	46.1	100.000	23	0.022	0	0	100	100	Indirana leithii voucher WILD-013-AMP-173 rhodopsin (rho) gene, partial cds	Indirana leithii	0	1	23	299	277
3	23	23	46.1	100.000	23	0.022	0	0	100	100	Indirana leithii voucher BNHS5590 rhodopsin (rho) gene, partial cds	Indirana leithii	0	1	23	299	277
3	23	23	46.1	100.000	23	0.022	0	0	100	100	Indirana leithii voucher AGCZRL-Amphibia-199 rhodopsin (rho) gene, partial cds	Indirana leithii	0	1	23	315	293
3	23	23	46.1	100.000	23	0.022	0	0	100	100	Hyla eximia isolate E_MA-02 rhodopsin (rho) gene, partial cds	Dryophytes eximius	0	1	23	284	262
3	23	23	46.1	100.000	23	0.022	0	0	100	100	Amietia sp. VDM-2010 rhodopsin gene, partial cds	Amietia sp. VDM-2010	0	1	23	313	291
3	23	23	46.1	100.000	23	0.022	0	0	100	100	Microbatrachella capensis rhodopsin gene, partial cds	Microbatrachella capensis	0	1	23	332	310
