0	25	25	50.1	100.000	25	0.003	0	0	100	100	Olmecazomus cruzlopezi voucher AMNH-LP14509 cytochrome oxidase subunit I (COI) gene, partial cds; mitochondrial	Olmecazomus cruzlopezi	0	1	25	689	665
0	25	25	50.1	100.000	25	0.003	0	0	100	100	Rasbora pauciperforata mitochondrion, complete genome	Rasbora pauciperforata	0	1	25	6234	6210
0	25	25	50.1	100.000	25	0.003	0	0	100	100	Trogoderma granarium mitochondrial DNA, contig: 140401 T. granarium Contig2	Trogoderma granarium	0	1	25	2374	2350
0	25	25	50.1	100.000	25	0.003	0	0	100	100	Colluricincla harmonica isolate ANWC45534 mitochondrion, complete genome	Colluricincla harmonica	0	1	25	6199	6175
0	25	25	50.1	100.000	25	0.003	0	0	100	100	Ophiosphalma properum isolate BP72 cytochrome oxidase subunit I gene, partial cds; mitochondrial	Ophiosphalma properum	0	1	25	770	746
0	25	25	50.1	100.000	25	0.003	0	0	100	100	Ophiolepis paucispina isolate F193487 cytochrome oxidase subunit I gene, partial cds; mitochondrial	Ophiolepis paucispina	0	1	25	770	746
0	25	25	50.1	100.000	25	0.003	0	0	100	100	Henicorhynchus siamensis mitochondrial DNA, almost complete genome, except for D-loop, specimen_voucher: CBM:ZF:11765	Henicorhynchus siamensis	0	1	25	6260	6236
0	25	25	50.1	100.000	25	0.003	0	0	100	100	Trogoderma granarium isolate SZ147 cytochrome oxidase subunit I (COI) gene, partial cds; mitochondrial	Trogoderma granarium	0	1	25	122	98
0	25	25	50.1	100.000	25	0.003	0	0	100	100	Trogoderma granarium isolate SZ140 cytochrome oxidase subunit I (COI) gene, partial cds; mitochondrial	Trogoderma granarium	0	1	25	50	26
0	25	25	50.1	100.000	25	0.003	0	0	100	100	Carduelis pinus mitochondrion, complete genome	Spinus spinus	0	1	25	7406	7382
1	25	25	50.1	100.000	25	0.003	0	0	100	100	Schizocardium brasiliense mitochondrion, complete genome	Schizocardium brasiliense	0	1	25	10128	10104
1	25	25	50.1	100.000	25	0.003	0	0	100	100	Macronectes giganteus voucher 1B-929 cytochrome oxidase subunit 1 (COI) gene, partial cds; mitochondrial	Macronectes giganteus	0	1	25	773	749
1	25	25	50.1	100.000	25	0.003	0	0	100	100	Spizixos semitorques voucher HS15001 mitochondrion, complete genome	Spizixos semitorques	0	1	25	6183	6159
1	25	25	50.1	100.000	25	0.003	0	0	100	100	Rasbora argyrotaenia mitochondrial DNA, complete genome, isolate: sbr4	Rasbora argyrotaenia	0	1	25	6244	6220
1	25	25	50.1	100.000	25	0.003	0	0	100	100	Spizixos semitorques mitochondrion, complete genome	Spizixos semitorques	0	1	25	6185	6161
1	25	25	50.1	100.000	25	0.003	0	0	100	100	Scolopax rusticola mitochondrion, complete genome	Scolopax rusticola	0	1	25	6174	6150
1	25	25	50.1	100.000	25	0.003	0	0	100	100	Scolopax rusticola cytochrome oxidase subunit 1 (COI) gene, partial cds; mitochondrial	Scolopax rusticola	0	1	25	773	749
1	25	25	50.1	100.000	25	0.003	0	0	100	100	Turdus obscurus mitochondrion, complete genome	Turdus obscurus	0	1	25	6161	6137
1	25	25	50.1	100.000	25	0.003	0	0	100	100	Turdus obscurus mitochondrion, complete genome	Turdus obscurus	0	1	25	6161	6137
1	25	25	50.1	100.000	25	0.003	0	0	100	100	Motacilla flava mitochondrion, complete sequence	Motacilla flava	0	1	25	6171	6147
2	25	25	50.1	100.000	25	0.003	0	0	100	100	Kieneria crissalis voucher MVZ:Bird:177921 cytochrome oxidase subunit 1 gene, partial cds; mitochondrial	Melozone crissalis	0	1	25	617	593
2	25	25	50.1	100.000	25	0.003	0	0	100	100	Melozone biarcuata voucher FMNH 434115 cytochrome oxidase subunit 1 gene, partial cds; mitochondrial	Melozone biarcuata	0	1	25	596	572
2	25	25	50.1	100.000	25	0.003	0	0	100	100	Peucaea ruficauda voucher ROM 160213 cytochrome oxidase subunit 1 gene, partial cds; mitochondrial	Peucaea ruficauda	0	1	25	689	665
2	25	25	50.1	100.000	25	0.003	0	0	100	100	Peucaea ruficauda voucher ROM 160214 cytochrome oxidase subunit 1 gene, partial cds; mitochondrial	Peucaea ruficauda	0	1	25	689	665
2	25	25	50.1	100.000	25	0.003	0	0	100	100	Luscinia svecica isolate DM209 mitochondrion	Luscinia svecica	0	1	25	6171	6147
2	25	25	50.1	100.000	25	0.003	0	0	100	100	Muscicapa sibirica mitochondrion, complete genome	Muscicapa sibirica	0	1	25	6104	6080
2	25	25	50.1	100.000	25	0.003	0	0	100	100	Cuculus canorus mitochondrion, complete genome	Cuculus canorus	0	1	25	6177	6153
2	25	25	50.1	100.000	25	0.003	0	0	100	100	Hydrobates microsoma isolate OmiCOI098IM cytochrome oxidase subunit I (COI) gene, partial cds; mitochondrial	Oceanodroma microsoma	0	1	25	717	693
2	25	25	50.1	100.000	25	0.003	0	0	100	100	Hydrobates microsoma isolate OmiCOI096IM cytochrome oxidase subunit I (COI) gene, partial cds; mitochondrial	Oceanodroma microsoma	0	1	25	717	693
2	25	25	50.1	100.000	25	0.003	0	0	100	100	Hydrobates microsoma isolate OmiCOI094FM cytochrome oxidase subunit I (COI) gene, partial cds; mitochondrial	Oceanodroma microsoma	0	1	25	717	693
3	25	25	50.1	100.000	25	0.003	0	0	100	100	Aimophila rufescens voucher UWBM 93598 cytochrome oxidase subunit 1 gene, partial cds; mitochondrial	Aimophila rufescens	0	1	25	107	83
3	25	25	50.1	100.000	25	0.003	0	0	100	100	Aimophila rufescens voucher FMNH 393869 cytochrome oxidase subunit 1 gene, partial cds; mitochondrial	Aimophila rufescens	0	1	25	29	5
3	25	25	50.1	100.000	25	0.003	0	0	100	100	Peucaea mystacalis voucher MZFC 23289 cytochrome oxidase subunit 1 gene, partial cds; mitochondrial	Peucaea mystacalis	0	1	25	596	572
3	25	25	50.1	100.000	25	0.003	0	0	100	100	Peucaea mystacalis voucher MZFC 12417 cytochrome oxidase subunit 1 gene, partial cds; mitochondrial	Peucaea mystacalis	0	1	25	596	572
3	25	25	50.1	100.000	25	0.003	0	0	100	100	Motacilla tschutschensis mitochondrion, complete genome	Motacilla tschutschensis	0	1	25	7416	7392
3	25	25	50.1	100.000	25	0.003	0	0	100	100	Agapornis lilianae mitochondrion, complete genome	Agapornis lilianae	0	1	25	6126	6102
3	25	25	50.1	100.000	25	0.003	0	0	100	100	Agapornis pullarius mitochondrion, complete genome	Agapornis personatus;Agapornis pullarius	0	1	25	6128	6104
3	25	25	50.1	100.000	25	0.003	0	0	100	100	Agapornis nigrigenis mitochondrion, complete genome	Agapornis nigrigenis	0	1	25	6124	6100
3	25	25	50.1	100.000	25	0.003	0	0	100	100	Cardellina canadensis mitochondrion, complete genome	Cardellina canadensis	0	1	25	6182	6158
3	25	25	50.1	100.000	25	0.003	0	0	100	100	Petronia petronia mitochondrion, complete genome	Petronia petronia	0	1	25	6190	6166
