0	25	25	50.1	100.000	25	0.003	0	0	100	100	Syringa oblata chloroplast, complete genome	Syringa oblata	0	1	25	3195	3171
0	25	25	50.1	100.000	25	0.003	0	0	100	100	Corallorhiza trifida plastid, complete genome	Corallorhiza trifida	0	1	25	2762	2738
0	25	25	50.1	100.000	25	0.003	0	0	100	100	Calypso bulbosa plastid, complete genome	Calypso bulbosa	0	1	25	2910	2886
0	25	25	50.1	100.000	25	0.003	0	0	100	100	Pholidota imbricata chloroplast, complete genome	Coelogyne imbricata	0	1	25	2867	2843
0	25	25	50.1	100.000	25	0.003	0	0	100	100	Litsea cubeba chloroplast, complete genome	Litsea cubeba	0	1	25	3154	3130
0	25	25	50.1	100.000	25	0.003	0	0	100	100	Dendrobium thyrsiflorum chloroplast, complete genome	Dendrobium thyrsiflorum	0	1	25	2810	2786
0	25	25	50.1	100.000	25	0.003	0	0	100	100	Cinnamomum camphora isolate 6c chloroplast, complete genome	Cinnamomum camphora	0	1	25	3257	3233
0	25	25	50.1	100.000	25	0.003	0	0	100	100	Crateva tapia chloroplast, complete genome	Crateva tapia	0	1	25	3014	2990
0	25	25	50.1	100.000	25	0.003	0	0	100	100	Cleomella lutea chloroplast, complete genome	Cleomella lutea	0	1	25	3187	3163
0	25	25	50.1	100.000	25	0.003	0	0	100	100	Syringa reticulata subsp. pekinensis chloroplast, complete genome	Syringa reticulata subsp. pekinensis	0	1	25	3158	3134
1	25	25	50.1	100.000	25	0.003	0	0	100	100	Rosa rugosa chloroplast, complete genome	Rosa rugosa	0	1	25	3104	3080
1	25	25	50.1	100.000	25	0.003	0	0	100	100	Capparis spinosa var. ovata chloroplast, complete genome	Capparis spinosa var. ovata	0	1	25	3175	3151
1	25	25	50.1	100.000	25	0.003	0	0	100	100	Prunus emarginata chloroplast, complete genome	Prunus emarginata	0	1	25	3128	3104
1	25	25	50.1	100.000	25	0.003	0	0	100	100	Malus toringoides chloroplast, complete genome	Malus toringoides	0	1	25	3062	3038
1	25	25	50.1	100.000	25	0.003	0	0	100	100	Prunus rufa voucher 1987.0221 chloroplast, complete genome	Prunus rufa	0	1	25	3071	3047
1	25	25	50.1	100.000	25	0.003	0	0	100	100	Malus toringoides chloroplast, complete genome	Malus toringoides	0	1	25	3066	3042
1	25	25	50.1	100.000	25	0.003	0	0	100	100	Malus sieboldii chloroplast, complete genome	Malus sieboldii	0	1	25	3066	3042
1	25	25	50.1	100.000	25	0.003	0	0	100	100	Malus halliana chloroplast, complete genome	Malus halliana	0	1	25	3122	3098
1	25	25	50.1	100.000	25	0.003	0	0	100	100	Agrimonia pilosa chloroplast, complete genome	Agrimonia pilosa	0	1	25	3030	3006
1	25	25	50.1	100.000	25	0.003	0	0	100	100	Prunus conradinae isolate HFBG chloroplast, complete genome	Prunus conradinae	0	1	25	3067	3043
2	25	25	50.1	100.000	25	0.003	0	0	100	100	Scyphiphora hydrophyllacea chloroplast, complete genome	Scyphiphora hydrophyllacea	0	1	25	3003	2979
2	25	25	50.1	100.000	25	0.003	0	0	100	100	Silvianthus bracteatus chloroplast, complete genome	Silvianthus bracteatus	0	1	25	3199	3175
2	25	25	50.1	100.000	25	0.003	0	0	100	100	Ilex latifolia chloroplast, complete genome	Ilex latifolia	0	1	25	3187	3163
2	25	25	50.1	100.000	25	0.003	0	0	100	100	Silvianthus bracteatus chloroplast, complete genome	Silvianthus bracteatus	0	1	25	3199	3175
2	25	25	50.1	100.000	25	0.003	0	0	100	100	Augusta austrocaledonica chloroplast	Augusta austrocaledonica	0	1	25	20716	20692
2	25	25	50.1	100.000	25	0.003	0	0	100	100	Paragenipa lancifolia chloroplast	Paragenipa lancifolia	0	1	25	2978	2954
2	25	25	50.1	100.000	25	0.003	0	0	100	100	Mitriostigma axillare chloroplast	Mitriostigma axillare	0	1	25	2952	2928
2	25	25	50.1	100.000	25	0.003	0	0	100	100	Stachyarrhena heterochroa chloroplast	Stachyarrhena heterochroa	0	1	25	2943	2919
2	25	25	50.1	100.000	25	0.003	0	0	100	100	Gardenia conferta chloroplast	Gardenia conferta	0	1	25	2957	2933
2	25	25	50.1	100.000	25	0.003	0	0	100	100	Mussaenda densiflora chloroplast	Mussaenda densiflora	0	1	25	2972	2948
3	25	25	50.1	100.000	25	0.003	0	0	100	100	Limonium sinense chloroplast, complete genome	Limonium sinense	0	1	25	4978	4954
3	25	25	50.1	100.000	25	0.003	0	0	100	100	Physalis minima chloroplast, complete genome	Physalis minima	0	1	25	3208	3184
3	25	25	50.1	100.000	25	0.003	0	0	100	100	Physalis pubescens chloroplast, complete genome	Physalis pubescens	0	1	25	3034	3010
3	25	25	50.1	100.000	25	0.003	0	0	100	100	Apocynum venetum chloroplast, complete genome	Apocynum venetum	0	1	25	2951	2927
3	25	25	50.1	100.000	25	0.003	0	0	100	100	Physochlaina physaloides chloroplast, complete genome	Physochlaina physaloides	0	1	25	3115	3091
3	25	25	50.1	100.000	25	0.003	0	0	100	100	Anisodus acutangulus chloroplast, complete genome	Anisodus acutangulus	0	1	25	3139	3115
3	25	25	50.1	100.000	25	0.003	0	0	100	100	Lycium ferocissimum chloroplast, complete genome	Lycium ferocissimum	0	1	25	3163	3139
3	25	25	50.1	100.000	25	0.003	0	0	100	100	Withania somnifera chloroplast, complete genome	Withania somnifera	0	1	25	3140	3116
3	25	25	50.1	100.000	25	0.003	0	0	100	100	Withania coagulans chloroplast, complete genome	Withania coagulans	0	1	25	3137	3113
3	25	25	50.1	100.000	25	0.003	0	0	100	100	Physalis minima chloroplast, complete genome	Physalis minima	0	1	25	3208	3184
